# Host: 192.168.10.175  (Version 5.5.5-10.1.24-MariaDB)
# Date: 2025-08-29 10:42:51
# Generator: MySQL-Front 6.0  (Build 2.20)


#
# Structure for table "control_servicio"
#

CREATE TABLE `control_servicio` (
  `Id` int(11) NOT NULL AUTO_INCREMENT,
  `servicio` varchar(10) NOT NULL DEFAULT '',
  `reporte` char(10) NOT NULL DEFAULT '',
  `contrato` varchar(20) NOT NULL DEFAULT '',
  `orde_compra` varchar(20) NOT NULL DEFAULT '',
  `tipo_servicio` varchar(15) NOT NULL DEFAULT '',
  `fecha` char(10) NOT NULL DEFAULT '',
  `activo` char(10) NOT NULL DEFAULT '',
  `nota` text,
  `emp_reportado` varchar(30) NOT NULL DEFAULT '',
  `emp_fecha` char(10) NOT NULL DEFAULT '',
  `emp_hora` varchar(10) NOT NULL DEFAULT '',
  `emp_nombre_emp` varchar(30) NOT NULL DEFAULT '',
  `emp_hora_ent` varchar(10) NOT NULL DEFAULT '',
  `emp_hora_sal` varchar(10) NOT NULL DEFAULT '',
  `ser_daño` text NOT NULL,
  `ser_reportado` varchar(30) NOT NULL DEFAULT '',
  `serv_fecha_rep` char(10) DEFAULT '',
  `ser_hora_rep` varchar(255) NOT NULL DEFAULT '',
  `ser_nota` text NOT NULL,
  `bio_super` varchar(30) NOT NULL DEFAULT '',
  `bio_fecha` char(10) NOT NULL DEFAULT '',
  `bio_hora` varchar(10) NOT NULL DEFAULT '',
  `bio_jefe` varchar(30) NOT NULL DEFAULT '',
  `bio_obs` text NOT NULL,
  `operacional` int(1) NOT NULL DEFAULT '0',
  `par_oper` int(1) NOT NULL DEFAULT '0',
  `fue_serv` int(1) NOT NULL DEFAULT '0',
  `esp_inf` int(1) NOT NULL DEFAULT '0',
  `espera_pieza` int(1) NOT NULL DEFAULT '0',
  `cotizar` int(1) NOT NULL DEFAULT '0',
  `a_pedir` int(1) NOT NULL DEFAULT '0',
  `pieza_col` int(1) NOT NULL DEFAULT '0',
  `fecha_reg` varchar(30) NOT NULL DEFAULT '',
  `usuario` varchar(15) NOT NULL DEFAULT '',
  `estado` int(1) NOT NULL DEFAULT '0',
  `fecha2` char(10) NOT NULL DEFAULT '',
  `cerrada` char(1) NOT NULL DEFAULT '',
  `reporte_emp` varchar(20) NOT NULL DEFAULT '',
  `fecha_ini` char(10) NOT NULL DEFAULT '',
  `fecha_ter` char(10) NOT NULL DEFAULT '',
  `trabajo_rea` text NOT NULL,
  `observaciones` text NOT NULL,
  `desc_pieza` text NOT NULL,
  `act` char(2) NOT NULL DEFAULT '',
  `codigo_empresa` int(10) NOT NULL DEFAULT '0',
  `estado1` int(1) NOT NULL DEFAULT '0',
  PRIMARY KEY (`Id`)
) ENGINE=InnoDB AUTO_INCREMENT=791 DEFAULT CHARSET=latin1 ROW_FORMAT=COMPACT;

#
# Data for table "control_servicio"
#

INSERT INTO `control_servicio` VALUES (3,'CONTRATO','0115-2025','EN TRÁMITE       ',' ','M. PREVENTIVO','2025-02-13','59820','CONTRATO GESTIONADO MEDIANTE NOTA N°2025-067-SBM-HST POR CONDUCTO DE LA DIRECCIÓN MEDICA GENERAL EL 29/1/2025.',' ','',' ','JOSÉ MURILLO                  ',' ',' ','MANTENIMIENTO PREVENTIVO DE FEBRERO 2025',' ','',' ','SERVICIO COORDINADO SEGÚN CRONOGRAMA Y DISPONIBILIDAD DEL SERVICIO.',' ','',' ',' ','',0,0,0,0,0,0,0,0,'14/02/2025 03:43:17 PM',' ',0,'','','','','','','','','',17,0),(4,'CONTRATO  ','0146-2025','35-2023             ','                    ','M. CORRECTIVO  ','2025-02-19','74301','GESTIONADO MEDIANTE NOTA N° 0407-23-SBM-HST POR CONDUCTO DE LA DIRECCIÓN MÉDICA. CONTRATO REFRENDADO.','SR. RENE/PROMED               ','2025-02-19','1:50 PM.  ','                              ','          ','          ','ALARMA EN EL SISTEMA.','TÉC. ANDRÉS/BIOMÉDICA         ','2025-02-19','1:50 PM         ','','                              ','','          ','                              ','',0,0,0,0,0,0,0,0,'19/02/2025 03:47:03 PM',' ',1,'','','','','','','','','',44,0),(5,'GARANTIA  ','0148-2025','                    ','4200533513','M. PREVENTIVO  ','2025-02-20','160391','RECIBIDO A SATISFACCIÓN 3/9/2024.','                              ','','          ','                              ','          ','          ','MANTENIMIENTO PREVENTIVO DE FEBRERO 2025.','                              ','',' ','','                              ','','          ','                              ','',0,0,0,0,0,0,0,0,'21/02/2025 02:19:53 PM',' ',0,'','','','','','','','','',44,0),(6,'GARANTIA','0149-2025',' ','4200533513       ','M. PREVENTIVO','2025-02-20','160393','RECIBIDO A SATISFACCIÓN EL 3/9/2024.',' ','',' ',' ',' ',' ','MANTENIMIENTO PREVENTIVO DE FEBRERO 2025',' ','',' ','',' ','',' ',' ','',0,0,0,0,0,0,0,0,'20/02/2025 10:46:18 AM',' ',2,'','','','','','','','','',44,0),(7,'GARANTIA','0150-2025',' ','4200489878       ','M. PREVENTIVO','2025-02-20','119726','RECIBIDO A SATISFACCIÓN 1/8/2023.',' ','',' ',' ',' ',' ','MANTENIMIENTO PREVENTIVO DE FEBRERO 2025',' ','',' ','',' ','',' ',' ','',0,0,0,0,0,0,0,0,'20/02/2025 10:56:17 AM',' ',0,'','','','','','','','','',44,0),(8,'GARANTIA','0151-2025',' ','4200338626       ','M. PREVENTIVO','2025-02-20','108336','RECIBIDO A SATISFACCIÓN 27/10/2021.',' ','',' ',' ',' ',' ','            MANTENIMIENTO PREVENTIVO DE FEBRERO 2024 (ÚLTIMO).',' ','',' ','',' ','',' ',' ','',1,0,0,0,0,0,0,0,'20/02/2025 12:28:11 PM',' ',0,'','1','250306085201122     ','2025-02-28','2025-02-28','SE REALIZA ENTRENAMIENTO A PERSONAL DE BIOMÉDICA EN LA FRECUENCIA Y EL CAMBIO DE PREFILTRADOS, FILTROS DE SALIDA, MEMBRANAS RO Y TANQUE DE RESINA DE CAMA MIXTA. CAMBIO DE INSUMOS PROPORCIONADOS POR EL CLIENTE. SE EXPLICA FUNCIONAMIENTO GENERAL DEL PURIFICADOR Y LOS DAÑOS MAS COMUNES Y SU SOLUCIÓN. EQUIPO OPERATIVO.','',' ','*',44,0),(9,'CONTRATO  ','0152-2025','35-2023             ','                    ','M. CORRECTIVO  ','2025-02-19','74301','GESTIONADO MEDIANTE NOTA N° 0407-23-SBM-HST POR CONDUCTO DE LA DIRECCIÓN MÉDICA. CONTRATO REFRENDADO.','SR. RENE/PROMED               ','2025-02-19','1:50 PM.  ','                              ','          ','          ','ALARMA EN EL SISTEMA.','TÉC. ANDRÉS/BIOMÉDICA         ','2025-02-19','1:50 PM         ','','                              ','','          ','                              ','',0,0,0,0,0,0,0,0,'20/02/2025 12:46:16 PM',' ',1,'','','','','','','','','',44,0),(10,'GARANTIA  ','0153-2025','                    ','4200518460','M. CORRECTIVO  ','2025-02-20','160296','RECIBIDO A SATISFACCIÓN EL 17/7/2024.','SR. JOSE /HORACIO ICAZA       ','20/02/2025','12:50 PM  ','                              ','          ','          ','MANDA COLOR ROJO EN LA PARTE INFERIOR.','LIC. MENDOZA/MEDICINA DE VARON','20/02/2025','12:14 PM        ','','                              ','/  /','          ','                              ','',0,0,0,0,0,0,0,0,'28/03/2025 07:19:12 AM',' ',0,'2025-02-20','','','','','','','','',24,0),(11,'GARANTIA  ','0154-2025','                    ','4200442385','M. CORRECTIVO  ','2025-02-20','119082','RECIBIDO A SATISFACCIÓN 30/11/2022.','NILKA/PRODUCTOS  A LA MANO    ','19/02/2025','          ','                              ','          ','          ','FALTA UN FOCO PARA VER EL PRIMER # DE PRESIÓN Y TIEMPO.','LIC. JEANNETTE/SALÓN DE OPERAC','19/02/2025','                ','','                              ','/  /','          ','                              ','',0,0,0,0,0,0,0,0,'27/03/2025 02:06:37 PM',' ',1,'2025-02-20','','','','','','','','',46,1),(12,'GARANTIA','0155-2025',' ','                 ','M. CORRECTIVO','2025-02-20','120412','','ING. CARMEN/PROMED            ','2025-02-20','          ',' ',' ',' ','ERROR TÉCNICO','LIC. JEANNETTE/SALÓN DE OPERAC','2025-02-20','                ','',' ','',' ',' ','',0,0,0,0,0,0,0,0,'20/02/2025 02:21:12 PM',' ',0,'','','','','','','','','',44,0),(13,'GARANTIA','0166-2025',' ','4200578663       ','M. CORRECTIVO','2025-02-24','160630','RECIBIDO A SATISFACCIÓN 31/12/2025.','EINAR BARRAZA/ORTOMEDIC.      ','2025-02-24','12:17 PM  ',' ',' ',' ','LA PUERTA NO CIERRA','DR. DE WITT/URGENCIAS         ','2025-02-24','11:24 AM        ','',' ','',' ',' ','',0,0,0,0,0,0,0,0,'24/02/2025 12:37:52 PM',' ',1,'','','','','','','','','',43,0),(14,'GARANTIA','0285-2025',' ','4200513879','M. CORRECTIVO','2025-03-19','160346','EQUIPO ADQUIRIDO POR ORDEN DE COMPRA N° 4200513879. RECIBIDIO A SATISFACCIÓN EL 07/08/2024.','SRA. DINA/DENTI CLINICA.      ','2025-03-19','12:26 PM  ',' ',' ',' ','BARANDALES NO FUNCIONAN','DRA. LLOYD/SALA DE PARTO      ','2025-03-19','12:00 PM        ','','','',' ','JOSÉ CASTILLO.                ','',1,0,0,0,0,0,0,1,'19/03/2025 02:54:07 PM',' ',1,'','1','****                ','2025-04-21','2025-04-21','SE LE CAMBIO LOS TOUCH PAD DE LOS LATERALES Y EL MOTOR DE SUBIR Y BAJA LA CAMILLA.','','TOUCH PAD LATERALES Y MOTOR UP-DOWN.                                                                                                                    ','*',11,1),(15,'GARANTIA','0297-2025',' ','4200381888       ','M. CORRECTIVO','2025-03-21','110144','ADQUIRIDO POR ORDEN DE COMPRA 4200381888, RECIBICO A SATISFACCIÓN EL 20/09/2022.','BENJAMIN/HEALTHCARE           ','21/03/2025','1:53 PM   ',' ',' ',' ','PROBLEMA DE LOS BARANDALES','LIC. MOYA/SALA 23             ','21/03/2025','1:49 PM         ','CAMA #656, ÁREA DE SEMI-INTENSIVO.',' ','/  /',' ','JOSÉ CASTILLO                 ','',0,0,0,0,0,0,0,0,'24/03/2025 08:45:14 AM',' ',0,'2025-03-21','','','','','','','','',23,0),(16,'GARANTIA  ','0334-2025','                    ','4200535878          ','M. CORRECTIVO  ','2025-03-28','160427','EQUIPO RECIBIDO A SATISFACCIÓN EL 03/09/2024.','MAYLENIS/PROMED               ','28/03/2025','1:33 PM   ','                              ','          ','          ','MANGUERA BOTANDO AGUA.','MIS DANIA/HEMODIÁLISIS        ','28/03/2025','1:30 PM         ','','                              ','/  /','          ','JOSÉ CASTILLO.                ','',0,0,0,0,0,0,0,0,'28/03/2025 02:18:46 PM',' ',1,'','','','','','','','','',44,1),(17,'GARANTIA','0335-2025',' ','4200535878       ','M. CORRECTIVO','2025-03-28','160428','EQUIPO RECIBIDO A SATISFACCIÓN EL 03/09/2024.','MAYLENIS/PROMED               ','2025-03-28','1:33 PM   ',' ',' ',' ','RECARGA DE SAL','LIC. PAULINA/HEMODIÁLISIS     ','2025-03-28','1:30 PM         ','',' ','',' ','JOSÉ CASTILLO,                ','',0,0,0,0,0,0,0,0,'28/03/2025 02:21:30 PM',' ',1,'','','','','','','','','',44,1),(18,'GARANTIA','0340-2025',' ','4200537741       ','M. PREVENTIVO','2025-04-01','159769','EQUIPO RECIBIDO A SATISFACCIÓN EL 30/05/2024.','ING. PAOLA/MEDTRONIC.         ','2025-04-01','12:00 PM  ',' ',' ',' ','MANTENIMIENTO DEL VENTILADOR','LIC. BILLARD/TERAPIA RESPIRATO','2025-04-01','10:22 AM        ','',' ','',' ','JOSÉ CASTILLO.                ','',1,0,0,0,0,0,0,0,'02/04/2025 07:45:31 AM',' ',1,'','1','403503889           ','2025-04-03','2025-04-03','SE REALIZA LIMPIEZA Y DESINFECCIÓN DEL EQUIPO, LIMPIEZA DE FILTRO, RUTINA DE MP , AUTOTEST GLOBAL, ATG, ATC, PRUEBA DE FUNCIONAMIENTO COMPLETO PVT, EQUIPO NO PRESENTA ERRORES NI FALLAS Y ES APTO PARA SU USO.','',' ','*',40,1),(19,'CONTRATO','0337-2025','TRÁMITE          ',' ','M. CORRECTIVO','2025-04-01','61629','CONTRATO GESTIONADO MEDIANTE NOTA N°2025-067-SBM-HST POR LA DIRECCIÓN MÉDICA GENERAL.',' ','',' ',' ',' ',' ','ENTREGA DE EQUIPO',' ','',' ','EQUIPO EVALUADO EN TALLER CON COTIZACIÓN ADJUNTA DE PIEZAS  MAYORES, TRÁMITE DE COMPRA.',' ','',' ',' ','',0,0,0,0,0,0,0,0,'02/04/2025 08:30:42 AM',' ',2,'','','','','','','','','',17,0),(20,'CONTRATO','0336-2025','TRÁMITE          ',' ','M. CORRECTIVO','2025-03-31','71633','CONTRATO GESTIONADO MEDIANTE NOTA N° 2025-067-SBM-HST POR LA DIRECCIÓN MÉDICA GENERAL.','SR. CASTILLERO/ENDOSERVICE    ','2025-03-31','8:51 AM   ',' ',' ',' ','MANDOS RÍGIDOS','DR. JAN CUBILLA/GASTRO        ','2025-03-31','8:50 AM         ','',' ','',' ','JOSÉ CASTILLO.                ','',0,0,0,0,0,0,0,0,'02/04/2025 08:47:18 AM',' ',1,'','','','','','','','','',17,0),(21,'CONTRATO','0224-2025','4200602634       ',' ','M. CORRECTIVO','2025-03-12','64243','','TANISHA/PROMED                ','2025-03-12','          ',' ',' ',' ','BATERIAS DEL DETECTOR NO ENCIENDEN','LIC. CUMBRERA/IMAGINOLOGÍA    ','2025-03-12','11:32 AM        ','',' ','',' ',' ','',0,0,0,0,0,0,0,0,'02/04/2025 11:24:04 AM',' ',1,'','','','','','','','','',44,0),(22,'CONTRATO','0223-2025','4200602634       ',' ','M. CORRECTIVO','2025-03-12','64241','',' ','',' ',' ',' ',' ',' BATERIA DEL DETECTOR NO ENCIENDE','                              ','',' ','',' ','',' ','JOSE CASTILLO.                ','',0,0,0,0,0,0,0,0,'02/04/2025 11:33:14 AM',' ',1,'','','','','','','','','',44,0),(23,'CONTRATO','0341-2025','4200602634       ',' ','M. CORRECTIVO','2025-04-02','64243','GESTIONADO MEDIANTE ORDEN DE COMPRA 4200602634 POR UN PERIODO DE 4 MESES.',' ','',' ',' ',' ',' ','ENTREGA DE BATERIAS DE DETECTOR','                              ','',' ','PIEZAS SOLICITADAS BAJO REPORTE ANTERIOR.',' ','',' ','JOSE CASTILLO.                ','',1,0,0,0,0,0,0,0,'02/04/2025 12:02:34 PM',' ',1,'','1','250402090401083     ','2025-04-02','2025-04-02','SE REALIZA ENTREGA DE DOS BATERIAS DE DETECTOR A LIC. LILIANA.','','BATTERY FLAHPAD N/P 5382000 (2) ENTREGADA.                                                                                                              ','*',44,1),(24,'CONTRATO','0342-2025','4200602634       ',' ','M. CORRECTIVO','2025-04-02','64246','GESTIONADO MEDIANTE ORDEN DE COMPRA N° 4200602634 POR UN PERIODO DE 4 MESES.',' ','',' ',' ',' ',' ','ENTREGA DE BATERIAS N/P 5382000',' ','',' ','PEDIDO REALIZADO EN REPORTE ANTERIOR.',' ','',' ','JOSE CASTILLO.                ','',0,0,0,0,0,0,0,0,'02/04/2025 12:07:49 PM',' ',1,'','','','','','','','','',44,0),(25,'CONTRATO','0319-2025','4200602634       ',' ','M. CORRECTIVO','2025-03-25','64243','',' ','',' ',' ',' ',' ','ENTREGA DE CABLE DE DETECTOR N/P5389155',' ','',' ','PIEZA SOLICITADA EN REPORTE ANTERIOR.',' ','',' ','JOSÉ CASTILLO.                ','',0,0,0,0,0,0,0,0,'02/04/2025 12:17:50 PM',' ',1,'','','','','','','','','',44,0),(26,'CONTRATO','0318-2025','4200602634       ',' ','M. CORRECTIVO','2025-03-26','64241','',' ','',' ',' ',' ',' ','ENTREGA DE CABLE DE DETECTOR N/P5389155.',' ','',' ','ENTREGA DE PARTE SOLICITADO EN REPORTE ANTERIOR.',' ','',' ','JOSÉ CASTILLO.                ','',0,0,0,0,0,0,0,0,'02/04/2025 12:22:26 PM',' ',1,'','','','','','','','','',44,0),(27,'CONTRATO','0320-2025','4200602634       ',' ','M. CORRECTIVO','2025-03-25','64245','',' ','',' ',' ',' ',' ','ENTREGA DE BATERIAS DEL DETECTOR N/P 538200',' ','',' ','PEDIDO DE PARTES BAJO REPORTE ANTERIOR.',' ','',' ','JOSÉ CASTILLO.                ','',0,0,0,0,0,0,0,0,'02/04/2025 01:45:06 PM',' ',1,'','','','','','','','','',44,0),(28,'CONTRATO','0343-2025','4200602634',' ','M. CORRECTIVO','2025-04-03','64241','EQUIPO BAJO CONTRATO DE MANTENIMIENTO SEGÚN ORDEN DE COMPRA N°4200602634',' ','',' ','ARMANDO DELGADO               ',' ',' ','NO ESTÁ CARGANGO/REEMPLAZO DE FIREFLY BOARD.',' ','',' ','PEDIDO DE PARTE SEGÚN REPORTE ANTERIOR. PIEZA REEMPLAZADA EL DÍA 2/04/2025.',' ','',' ','JOSÉ CASTILLO.                ','',1,0,0,0,0,0,0,1,'03/04/2025 01:25:27 PM',' ',1,'','1','250403085901083     ','2025-04-02','2025-04-02','INSTALACIÓN DE TARJETA DE FIREFLY Y REPARACIÓN DEL CABLE DE ALIMENTACIÓN. EQUIPO EMPIEZA A CARGAR. SE DEJA EQUIPO CARGANDO.','','FIREFLY BOARD N/P 5350000-2                                                                                                                             ','*',44,1),(29,'CONTRATO','0344-2025','EN TRÁMITE       ',' ','M. CORRECTIVO','2025-04-03','37826','GESTIONADO MEDIANTE NOTA N° 25-129-SBM-HST POR CONDUCTO DE LA DIRECCIÓN MÉDICA GENERAL.',' ','',' ','JULIO RODRÍGUEZ               ',' ',' ','LA MESA NO FUNCIONA',' ','',' ','REPORTE DE TURNO DEL 27/3/2025 POR PERSONAL DEL SERVICIO A PERSONAL DE BIOMÉDICA.',' ','',' ','JOSÉ CASTILLO.                ','',1,0,0,0,0,0,0,0,'03/04/2025 01:49:23 PM',' ',1,'','1','250328122601078     ','2025-03-27','2025-03-27','SE RPOCEDE A VERIFICAR EQUIPO, DOCK SE ENCUENTRA ACTIVADO PARA SUBIR LA MESA A PESAR QUE LA CAMILLA NO ESTÁ ENGANCHADA, SE PROCEDE A DESACTIVAR SWITCH MECÁNICO QUE ACTIVA ESTA FUNCIÓN, SE REALIZA TPS RESET, SE ENGANCHA CAMILLA. PRUEBAS DE FUNCIONAMIENTO.','',' ','*',44,1),(30,'CONTRATO','0345-2025','4200602634',' ','M. CORRECTIVO','2025-04-03','64245','GESTIONADO MEDIANTE NOTA N°25-094-SBM-HST POR CONDUCTO DE LA DIRECCIÓN MÉDICA GENERAL. OC 4200602634.',' ','',' ','JULIO RODRÍGUEZ.              ',' ',' ','PANTALLA TÁCTIL ROTA.','                              ','',' ','REPORTE DE TURNO DEL DÍA 28/3/2025 POR PERSONAL DEL SERVICIO A PERSONAL DE BIOMÉDICA.',' ','',' ','JOSÉ CASTILLO.                ','',0,0,0,0,0,0,0,0,'03/04/2025 01:56:53 PM',' ',1,'','','','','','','','','',44,0),(31,'CONTRATO','0192-2025','4200602634       ',' ','M. CORRECTIVO','2025-03-07','64244','',' ','',' ','EMILIO BUENO                  ',' ',' ','PROBLEMA DE CARGA, PEDIDO DE LOCUST BOARD',' ','',' ','REPORTE REALIZADO EN BASE A REPORTE EN SITIO POR RECORRIDO EN EL ÁREA.',' ','',' ','JOSE CASTILLO.                ','',0,0,0,0,0,0,0,0,'03/04/2025 02:09:04 PM',' ',1,'','','','','','','','','',44,0),(32,'CONTRATO','0288-2025','EN TRÁMITE       ',' ','M. CORRECTIVO','2025-03-20','37826','',' ','',' ','JULIO RODRÍGUEZ               ',' ',' ','SUGETADOR DE ANTENA DE CEREBRO ROTA.',' ','',' ','',' ','',' ','JOSE CASTILLO.                ','',0,0,0,0,0,0,0,0,'03/04/2025 02:20:26 PM',' ',1,'','','','','','','','','',44,1),(33,'CONTRATO','0346-2025','4200602634       ',' ','M. CORRECTIVO','2025-04-03','64246','',' ','',' ','YESFFRY PEÑALBA               ',' ',' ','REEMPLAZO DE BRAZO HORIZONTAL N/P 5506700',' ','',' ','PEDIDO REALIZADO EN REPORTE ANTERIOR.',' ','',' ','JOSÉ CASTILLO.                ','',0,0,0,0,0,0,0,0,'03/04/2025 02:28:07 PM',' ',1,'','','','','','','','','',44,0),(34,'CONTRATO','0186-2025','4200602634       ',' ','M. CORRECTIVO','2025-03-06','64245','',' ','',' ','EMILIO BUENO                  ',' ',' ','REEMPLAZO DE HAND SWITCH (DISPARADOR) N/P 5503500-3',' ','',' ','REPORTE REALIZADO POR EL SERVICIO, PREVIO AL INICIO DE CONTRATO. NOTIFICADO EL 6/3/2025 POR ING. EMILIO BUENO.',' ','',' ','JOSÉ CAASTILLO.               ','',0,0,0,0,0,0,0,0,'03/04/2025 02:45:50 PM',' ',1,'','','','','','','','','',44,0),(35,'CONTRATO','0347-2025','07-2025          ',' ','M. PREVENTIVO','2025-04-04','71741-D','CONTRATO GESTIONADO MEDIANTE NOTA N° 2025-067-SBM-HST POR LA DIRECCIÓN MÉDICA GENERAL. CONTRATO POR REFRENDO.',' ','/  /',' ',' ',' ',' ','  MANTENIMIENTO PREVENTIVO DE ABRIL 2025.',' ','/  /',' ','COORDINADO SEGÚN CRONOGRAMA Y DISPONIBILIDAD.',' ','/  /',' ','JOSÉ CASTILLO.                ','',0,0,0,0,0,0,0,0,'04/04/2025 07:22:21 AM',' ',1,'2025-04-04','','','','','','','','',17,1),(36,'CONTRATO','0348-2025','07-2025          ',' ','M. PREVENTIVO','2025-04-04','71741-E','GESTIONADO MEDIANTE NOTA N° 2025-067-SBM-HST POR CONDUCTO DE LA DIRECCIÓN MÉDICA GENERAL.CONTRATO POR REFRENDO.',' ','',' ',' ',' ',' ','    MANTENIMIENTO PREVENTIVO DE ABRIL 2025',' ','',' ','COORDINADO SEGÚN CRONOGRAMA Y DISPONIBILIDAD.',' ','',' ','  JOSÉ CASTILLO.              ','',0,0,0,0,0,0,0,0,'04/04/2025 07:26:26 AM',' ',1,'','','','','','','','','',17,1),(37,'CONTRATO','0349-2025','07-2025          ',' ','M. PREVENTIVO','2025-04-04','71741-H','GESTIONADO MEDIANTE N° 2025-067-SBM-HST POR CONDUCTO DE LA DIRECCIÓN MÉDICA GENERAL. CONTRATO POR REFRENDO.',' ','',' ',' ',' ',' ','  MANTENIMIENTO PREVENTIVO DE ABRIL 2025.',' ','',' ','COORDINADO SEGÚN CRONOGRAMA  Y DISPONIBILIDAD.',' ','',' ','JOSÉ CASTILLO.                ','',0,0,0,0,0,0,0,0,'04/04/2025 07:30:49 AM',' ',1,'','','','','','','','','',17,1),(38,'CONTRATO','0350-2025','07-2025          ',' ','M. PREVENTIVO','2025-04-04','71741*','GESTIONADO MEDIANTE NOTA N°2025-067-SBM-HST POR CONDUCTO DE LA DIRECCIÓN MÉDICA GENERAL. CONTRATO POR REFRENDO.',' ','',' ',' ',' ',' ','  MANTENIMIENTO PREVENTIVO DE ABRIL 2025.',' ','',' ','COORDINADO SEGÚN CRONOGRAMA Y DISPONIBILIDAD.',' ','',' ','JOSÉ CASTILLO.                ','',0,0,0,0,0,0,0,0,'04/04/2025 07:35:07 AM',' ',0,'','','','','','','','','',0,0),(39,'CONTRATO','0351-2025','07-2025          ',' ','M. PREVENTIVO','2025-04-04','71741-L','GESTIONADO MEDIANTE NOTA N° 2025-067-SBM-HST POR CONDUCTO DE LA DIRECCIÓN MÉDICA GENERAL. CONTRATO POR REFRENDO.',' ','',' ',' ',' ',' ','  MANTENIMIENTO PREVENTIVO DE ABRIL 2025',' ','',' ','COORDINADO SEGÚN CRONOGRAMA Y DISPONIBILIDAD.',' ','',' ','JOSÉ CASTILLO.                ','',0,0,0,0,0,0,0,0,'04/04/2025 07:38:09 AM',' ',1,'','','','','','','','','',17,1),(40,'CONTRATO','0352-2025','07-2025          ',' ','M. PREVENTIVO','2025-04-04','71741**','GESTIONADO MEDIANTE NOTA N° 2025-067-SBM-HST POR CONDUCTO DE LA DIRECCIÓN MÉDICA GENERAL. CONTRATO POR REFRENDO.',' ','',' ',' ',' ',' ','      MANTENIMIENTO PREVENTIVO DE ABRIL 2025.',' ','',' ','       COORDINADO SEGÚN CRONOGRAMA Y DISPONIBILIDAD.',' ','',' ','JO´SE CASTILLO.               ','',0,0,0,0,0,0,0,0,'04/04/2025 07:41:40 AM',' ',0,'','','','','','','','','',0,0),(41,'CONTRATO','0347A-2025','4200602634       ',' ','M. PREVENTIVO','2025-04-04','64246','GESTIONADO MEDIANTE ORDEN DE COMPRA N°4200602634.',' ','',' ',' ',' ',' ',' MANTENIMIENTO PREVENTIVO DE ABRIL 2025.',' ','',' ','  COORDINADO SEGÚN CRONOGRAMA Y DISPONIBILIDAD.',' ','',' ','JOSÉ CASTILLO.                ','',1,0,0,0,0,0,0,0,'04/04/2025 07:55:34 AM',' ',1,'','1','250430090401078     ','2025-04-04','2025-04-25','REPROG MP. 25/04/2025 SE VERIFICA FUNCIONAMIENTO, REVISIÓN DE PANTALLA TÁCTIL , MOVIMIENTO DEL TUBO DE RX, COLIMADOR Y COLUMNA DEL EQUIPO, RUEDAS, FRENOS, SENSORES DE GOLPE , DISPARADOR, REVISIÓN FISICA DEL DETECTOR, PRUEBAS QA DE DETECTOR, LIMPIEZA GENERAL DEL EQUIPO. PRUEBA DE FUNCIONAMIENTO.','',' ','*',44,1),(42,'CONTRATO','0291-2025','4200602634       ',' ','M. PREVENTIVO','2025-03-21','64241','',' ','',' ',' ',' ',' ','MANTENIMIENTO PREVENTIVO DE MARZO 2025.',' ','',' ','',' ','',' ','JOSÉ CASTILLO.                ','',0,0,0,0,0,0,0,0,'04/04/2025 08:17:11 AM',' ',1,'','','','','','','','','',44,0),(43,'CONTRATO','0301-2025','4200602634       ',' ','M. PREVENTIVO','2025-04-04','64242','',' ','',' ',' ',' ',' ','MANTENIMIENTO PREVENTIO DE ABRIL 2025',' ','',' ','',' ','',' ','JOSÉ CASTILLO.                ','',0,0,0,0,0,0,0,0,'04/04/2025 08:19:58 AM',' ',2,'','','','','','','','','',44,0),(44,'CONTRATO','0283-2025','4200602634       ',' ','M. PREVENTIVO','2025-03-20','64243','',' ','',' ',' ',' ',' ','  MANTENIMIENTO PREVENTIVO DE MARZO 2025',' ','',' ','',' ','',' ','JOSÉ CASTILLO.                ','',0,0,0,0,0,0,0,0,'04/04/2025 08:26:35 AM',' ',1,'','','','','','','','','',44,0),(45,'CONTRATO','0307-2025','4200602634       ',' ','M. CORRECTIVO','2025-03-24','64241','',' ','',' ',' ',' ',' ','PIERDE COMUNICACIÓN DEL DETECTOR CON EL EQUIPO.',' ','',' ','',' ','',' ','JOSÉ CASTILLO.                ','',0,0,0,0,0,0,0,0,'04/04/2025 08:39:49 AM',' ',1,'','','','','','','','','',44,0),(46,'CONTRATO','0353-2025','EN TRÁMITE       ',' ','M. CORRECTIVO','2025-04-04','61496','GESTIONADO MEDIANTE NOTA N° 25-229-SMB-HST DEL 27/03/2025 POR CONDUCTO DE LA DIRECCIÓN MÉDICA GENERAL.','MAYLENIS/PROMED               ','2025-04-04','12:01 PM  ',' ',' ',' ','    RECARGA DE SAL','    LIC. ARTURO VALDÉZ/SALA 3 ','2025-04-04','12:01 PM        ','',' ','',' ','JOSÉ CASTILLO.                ','',0,0,0,0,0,0,0,0,'04/04/2025 01:35:28 PM',' ',1,'','','','','','','','','',44,1),(47,'GARANTIA','0354-2025',' ','4200535878       ','M. CORRECTIVO','2025-04-04','160428','EQUIPO RECIBIDO A SATISFACCIÓN EL 03/09/2024.','MAYLENIS/PROMED               ','2025-04-04','12:01 PM  ',' ',' ',' ','  RECARGA DE SAL','LIC. ARTURO VALDÉZ/SALA 3 HEMO','2025-04-04','12:01 PM        ','',' ','',' ','JOSÉ CASTILLO.                ','',0,0,0,0,0,0,0,0,'04/04/2025 01:40:36 PM',' ',1,'','','','','','','','','',44,1),(48,'CONTRATO','0355-2025','EN TRÁMITE       ',' ','M. CORRECTIVO','2025-04-04','61498','GESTIONADO MEDIANTE NOTA N° 25-229-SBM-HST DEL 27/3/2025 POR CONDUCTO DE LA DIRECCIÓN MÉDICA GENERAL.','           MARICRUZ/PROMED    ','2025-04-04','1:24 PM   ',' ',' ',' ',' PRODUCCIÓN DE AGUA POR DEBAJO DE LO ESPERADO, MÁQUINA NO PREPARA MÁS DE UNA HORA DE ESPERA.','MIS DANIA/HEMODIÁLISIS.       ','2025-04-04','1:11 PM         ','',' ','',' ','JOSÉ CASTILLO.                ','',0,0,0,0,0,0,0,0,'04/04/2025 01:46:37 PM',' ',2,'','','','','','','','','',44,2),(49,'CONTRATO','0356-2025','EN TRÁMITE       ',' ','M. CORRECTIVO','2025-04-04','37826','','   MELISSA/PROMED             ','2025-04-04','12:37 PM  ',' ',' ',' ','   MOTOR DE LA CAMILLA SE QUEDÓ TRABADO, NO FUNCIONA.\r\n\r\n','   LIC. DE ARRIBA/RESONANCIA  ','2025-04-04','12:29 PM        ','',' ','',' ','  JOSÉ CASTILLO.              ','',0,0,0,0,0,0,0,0,'04/04/2025 01:51:00 PM',' ',1,'','','','','','','','','',44,1),(50,'CONTRATO','0357-2025','15-2023          ',' ','M. PREVENTIVO','2025-04-07','65492','GESTIONADO MEDIANTE NOTA N° 0319-23-SBM-HST DEL 29/5/2023 POR CONDUCTO DE LA DIRECCIÓN MÉDICA.',' ','',' ',' ',' ',' ','MANTENIMIENTO PREVENTIVO DE ABRIL 2025',' ','',' ','COORDINADO SEGÚN CRONOGRAMA Y DISPONIBILIDAD.',' ','',' ','JOSÉ CASTILLO.                ','',1,0,0,0,0,0,0,0,'07/04/2025 09:36:33 AM',' ',1,'','1','TSO048517/TSO47728  ','2025-04-07','2025-04-10','SE REALIZA MO SEGÚN CHECK LIS ADJUNTO, PRUEBA DE FUNCIONAMIENTO. ESPACIO DE DISCO 59% .INSPECCIÓN Y VERIFICACIÓN DE COMPONENTES. LIMPIEZA GENERAL. REVISIÓN DE ESTACION , Y UPS DEL EQUIPO.','SE RECOMIENDA NO DEJAR QUE EL DISCO SE LLENE PARA QUE NO AFECTE EL RENDIMIENTO DEL EQUIPO',' ','*',16,1),(51,'CONTRATO','0358-2025','4200602634       ',' ','M. PREVENTIVO','2025-04-07','64244','GESTIONADO MEDIANTE ORDEN DE COMPRA N°4200602634 (2025),POR 4 MESES.',' ','',' ',' ',' ',' ','MANTENIMIENTO PREVENTIVO DE ABRIL 2025.',' ','',' ','COORDINADO SEGÚN CRONOGRAMA Y DISPONIBILIDAD. ',' ','',' ','JOSÉ CASTILLO.                ','',0,0,1,0,1,0,0,0,'07/04/2025 09:39:52 AM',' ',1,'','1','250408132401075     ','2025-04-07','2025-04-07','NO SE PUEDE REALIZAR EL MANTENIMIENTO YA QUE EL EQUIPO , ESTÁ EN ESPERA DE PIEZAS. 29/04/2025 EQUIPO FUERA DE SERVICIO, SE CIERRA DESPACHO SE ABRE UNO DE MAYO.','MP REPROGRAMADO.','                                                                                                                                                                                                                                                              ','*',44,1),(52,'GARANTIA','0362-2025',' ','4200537741       ','M. PREVENTIVO','2025-04-07','159768','EQUIPO RECIBIDO A SATISFACCIÓN EL 30/05/2024.',' ','',' ',' ',' ',' ',' MANTENIMIENTO PREVENTIVO DE ABRIL 2025.',' ','',' ','COORDINADO SEGÚN CRONOGRAMA Y DISPONIBILIDAD.',' ','',' ','JOSÉ CASTILLO.                ','',0,0,0,0,0,0,0,0,'07/04/2025 11:18:49 AM',' ',0,'','','','','','','','','',40,0),(53,'CONTRATO','0363-2025','07-2025          ',' ','M. PREVENTIVO','2025-04-08','71741-F','GESTIONADO MEDIANTE NOTA N°2025-067-SBM-HST POR CONDUCTO DE LA DIRECCIÓN MÉDICA.',' ','',' ',' ',' ',' ','MANTENIMIENTO PREVENTIVO DE ABRIL 2025.',' ','',' ','COORDINADO SEGÚN CRONOGRAMA Y DISPONIBILIDAD',' ','',' ','JOSÉ CASTILLO.                ','',0,0,0,0,0,0,0,0,'08/04/2025 07:21:07 AM',' ',1,'','','','','','','','','',17,1),(54,'CONTRATO','0364-2025','07-2025          ',' ','M. PREVENTIVO','2025-04-08','71741-M','GESTIONADO MEDIANTE NOTA N° 2025-067-SBM-HST POR CONDUCTO DE LA DIRECCIÓN MÉDICA.',' ','',' ',' ',' ',' ','MANTENIMIENTO PREVENTIVO DE ABRIL 2025.',' ','',' ','COORDINADO SEGÚN CRONOGRAMA Y DISPONIBILIDAD.',' ','',' ','JOSÉ CASTILLO.                ','',0,0,0,0,0,0,0,0,'08/04/2025 07:23:53 AM',' ',1,'','','','','','','','','',17,1),(55,'CONTRATO','0365-2025','07-2025          ',' ','M. PREVENTIVO','2025-04-08','68472','GESTIONADO MEDIANTE NOTA N°2025-067-SBM-HST POR CONDUCTO DE LA DIRECIÓN MÉDICA GENERAL.',' ','',' ',' ',' ',' ','MANTENIMIENTO PREVENTIVO DE ABRIL 2025.',' ','',' ','COORDINADO SEGÚN CRONOGRAMA Y DISPONIBILIDAD.',' ','',' ','JOSÉ CASTILLO.                ','',0,0,0,0,0,0,0,0,'08/04/2025 07:31:14 AM',' ',1,'','','','','','','','','',17,1),(56,'CONTRATO','0366-2025','07-2025          ',' ','M. PREVENTIVO','2025-04-08','64089','GESTIONADO MEDIANTE NOTA N° 2025-067-SBM-HST POR CONDUCTO DE LA DIRECCIÓN MÉDICA.',' ','',' ',' ',' ',' ','MANTENIMIENTO PREVENTIVO DE ABRIL 2025.',' ','',' ','COORDINADO SEGÚN CRONOGRAMA Y DISPONIBILIDAD.',' ','',' ','JOSÉ CASTILLO.                ','',0,0,0,0,0,0,0,0,'08/04/2025 07:40:52 AM',' ',1,'','','','','','','','','',17,1),(57,'CONTRATO','0367-2025','07-2025          ',' ','M. PREVENTIVO','2025-04-08','64083','GESTIONADO MEDIANTE NOTA N° 2025-067-SBM-HST POR CONDUCTO DE LA DIRECCIÓN MÉDICA.',' ','',' ',' ',' ',' ','MANTENIMIENTO PREVENTIVO DE ABRIL 2025.',' ','',' ','COORDINADO SEGÚN CRONOGRAMA Y DISPONIBILIDAD.',' ','',' ','JOSÉ CASTILLO.                ','',0,0,0,0,0,0,0,0,'08/04/2025 07:43:58 AM',' ',1,'','','','','','','','','',17,1),(58,'CONTRATO','0368-2025','TRÁMITE          ',' ','M. PREVENTIVO','2025-04-08','64084','GESTIONADO MEDIANTE NOTA N° 2025-067-SBM-HST. POR CONDUCTO DE LA DIRECCIÓN MÉDICA GENERAL.',' ','',' ',' ',' ',' ','MANTENIMIENTO PREVENTIVO DE ABRIL 2025.',' ','',' ','COORDINADO SEGÚN CRONOGRAMA Y DISPONIBILIDAD.',' ','',' ','JOSÉ CASTILLO.                ','',0,0,0,0,0,0,0,0,'08/04/2025 07:46:49 AM',' ',1,'','','','','','','','','',17,1),(59,'GARANTIA','0369-2025',' ','4200535878       ','M. CORRECTIVO','2025-04-08','160428','RECIBIDO A SATISFACCIÓN EL 3/9/2025.','MARGARITA/PROMED              ','2025-04-08','8:12 AM   ',' ',' ',' ','ALARMA DE FALLA EN EL SOFTWARE DEL AGUA.','LIC. IDANIA/HEMODIALISIS      ','2025-04-08','8:10 AM         ','',' ','',' ','JOSÉ CASTILLO.                ','',1,0,0,0,0,0,0,1,'08/04/2025 09:21:34 AM',' ',1,'','1','250411112701081     ','2025-04-08','2025-04-08','REEMPLAZO DE FILTRO DE ENTRADA DE AGUA, SE REALIZA REGENERACIÓN A TANQUES DE RESINA, PRUEBAS DE FUNCIONAMIENTO SUPPLY-RINSE OK. SE VERIFICA NIVEL DE SAL OK. PRUEBA DE FUNCIONAMIENTO CON  LAS MAQUINAS DE HEMODIÁLISIS OK.','','FILTRO DE ENTRADA DE AGUA.                                                                                                                              ','*',44,1),(60,'GARANTIA','0370-2025',' ','4200513879','M. CORRECTIVO','2025-04-08','160346','RECIBIDO A SATISFACCIÓN EL 7/8/2024.','LIC. DINA/DENTI CLINICA       ','2025-04-08','1:46 PM   ',' ',' ',' ','NO SUBE Y EN LA PARTE DE ABAJO ESTÁ QUEBRADA.','LIC. INDIRA BARRIOS/SALA DE PA','2025-04-08','12:22 PM        ','',' ','',' ','JOSÉ CASTILLO.                ','',0,0,1,0,1,0,1,0,'08/04/2025 01:50:40 PM',' ',1,'','1','****                ','2025-04-09','2025-04-09','MOTOR DE SUBIR DAÑADO  Y TORNILLO FALTANTE, SE RETIRA PARA REEMPLAZO.','',' ','*',11,1),(61,'CONTRATO','0371-2025','4200602634       ',' ','M. CORRECTIVO','2025-04-08','64245','GESTIONADO MEDIANTE ORDEN DE COMPRA 4200602634.',' ','',' ',' ',' ',' ','REEMPLAZO DE PANTALLA TÁCTIL N/P 5926611.',' ','',' ','PIEZA SOLICITADA EN REPORTE ANTERIOR.',' ','',' ','JOSÉ CASTILLO.                ','',1,0,0,0,0,0,0,0,'08/04/2025 02:50:49 PM',' ',1,'','1','250409125601078     ','2025-04-08','2025-04-08','SE REALIZA CAMBIO DE PANTALLA TÁCTIL , CALIBRACIÓN DE LA PANTALLA TÁCTIL, SE REALIZAN PRUEBAS DE FUNCIONAMIENTO. EQUIPO OPERA CORRECTAMENTE.','','TOP COVER. N/P 5926611.                                                                                                                                 ','*',44,1),(62,'CONTRATO','0372-2025','4200602634       ',' ','M. CORRECTIVO','2025-04-08','64242','GESTIONADO MEDIANTE ORDEN DE COMPRA N°4200602634','TANISHA/PROMED                ','2025-04-08','2:48 PM   ',' ',' ',' ','AL BAJAR EL TUBO EL SEGURO SE ATASCA Y SE MANTIENE PANTALLA ENCENDIDA.','LIC. SAAVEDRA/IMAGINOLOGÍA    ','2025-04-08','2:45 PM         ','',' ','',' ','JOSÉ CASTILLO                 ','',0,0,0,0,0,0,0,0,'08/04/2025 02:55:02 PM',' ',2,'','','','','','','','','',44,0),(63,'GARANTIA','0373-2025',' ','4200447584       ','M. CORRECTIVO','2025-04-08','119257','RECIBIDO A SATISFACCIÓN EL 30/03/2023.','DAYRA/HEALTHCARE              ','2025-04-08','2:30 PM   ',' ',' ',' ','REVISIÓN DE LA CAMILLA.','DR. DE WITT/URGENCIAS         ','',' ','CAMILLA ASIGNADA AL SERVICIO DE URGENCIAS SEGÚN NOTA 150/SU-HST.',' ','',' ','JOSÉ CASTILLO                 ','',0,0,0,0,0,0,0,0,'08/04/2025 02:58:11 PM',' ',0,'','','','','','','','','',23,0),(64,'CONTRATO','0374-2025','EN TRÁMITE       ',' ','M. CORRECTIVO','2025-04-09','61498','CONTRATO GESTIONADO  MEDIANTE NOTA N° 25-229-SBM-HST POR CONDUCTO DE LA DIRECCIÓN MÉDICA.','MARIA LOURDES/PROMED          ','09/04/2025','7:25 AM   ',' ',' ',' ','INSUFICIENCIA DE AGUA, WATER SUPPLY/ Y FALTA DE SAL','LIC. LISBETH/HEMODIÁLISIS     ','09/04/2025','7:23 AM         ','',' ','/  /',' ','JOSÉ CASTILLO.                ','',0,0,0,0,0,0,0,0,'09/04/2025 08:00:39 AM',' ',2,'2025-04-09','','','','','','','','',44,2),(65,'CONTRATO','0375-2025','31-2024          ',' ','REVISION','2025-04-09','64971','CONTRATO GESTIONADO MEDIANTE NOTA N° 24-628-SBM-HST POR CONDUCTO DE LA DIRECCIÓN MÉDICA GENERAL.',' ','',' ',' ',' ',' ','INSPECCIÓN GENERAL',' ','',' ','COORDINADO SEGÚN CRONOGRAMA Y DISPONIBILIDAD.',' ','',' ','JOSÉ CASTILLO.                ','',1,0,0,0,0,0,0,0,'09/04/2025 08:08:28 AM',' ',1,'','1','40301               ','2025-04-29','2025-04-29','SE VERIFICA LÁMPARAS, VENTILADOR, BOCINA, PC, SOFTWARE. EQUIPO FUNCIONAL. HORA DE USO DE LAMPARAS 286 HRS Y 27 MIN CALIB. 8/1/2025.','VISITA DEL 16/04/2025 REPROGRAMADA POR DISPONIBILIDAD. PANTALLA CON SIGNOS DE FALLA EN PARTE INFERIOR.',' ','*',31,1),(66,'CONTRATO','0376-2025','4200602634       ',' ','M. PREVENTIVO','2025-04-09','64258','GESTIONADO MEDIANTE ORDEN DE COMPRA N° 4200602634.',' ','',' ',' ',' ',' ','MANTENIMIENTO PREVENTIVO DE ABRIL 2025.',' ','',' ','COORDINADO SEGÚN CRONOGRAMA Y DISPONIBILIDAD.',' ','',' ','JOSÉ CASTILLO.                ','',1,0,0,0,0,0,0,0,'09/04/2025 08:10:56 AM',' ',1,'','1','250410072901918     ','2025-04-09','2025-04-09','TEST DE PRUEBAS DE TARJETAS, VERIFICACIÓN DE PANTALLA, PANEL TÁCTIL, TECLADO, RUEDAS, MOVIMIENTOS Y TRANSDUCTORES.','',' ','*',44,1),(67,'CONTRATO','0377-2025','4200598718       ',' ','M. CORRECTIVO','2025-04-09','63177','GESTIONADO MEDIANTE ORDEN DE COMPRA N° 4200598718.','GRACE/ELECT. MÉDICA           ','2025-04-09','8:42 AM   ',' ',' ',' ','MENSAJE \"UNABLE TO LOG YOU ON BECAIUSE YOUR ACCOUNT HAS BEEN LOCKED OUT\"','LIC. LILIANA/IMAGINOLOGÍA     ','2025-04-09','8:40 AM         ','',' ','',' ','JOSÉ CASTILLO.                ','',0,0,0,0,0,0,0,0,'09/04/2025 09:05:22 AM',' ',2,'','','','','','','','','',16,0),(68,'CONTRATO','0378-2025','15-2023          ',' ','M. CORRECTIVO','2025-04-09','67794','EQUIPO BAJO CONTRATO REFRENDADO N° 15-2023.','MARLINA/ELECT. MÉDICA.        ','2025-04-09','10:38 AM  ',' ',' ',' ','ALARMA DE LA BATERÍA.','SEC. YASIRA/CARDIOLOGÍA       ','2025-04-09','10:38 AM        ','',' ','',' ','JOSÉ CASTILLO.                ','',0,0,0,0,0,0,0,0,'09/04/2025 10:51:49 AM',' ',1,'','1','ANULADO             ','','','LA ALARMA DE LA BATERÍA CORRESPONDÍA A OTRO EQUIPO.','',' ','*',16,1),(69,'CONTRATO','0379-2025','EN TRÁMITE       ',' ','M. CORRECTIVO','2025-04-09','37826','GESTIONADO MEDIANTE NOTA N° 25-129-SBM-HST POR CONDUCTO DE LA DIRECCIÓN MÉDICA GENERAL. EL 20/2/2025.',' ','',' ','JULIO RODRÍGUEZ.              ',' ',' ','CAMBIO DE SWITCH DEL DOCK, PROBLEMAS CON LA CAMILLA. N/P 46-136334P56.',' ','',' ','PARTE SOLICITADA EN REPORTE ANTERIOR.',' ','',' ','JOSÉ CASTILLO.                ','',1,0,0,0,0,0,0,0,'09/04/2025 12:32:39 PM',' ',1,'','1','250416131001078     ','2025-04-16','2025-04-16','REEMPLAZO DEL SWITCH DEL PEDAL QUE SUBE LA CAMILLA AUTOMATICAMENTE EN EL ÁREA DEL DOCK. SE REALIZA PRUEBA DE FUNCIONAMIENTO. EQUIPO OPERA CON NORMALIDAD.','','SWITCH DE DOCK N/P 46136334P56                                                                                                                          ','*',44,1),(70,'CONTRATO','0380-2025','4200602634       ',' ','M. CORRECTIVO','2025-04-09','64244','CONTRATO GESTIONADO POR ORDEN DE COMPRA N° 4200602634 POR 4 MESES.',' ','',' ','EMILIO BUENO                  ',' ',' ','REEMPLAZO DE PIEZAS (LOCUST BOARD N/P 800812323 Y FIRE FLY N/P 535000-2',' ','',' ','PIEZAS SOLICITADAS EN REPORTE ANTERIOR.',' ','',' ','JOSÉ CASTILLO.                ','',0,0,1,0,1,0,1,0,'09/04/2025 01:46:06 PM',' ',1,'','1','250318143501918     ','2025-04-09','2025-04-16','SE REALIZA PEDIDO DE FIREFLY Y BOMBILLO DE COLIMADOR, CABLE AC YOYO, EQUIPO MUESTRA INCONVENIENTES CON LA COLUMNA Y NO PERMITE CALIBRAR EL NADDLE.','','FIREFLY, LAMPARA, HORIZONTAL ARM ASSEMBLY, DRIVER HANDLE, CORD REEL WITH PLUG.                                                                          ','*',44,1),(71,'CONTRATO','0381-2025','07-2025          ',' ','M. CORRECTIVO','2025-04-09','68462','GESTIONADO MEDIANTE NOTA N° 2025-067-SBM-HST POR CONDUCTO DE LA DIRECCIÓN MÉDICA GENERAL.','CASTILLERO/ENDOSERVICE        ','2025-04-09','          ',' ',' ',' ','PRESENTA PRUEBA DE FUGA POSITIVA.','DR. JAN CUBILLA/GASTRO        ','2025-04-09','1:32 PM         ','',' ','',' ','JOSÉ CASTILLO.                ','',0,0,0,0,0,0,0,0,'09/04/2025 02:03:41 PM',' ',1,'','','','','','','','','',17,0),(72,'GARANTIA  ','0382-2025','                    ','4200535878          ','M. PREVENTIVO','2025-04-10','160427','EQUIPO RECIBIDO A SATISFACCIÓN EL 3/09/2024.','                              ','/  /','          ','                              ','          ','          ','MANTENIMIENTO PREVENTIVO DE ABRIL 2025.','                              ','/  /',' ','COORDINADO SEGÚN CRONOGRAMA Y DISPONIBILIDAD.','                              ','/  /','          ','JOSÉ CASTILLO.                ','',1,0,0,0,0,0,0,1,'10/04/2025 08:06:28 AM',' ',1,'2025-04-10','1','250430001001127     ','2025-04-10','2025-04-30','SE REALIZA MP 29/04/2025 CAMBIO DE FILTROS DE SEDIMENTOS Y CARBÓN ACTIVADO, DESINFECCIÓN CON PURISTERIL, CHECK DE RESIDUOS DE PURISTERIL, PRUEBAS DE FUNCIONAMIENTO. SE ADJUNTA TSC DEL FABRICANTE.','EQUIPO SIN MÁQUINA DE HMD O RIÑÓN, NO SE PUEDE TOMAR MUESTRA.','FILTRO DE 5 MICRAS/FILTRO DE CARBÓN ACTIVADO.                                                                                                           ','*',44,1),(73,'CONTRATO  ','0383-2025','4200602634','                    ','OTROS','/  /','64242','CONTRATO GESTIONADO MEDIANTE ORDEN DE COMPRA 4200602634. POR UN PERIODO DE 4 MESES.','                              ','/  /','          ','                              ','          ','          ','PRUEBAS DE CONTROL DE CALIDAD','                              ','/  /',' ','COORDINADO SEGÚN CRONOGRAMA Y DISPONIBILIDAD CON PERSONAL DE PROTECCIÓN RADIOLÓGICA.','                              ','/  /','          ','JOSÉ CASTILLO.                ','',1,0,0,0,0,0,0,0,'11/04/2025 02:59:19 PM',' ',2,'','1','250509145601075     ','2025-04-10','2025-04-29','SE REPROGRAMA. 29/04/2025 SE PROCEDIÓ A LAS PRUEBAS DE SALUD RADIOLÓGICAS DEL EQUIPO, SIGUIENDO LA PLANTILLA Y MANUAL DE LAS PRUEBAS, SE REALIZA PRUEBA DE CONGRUENCIA, PUNTO FOCAL,CAPA HEMIREDUCTORA, LINEALIDAD, ENTRE OTRAS.','',' ','*',44,2),(74,'CONTRATO','0384-2025','07-2025          ',' ','M. PREVENTIVO','2025-04-10','64086','GESTIONADO MEDIANTE NOTA N°2025-067-SBM-HST POR CONDUCTO DE LA DIRECCIÓN MÉDICA GENERAL.',' ','',' ',' ',' ',' ','MANTENIMIENTO PREVENTIVO DE ABRIL 2025.',' ','',' ','COORDINADO SEGÚN CRONOGRAMA Y DISPONIBILIDAD.',' ','',' ','JOSÉ CASTILLO.                ','',1,0,0,0,0,0,0,0,'10/04/2025 08:22:51 AM',' ',1,'','1','5751                ','2025-04-10','2025-04-10','VERIFICACIÓN DE PARÁMETROS DE IMPRESIÓN,CABLES Y CONECTORES, LIMPIEZ GENERAL. PRUEBA DE FUNCIONAMIENTO.','',' ','*',17,1),(75,'CONTRATO','0385-2025','07-2025          ',' ','M. PREVENTIVO','2025-04-10','64088','GESTIONADO MEDIANTE NOTA N° 2025-067-SBM-HST POR CONDUCTO DE LA DIRECCIÓN MÉDICA GENERAL.',' ','',' ',' ',' ',' ','MANTENIMIENTO PREVENTIVO DE ABRIL 2025.',' ','',' ','COORDINADO SEGÚN CRONOGRAMA Y DISPONIBILIDAD.',' ','',' ','JOSPE CASTILLO.               ','',1,0,0,0,0,0,0,0,'10/04/2025 08:25:13 AM',' ',1,'','1','5752                ','2025-04-10','2025-04-10','VERIFICACIÓN DE CABEZAL, MECANISMO INTERNO, LIMPIEZA GENERAL. PRUEBA DE FUNCIONAMIENTO. OK','',' ','*',17,1),(76,'CONTRATO','0386-2025','07-2025          ',' ','M. PREVENTIVO','2025-04-10','64087','GESTIONADO MEDIANTE NOTA N° 2025-067-SBM-HST POR CONDUCTO DE  LA DIRECCIÓN MÉDICA GENERAL.',' ','',' ',' ',' ',' ','MANTENIMIENTO PREVENTIVO DE ABRIL 2025.',' ','',' ','COORDINADO SEGÚN CRONOGRAMA Y DISPONIBILIDAD.',' ','','          ','JOSÉ CASTILLO.                ','',1,0,0,0,0,0,0,0,'10/04/2025 08:27:44 AM',' ',1,'','1','5753                ','2025-04-10','2025-04-10','SE REALIZÓ VERIFICACIÓN DEL FLUJO DE SUCCIÓN, MECANISMO INTERNO, MANGUERA Y FILTRO. LIMPIEZA GENERAL.','','                                                                                                                                                                                                                                                              ','*',17,1),(77,'CONTRATO','0387-2025','07-2025          ',' ','M. PREVENTIVO','2025-04-10','64082','GESTIONADO MEDIANTE NOTA N° 2025-067-SBM-HST POR CONDUCTO DE LA DIRECCIÓN MÉDICA GENERAL.',' ','',' ',' ',' ',' ','MANTENIMIENTO PREVENTIVO DE ABRIL 2025.',' ','',' ','COORDINADO SEGÚN CRONOGRAMA Y DISPONIBILIDAD.',' ','',' ','JOSÉ CASTILLO.                ','',0,0,1,0,0,1,0,0,'10/04/2025 08:29:54 AM',' ',2,'','1','5754                ','2025-04-10','2025-04-10','EQUIPO SE ENCUENTRA EN BIOMÉDICA FUERA DE SERVICIO  POR DAÑO MAYOR. SE REPROG. MP.','CON COTIZACIÓN N°3586 DE 3862.00',' ','*',17,2),(78,'CONTRATO','0388-2025','TRÁMITE          ',' ','M. PREVENTIVO','2025-04-10','68469','GESTIONADO MEDIANTE NOTA N° 2025-067-SBM-HST POR CONDUCTO DE LA DIRECCIÓN MÉDICA GENERAL.',' ','',' ',' ',' ',' ','MANTENIMEINTO PREVENTIVO DE ABRIL 2025.',' ','',' ','COORDINADO SEGÚN CRONOGRAMA Y DISPONIBILIDAD.',' ','',' ','JOSÉ CASTILLO.                ','',1,0,0,0,0,0,0,0,'10/04/2025 08:51:53 AM',' ',1,'','1','5755                ','2025-04-10','2025-04-10','VERIFICACIÓN DE PARÁMETROS DEFUNCIONAMIENTO DE ACUERDO AL CHECK LIST DE INSPECCIÓN ADJUNTO.PRUEBA DE FUNCIONAMIENTO.','','                                                                                                                                                                                                                                                              ','*',17,1),(79,'GARANTIA','0389-2025',' ','4200510162       ','M. CORRECTIVO','2025-04-10','120021','EQUIPO RECIBIDO A SATISFACCIÓN EL 11/12/2023.','MERIL/MED. INTERNACIONAL.     ','2025-04-10','8:20 AM   ',' ',' ',' ','PC DESCARGADA TOTALMENTE A PESAR DE ESTAR CONECTADA.','LIC. IDAYRA/NEUMOLOÍA         ','2025-04-10','8:15 AM         ','',' ','',' ','JOSÉ CASTILLO.                ','',0,0,0,0,0,0,0,0,'10/04/2025 09:23:13 AM',' ',1,'','','','','','','','','',24,1),(80,'GARANTIA','0390-2025',' ','4200526264       ','M. CORRECTIVO','2025-04-09','131544','','JONATHAN ZAMORA/OBRIGADO      ','2025-04-08','2:34 PM   ',' ',' ',' ','REVISIÓN DE LA CAMILLA.','DR. DE WITT/URGENCIAS         ','2025-04-09','1:41 PM         ','EQUIPO ENTRO DIRECTO AL SERVICIO, NO HAY EXPEDIENTE REGISTRADO EN BIOMÉDICA.',' ','',' ','JOSÉ CASTILLO.                ','',0,0,0,0,0,0,0,0,'10/04/2025 09:48:49 AM',' ',0,'','','','','','','','','',75,0),(81,'GARANTIA','0391-2025',' ','4200526264       ','M. CORRECTIVO','2025-04-09','131543','',' ','',' ',' ',' ',' ','REVISIÓN DE LA CAMILLA.',' ','',' ','EQUIPO ENTRÓ DIRECTO POR EL SERVICIO, NO HAY EXPEDIENTE CON INFORMACIÓN DETALLADA DE LA ORDEN Y RECIBIDO.',' ','',' ','JOSÉ CASTILLO.                ','',0,0,0,0,0,0,0,0,'10/04/2025 09:51:15 AM',' ',0,'','','','','','','','','',75,0),(82,'CONTRATO','0392-2025','13-2023          ',' ','REVISION','2025-04-11','65995','GESTIONADO CON NOTA N° 0251-23-SBM-HST EL 28/4/2023 POR CONDUCTO DE LA DIRECCIÓN MÉDICA GENERAL. CONTRATO REFRENDADO.',' ','',' ',' ',' ',' ','INSPECCIÓN GENERAL',' ','',' ','COORDINADO SEGÚN CRONOGRAMA Y DISPONIBILIDAD.',' ','',' ','JOSÉ CASTILLO.                ','',1,0,0,0,0,0,0,0,'11/04/2025 07:55:48 AM',' ',1,'','1','39336               ','2025-04-11','2025-04-11','VERIFICACIÓN GENERAL DEL TOMÓGRAFO, MOVIMIENTO DEL GANTRY, DETECTOR , MESA SIN ERRORES. SE REALIZA HOME POSITION DEL EQUIPO, REVISIÓN DE UPS DEL SPECT CT, ENVÍO DE IMÁGENES AL PACS. REVISIÓN DE SEGURIDAD Y TOUCH PAD.','',' ','*',31,1),(83,'GARANTIA','0393-2025',' ','4200538044       ','M. PREVENTIVO','2025-04-11','160531','',' ','',' ','JHONSON CEBALLOS.             ',' ',' ','MANTENIMIENTO PREVENTIVO DE ABRIL 2025.',' ','',' ','REVISIÓN INCLUYE REVISIÓN DE TODOS LOS COMPONENES ID 33462/35049/33463/35055',' ','',' ','JOSÉ CASTILLO                 ','',1,0,0,0,0,0,0,0,'11/04/2025 08:00:01 AM',' ',1,'','1','250428195101086     ','2025-04-04','2025-04-04','EQUIPO EN USO, SE REPROGRAMA MANTENIMIENTO PARA CUANDO LLEGUE FUENTE Y EL INSUFLADOR Y SE COORDINE DISPONIBILIDAD.','',' ','*',44,1),(84,'GARANTIA','0395-2025',' ','4800078822       ','M. CORRECTIVO','2025-04-11','110172','RECIBIDO A SATISFACCIÓN EL 7/10/2025 .','MARICRUZ/PROMED               ','2025-04-11','9:41 AM   ',' ',' ',' ','REVISIÓN DEL MARCO DE MANIGUETA DEL AREA DE COMPARTIMENTO DEL BLOQUE ELECTRÓNICO.','LIC. ADALBERTO/SOP PERFUSIÓN  ','2025-04-11','9:27 AM         ','',' ','',' ','JOSÉ CASTILLO.                ','',0,0,0,0,0,0,0,0,'11/04/2025 10:56:55 AM',' ',0,'','','','','','','','','',44,0),(85,'CONTRATO','0396-2025','EN TRÁMITE       ',' ','M. CORRECTIVO','2025-04-11','70417','SE GESTIONA MEDIANTE NOTA N°24-840-SBM-HST DEL 29/11/2024 POR CONDUCTO DE LA DIRECCIÓN MÉDICA GENERAL. ','MIGUEL /DRAEGUER              ','2025-04-11','11:48 AM  ',' ',' ',' ','NO PASÓ EL TEST. REVISAR VÁLVULAS.','LIC. SERRANO/SOP MATERNIDAD.  ','2025-04-11','11:45 AM        ','',' ','',' ','JOSÉ CASTILLO.                ','',1,0,0,0,0,0,0,0,'11/04/2025 12:10:02 PM',' ',1,'','1','30148               ','2025-04-12','2025-04-12','LIMPIEZA DEL SISTEMA DE PACIENTE, PRESENTABA EXCESO DE PARTÍCULAS PEQUEÑAS DE LA CAL SODADA LO CUAL RESECÓ LOS SELLOS Y ORINGS DEL SISTEMA DE PACIENTE SE LIMPIÓ Y FALLO SE CORRIGIÓ. PRUEBA DE FUNCIONAMIENTO OK.','',' ','*',13,1),(86,'GARANTIA','0397-2025',' ','4200537904       ','REVISION','2025-04-11','160499','EQUIPO RECIBIDO A SATISFACCIÓN EL 18/10/2024.',' ','',' ',' ',' ',' ','RECARGA DE SAL',' ','',' ','SE COORDINA SEGÚN INSPECCIÓN.',' ','',' ','JOSÉ CASTILLO.                ','',1,0,0,0,0,0,0,0,'11/04/2025 02:02:31 PM',' ',1,'','1','0988                ','2025-04-11','2025-04-11','SE COLOCÓ UN SACO DE SAL POLLET EN EL ABLANDADOR DE AGUA QUE ESTÁ INSTALADO EN EL LAVADORA.','','CONSUMIBLE \"1 SACO DE SAL\"                                                                                                                              ','*',65,1),(87,'GARANTIA','0398-2025',' ','4200533572       ','REVISION','2025-04-11','160425','RECIBIDO A SATISFACCIÓN EL 27/08/2024.',' ','',' ',' ',' ',' ','RECARGA DE SAL',' ','',' ','SE COORDINA SEGÚN INSPECCIÓN CON EL SERVICIO.',' ','',' ','JOSÉ CASTILLO.                ','',1,0,0,0,0,0,0,0,'11/04/2025 02:20:44 PM',' ',1,'','1','2237                ','2025-04-11','2025-04-11','SE REALIZA RECARGA DE SAL  PELOT A CBS CALSIFICADOR. EQUIPO 100% OPERATIVO.','','1 SACO DE SAL                                                                                                                                           ','*',65,1),(88,'CONTRATO','0399-2025','4200602634       ',' ','M. PREVENTIVO','2025-04-14','64241','CONTRATO GESTIONADO MEDIANTE ORDEN DE COMPRA N° 4200602634.',' ','',' ',' ',' ',' ','PRUEBAS DE CONTROL DE CALIDAD.',' ','',' ','COORDINADO SEGÚN CRONOGRAMA Y DISPONIBILIDAD CON PERSONAL DE PROTECCIÓN RADIOLÓGICA.',' ','',' ','JOSÉ CASTILLO.                ','',1,0,0,0,0,0,0,0,'14/04/2025 07:42:12 AM',' ',1,'','1','250509153001075     ','2025-04-14','2025-04-29','SE REPROGRAMÓ MP. 29/04/2025 SE REALIZAN PRUEBAS DE SALUD RADIOLÓGICA DEL EQUIPO. SIGUIENDO LA PLANTILLA Y MANUAL DE PRUEBAS, DONDE SE REALIZARON PRUEBA DE CONGRUENCIA, PUNTO FOCAL, CAPA HEMIREDUCTORA, LINEALIDAD ENTRE OTRAS.','',' ','*',44,1),(89,'GARANTIA  ','0400-2025','                    ','4200518630','M. PREVENTIVO  ','2025-04-14','131257','EQUIPO RECIBIDO A SATISFACCIÓN EL 03/01/2023.','                              ','/  /','          ','                              ','          ','          ','MANTENIMIENTO PREVENTIVO DE ABRIL 2025.','                              ','/  /',' ','COORDINADO SEGÚN CRONOGRAMA Y DISPONIBILIDAD.','                              ','/  /','          ','JOSÉ CASTILLO.                ','',1,0,0,0,0,0,0,0,'14/04/2025 08:31:14 AM',' ',1,'2025-04-14','1','31167               ','2025-04-14','2025-04-14','VERIFICACIÓN ELECTRÓNICA DEL EQUIPO, OS Y SOFTWARE, MONITOR, PANEL DECONTROL Y PANTALLA TÁCTIL, HDD ALMACENAMIENTO, PRUEBA DE TRANSDUCTOR LINEAL CONVEXO, PRUEBA DE IMPRESORA DESDE TECLADO, LIMPIEZA GENEARL.','','                                                                                                                                                                                                                                                              ','*',68,1),(90,'GARANTIA  ','0401-2025','                    ','4200514657','M. PREVENTIVO  ','2025-04-14','131256','EQUIPO RECIBIDO A SATISFACCIÓN EL 03/01/2024.','                              ','/  /','          ','                              ','          ','          ','MANTENIMIENTO PREVENTIVO DE ABRIL 2025.','                              ','/  /',' ','COORDINADO SEGÍN CRONOGRAMA Y DISPONIBILIDAD.','                              ','/  /','          ','JOSÉ CASTILLO.                ','',1,0,0,0,0,0,0,0,'14/04/2025 08:30:18 AM',' ',1,'2025-04-14','1','31162               ','2025-04-14','2025-04-14','VERIFICACIÓN ELECTRÓNICA DEL EQUIPO, OS Y SOFTWARE, MONITOR, PANEL DECONTROL Y PANTALLA TÁCTIL, HDD UTILIZADO 1%, PRUEBA DE TRANSDUCTOR LINEAL CONVEXO, PRUEBA DE IMPRESORA DESDE TECLADO, LIMPIEZA GENEARL.','',' ','*',68,1),(91,'GARANTIA  ','0402-2025','                    ','4200510980','M. PREVENTIVO  ','2025-04-14','131255','EQUIPO RECIBIDO A SATISFACCIÓN EL 10/01/2023.','                              ','/  /','          ','                              ','          ','          ','MANTENIMIENTO PREVENTIVO DE ABRIL 2025.','                              ','/  /',' ','COORDINADO SEGÚN CRONOGRAMA Y DISPONIBILIDAD.','                              ','/  /','          ','JOSÉ CASTILLO.                ','',1,0,0,0,0,0,0,0,'14/04/2025 08:29:24 AM',' ',1,'2025-04-14','1','31163               ','2025-04-14','2025-04-14','VERIFICACIÓN ELECTRÓNICA DEL EQUIPO, OS Y SOFTWARE, MONITOR, PANEL DECONTROL Y PANTALLA TÁCTIL, HDD UTILIZADO 2%, PRUEBA DE TRANSDUCTOR LINEAL CONVEXO, VAGINAL, PRUEBA DE IMPRESORA DESDE TECLADO, LIMPIEZA GENEARL.','','                                                                                                                                                                                                                                                              ','*',68,1),(92,'GARANTIA','0403-2025',' ','C51-2023 M       ','M. PREVENTIVO','2025-04-14','2324113304','EQUIPO RECIBIDO A SATISFACCIÓN EL 07/04/2025.',' ','',' ',' ',' ',' ','MANTENIMIENTO DEL SISTEMA DE BIOPSIA CON PERSONAL DE PROMED.',' ','',' ','COORDINADO SEGÚN CRONOGRAMA Y DISPONIBILIDAD.',' ','',' ','JOSÉ CASTILLO.                ','',1,0,0,0,0,0,0,0,'14/04/2025 08:09:48 AM',' ',1,'','1','250422191001934     ','2025-04-22','2025-04-22','REVISIÓN DEL TUBO DE VACÍO EN LA PARTE SUPERIOR DEL MÓDULO DE CONTROL, CABLES Y CONECTORES, BLOQUEOS DE LAS RUEDAS DEL CARRO Y TORNILLO DE TOPE DELANTERO PARA FIJACIÓN DEL MÓDULO DE CONTROL AL CARRO. PRUEBAS DE FUNCIONAMIENTO ENCENDIDO Y APAGADO DEL EQUIPO.','',' ','*',45,1),(93,'GARANTIA','0405-2025',' ','4200537741       ','M. PREVENTIVO','2025-04-14','159767','EQUIPO RECIBIDO A SATISFACCIÓN EL 30/05/2024.',' ','',' ',' ',' ',' ','MANTENIMIENTO PREVENTIVO DE ABRIL 2025',' ','',' ','COORDINADO SEGÚN DISPONIBILIDAD DEL SERVICIO.',' ','',' ','JOSÉ CASTILLO.                ','',1,0,0,0,0,0,0,0,'14/04/2025 08:54:12 AM',' ',1,'','1','403531104           ','2025-04-14','2025-04-14','LIMPIEZA, CALIBRACIÓN DEL SENSOR DE O2, PRUEBA DE FUNCIONAMIENTO COMPLETA, ATG, ATC, PRUEBA DE VENTILACIÓN CON PULMÓN DE PRUEBA, EQUIPO NO PRESENTA ERRORES NI FALLAS Y ES APTO PARA SU USO.','',' ','*',40,1),(94,'CONTRATO','0406-2025','EN TRÁMITE       ',' ','M. CORRECTIVO','2025-04-14','37826','GESTIONADO MEDIANTE NOTA N° 25-129-SBM-HST POR CONDUCTO DE LA DIRECCIÓN MÉDICA GENERAL.','MARGARITA/PROMED              ','2025-04-14','8:38 AM   ',' ',' ',' ','NO DEJA HACE PERFUSIONES Y EN LAS SECUENCIAS DE DIFUSIONES SE ENVUELVE EN RM DE CEREBRO.','LIC. DE ARRIBA/RESONANCIA     ','2025-04-14','8:24 AM         ','',' ','',' ','JO´SE CASTILLO.               ','',1,0,0,0,0,0,0,0,'14/04/2025 08:59:20 AM',' ',1,'','1','250414143401078     ','2025-04-14','2025-04-14','VERIFICAR IMÁGENES SE VEN SOBREPUESTAS, SE PIDE A USUARIO LIBERAR ESPACIO DEL DISCO DURO, SE COORDINA CON APLICACIONISTA HECTOR LA REVISIÓN DE PROTOCOLOS, SE REALIZA PRUEBA DE FUNCIONAMIENTO, EQUIPO NO PRESENTÓ FALLA ALGUNA. USUARIO LIBERA ESPACIO EN DISCO DE 88% A 72 % EQUIPO OPERA CON NORMALIDAD.','',' ','*',44,1),(95,'GARANTIA','0407-2025',' ','4200552851       ','M. CORRECTIVO','2025-04-14','160426','EQUIPO RECIBIDO A SATISFACCIÓN EL 30/08/2024.','ING. OLGA/INV. SAGRAV         ','2025-04-14','9:30 AM   ',' ',' ',' ','LA PUERTA NO CIERRA BIÉN Y NO CENTRIFUGA.','LIC. BALLESTEROS/BANCO DE SANG','2025-04-14','9:05 AM         ','',' ','',' ','JOSÉ CASTILLO.                ','',1,0,0,0,0,0,0,0,'14/04/2025 09:39:49 AM',' ',1,'','1','57351/53449         ','2025-04-16','2025-04-17','INTERRUPTOR DE PUERTA NO ACCIONA, INTERRUPTOR DE PURTA SE QUEBRÓ PIN, SE MODIFICA PARA QUE FUNCIONE, REQUIERE CAMBIO.','',' ','*',30,1),(96,'CONTRATO','0408-2025','EN TRÁMITE       ',' ','M. PREVENTIVO','2025-04-15','61496','CONTRATO GESTIONADO MEDIANTE NOTA N°25-229-SBM-HST POR CONDUCTO DE LA DIRECCIÓN MÉDICA.',' ','',' ',' ',' ',' ','MANTENIMIENTO PREVENTIVO DE ABRIL 2025.','                              ','',' ','COORDINADO SEGÚN CRONOGRAMA Y DISPONIBILIDAD.',' ','',' ','JOSÉ CASTILLO.                ','',1,0,0,0,0,0,0,1,'15/04/2025 07:51:43 AM',' ',1,'','1','250505130601081     ','2025-04-15','2025-04-29','SE REALIZA CAMBIOS DE FILTROS DE ENTRADA DE AGUA, CHECK DE NIVEL DE SAL, PRUEBA DE FUNCIONAMIENTO EN MODO SUPPLY-RINSE, DESINFECCIÓN CON PURISTERIL, CHECK DE RECIDUOS DE PURISTERIL, PRUEBAS DE FUNCIONAMIENTO, SE ADJUNTA TSC DEL FABRICANTE.','VISITA DEL 15/04/2025 SE REPROGRAMA PARA EL 29/04/2025 POR DISPONIBILIDAD DEL EQUIPO','FILTRO DE 5 MICRA Y FILTRO DE CARBÓN ACTIVADO.                                                                                                                                                                                                                ','*',44,1),(97,'CONTRATO  ','0409-2025','TRÁMITE   ','                    ','M. PREVENTIVO  ','2025-04-15','63232','GESTIONADO MEDIANTE NOTA N° 25-090-SBM-HST POR CONDUCTO DE LA DIRECCIÓN MÉDICA GENERAL DEL 13/2/2025.','                              ','/  /','          ','                              ','          ','          ','MANTENIMIENTO PREVENTIVO DE ABRIL 2025.','                              ','/  /',' ','COORDINADO SEGÚN CRONOGRAMA Y DISPONIBILIDAD.','                              ','/  /','          ','JOSÉ CASTILLO.                ','',1,0,0,0,0,0,0,0,'03/06/2025 09:04:33 AM',' ',1,'2025-04-15','1','TSO48429            ','2025-04-15','2025-04-15','SE REALIZA MANTENIMIENTO PREVENTIVO DE ACUERDO AL CHECKLIST DEL EQUIPO. EL SISTEMA SE MANTIENE FUNCIONAL.','SE ADJUNTA CHECKLIST DE ACTIVIDADES REALIZADAS.',' ','*',16,1),(98,'CONTRATO','0410-2025','EN TRÁMITE       ',' ','M. PREVENTIVO','2025-04-14','64256','GESTIONADO MEDIANTE NOTA N°25-129-SBM-HST POR CONDUCTO DE LA DIRECCIÓN MÉDICA GENERAL DEL 20/2/2025.',' ','',' ',' ',' ',' ','MANTENIMIENTO PREVENTIVO DE ABRIL 2025.',' ','',' ','COORDINADO SEGÚN CRONOGRAMA Y DISPONIBILIDAD.',' ','',' ','JOSÉ CASTILLO.                ','',1,0,0,0,0,0,0,0,'15/04/2025 08:06:52 AM',' ',1,'','1','250415101601108     ','2025-04-15','2025-04-15','REVISIÓN DE LA ESTACIÓN DE TRABAJO, LIBERACIÓN DE DISCO, VERIFICACIÓN DE APLICACIONES Y CONFIGURACIONES, LIMPIEZA GENERAL. SE ADJUNTA CHECK LIST.','',' ','*',44,1),(99,'GARANTIA','0411-2025',' ','4200510162       ','M. PREVENTIVO','2025-04-15','120021','EQUIPO RECIBIDO A SATISFACCIÓN EL 11/12/2023.',' ','',' ',' ',' ',' ','MANTENIMIENTO PREVENTIVO DE ABRIL 2025.',' ','',' ','COORDINADO SEGÚN CRONOGRAMA Y DISPONIBILIDAD.',' ','',' ','JOSÉ CASTILLO.                ','',1,0,0,0,0,0,0,0,'15/04/2025 08:09:21 AM',' ',1,'','1','40456               ','2025-06-16','2025-06-16','REVISIÓN GENERAL VERIFICACIÓN DE FUNCIONABILIDAD. AJUSTE DE SOFTWARE DE EXPIROMETRÍA, VERIFICACIÓN DE CONDICIONES DE BATERÍA DE RESPALDO, PRUEBA DE UPS, SOFTWARE Y SENSOR DE ESPIROMETRIA FUNCIONAL.','',' ','*',24,1),(100,'GARANTIA','0412-2025',' ','4200533612       ','M. PREVENTIVO','2025-04-15','159753','EQUIPO RECIBIDO A SATISFACCIÓN EL 30/05/2024.',' ','',' ',' ',' ',' ','MANTENIMIENTO PREVENTIVO DE ABRIL 2025',' ','',' ','COORDINADO SEGÚN CRONOGRAMA Y DISPONIBILIDAD.',' ','',' ','JOSÉ CASTILLO.                ','',1,0,0,0,0,0,0,0,'15/04/2025 08:11:15 AM',' ',1,'','1','250422112801126     ','2025-04-15','2025-04-21','15/4 REPROG. MP. 21/4 SE REALIZA MP, SE VERIFICO MOVIMEINTOS EN CADA POSICIÓN, FRENOS, RODAJES, LIMPIEZA COMPLETA, SE VERIFICAN VOLTAJES Y CARGA DE LAS BATERIAS.','',' ','*',44,1),(101,'GARANTIA','0413-2025',' ','4200533612       ','M. PREVENTIVO','2025-04-15','159752','EQUIPO RECIBIDO A SATISFACCIÓN EL 30/05/2025.',' ','',' ',' ',' ',' ','MANTENIMIENTO PREVENTIVO DE ABRIL 2025.',' ','',' ','COORDINADO SEGÚN CRONOGRAMA Y DISPONIBILIDAD.',' ','',' ','JOSÉ CASTILLO.                ','',1,0,0,0,0,0,0,0,'15/04/2025 08:17:17 AM',' ',1,'','1','250422112201126     ','','','15/4 SE REPROGRAMA MP. 21/4 SE VERIFICA MOVIMIENTOS EN CADA POSICIÓN Y RODAJES, SE EFECTUÓ LIMPIEZA COMPLETA DEL EQUIPO. SE VERIFICÓ VOLTAJES Y CARGA DE LAS BATERIAS. CHECK ADJUNTO.','','                                                                                                                                                        ','*',44,1),(102,'CONTRATO','0414-2025','07-2025          ',' ','M. PREVENTIVO','2025-04-15','68468','GESTIONADO MEDIANTE NOTA N°2025-067-SBM-HST POR CONDUCTO DE LA DIRECCIÓN MÉDICA GENERAL.',' ','',' ',' ',' ',' ','MANTENIMIENTO PREVENTIVO DE ABRIL 2025',' ','',' ','COORDINADO SEGÚN CRONOGRAMA Y DISPONIBILIDAD.',' ','',' ','JOSÉ CASTILLO.                ','',1,0,0,0,0,0,0,0,'15/04/2025 08:32:45 AM',' ',1,'','1','5817                ','2025-04-15','2025-04-15','SE VERIFICA PIG TAIL, CABLES, CONECTORES Y MECANISMO INTERNO, SE HIZO LIMPIEZA GENERAL. PRUEBAS DE FUNCIONAMIENTO.','',' ','*',17,1),(103,'CONTRATO','0415-2025','07-2025          ',' ','M. PREVENTIVO','2025-04-15','38001','GESTIONADO MEDIANTE NOTA N° 2025-067-SBM-HST POR CONDUCTO DE LA DIRECCIÓN MÉDICA GENERAL.',' ','',' ',' ',' ',' ','MANTENIMIENTO PREVENTIVO DE ABRIL 2025.',' ','',' ','COORDINADO SEGÚN CRONOGRAMA Y DISPONIBILIDAD.',' ','',' ','JOSÉ CASTILLO.                ','',0,0,1,0,0,0,0,0,'15/04/2025 08:37:34 AM',' ',2,'','1','5814                ','2025-04-15','2025-04-15','DAÑO DE TUBO DE LUZ, DESGASTE EN TUBO DE INSERCIÓN, EN A-RUBBER, DESAJUSTE DE MANDOS. ENVIAR A TALLER PARA EVALUAR.','RE REPROGRAMA MP.','                                                                                                                                                                                                                                                              ','*',17,2),(104,'CONTRATO','0416-2025','07-2025          ',' ','M. PREVENTIVO','2025-04-15','62501','GESTIONADO MEDIANTE NOTA N° 2025-067-SBM-HST POR CONDUCTO DE LA DIRECCIÓN MÉDICA GENERAL.',' ','',' ',' ',' ',' ','MANTENIMIENTO PREVENTIVO DE ABRIL DE 2025.',' ','',' ','COORDINADO SEGÚN CRONOGRAMA Y DISPONIBILIDAD.',' ','',' ','JOSÉ CASTILLO.                ','',1,0,0,0,0,0,0,0,'15/04/2025 08:42:27 AM',' ',1,'','1','5815                ','2025-04-15','2025-04-15','VERIFICACIÓN DE PARÁMETROS DE FUNCIONAMIENTO SEGÚN CHECK LIST ADJUNTO. PRUEBA DE FUCNIONAMIENTO.','',' ','*',17,1),(105,'CONTRATO','0417-2025','07-2025          ',' ','M. PREVENTIVO','2025-04-15','31144','GESTIONADO MEDIANTE NOTA N° 2025-067-SBM-HST POR CONDUCTO DE LA DIRECCIÓN MÉDICA.',' ','',' ',' ',' ',' ','MANTENIMIENTO PREVENTIVO DE ABRIL 2025.',' ','',' ','COORDINADO SEGÚN CRONOGRAMA Y DISPONIBILIDAD.',' ','',' ','JOSÉ CASTILLO.                ','',1,0,0,0,0,0,0,0,'15/04/2025 08:44:42 AM',' ',1,'','1','5813                ','2025-04-15','2025-04-15','SE REALIZÓ VERIFICACIÓN DE PARÁMETROS DE FUNCIONAMIENTO DE ACUERDO A CHECKLIST DE INSPECCIÓN ADJUNTO. PRUEBAS DE FUNCIONAMIENTO.','',' ','*',17,1),(106,'CONTRATO  ','0418-2025','TRÁMITE   ','                    ','M. PREVENTIVO  ','2025-04-15','31143','GESTIONADO MEDIANTE NOTA N° 2025-067-SBM-HST POR CONDUCTO DE LA DIRECCIÓN MÉDICA GENERAL.','                              ','/  /','          ','                              ','          ','          ','MANTENIMIENTO PREVENTIVO DE ABRIL 2025','                              ','/  /',' ','COORDINADO SEGÚN CRONOGRAMA Y DISPONIBILIDAD.','                              ','/  /','          ','JOSÉ CASTILLO.                ','',1,0,0,0,0,0,0,0,'15/04/2025 08:49:46 AM',' ',1,'2025-04-15','1','5816                ','2025-04-15','2025-04-15','SE REALIZA VERIFICACIÓN DE LÁMPARA DE XENÓN, CABLES, CONECTORES, LIMPIEZA GENERAL. PRUEBA DE FUNCIONAMIENTO.','',' ','*',17,1),(107,'GARANTIA','0419-2025',' ','4800096289       ','M. CORRECTIVO','2025-04-15','160307','EQUIPO RECIBIDO A SATISFACCIÓN EL 27/06/2025.','MAYLENIS/PROMED               ','2025-04-15','9:32 AM   ',' ',' ',' ','NO MARCA EL TRAZO, SALE MUY CLARO CASI NO SE VE.','DRA ARIS DE MENDIETA/SEGO     ','2025-04-15','9:21 AM         ','',' ','',' ','JOSÉ CASTILLO.                ','',0,0,0,0,0,0,0,0,'15/04/2025 09:35:50 AM',' ',1,'','','','','','','','','',44,1),(108,'CONTRATO  ','0420-2025','TRÁMITE   ','                    ','M. PREVENTIVO  ','2025-04-15','63232','GESTIONADO MEDIANTE NOTA N°25-090-SBM-HST POR CONDUCTO DE LA DIRECCIÓN MÉDICA GENERAL DEL 13/02/2025.','MARLINA/ELECT. MÉDICA.        ','15/04/2025','10:58 AM  ','                              ','          ','          ','LA PANTALLA DEL MONITOR DE LA EXTRAVISIÓN SE APAGÓ DURANTE EL PROCEDIMIENTO.','LIC. YESSICA/HEMODINÁMICA     ','15/04/2025','10:55 AM        ','\r\n\r\n','                              ','/  /','          ','JOSÉ CASTILLO.                ','',1,0,0,0,0,0,0,0,'03/06/2025 09:03:47 AM',' ',1,'2025-04-15','1','TSO48               ','2025-04-15','2025-04-15','SE REALIZA LA VERIFICACIÓN DEL SISTEMA, SE ENCUENTRA CABLE DE VIDEO NO ACOPLADO CORRECTAMENTE, SE RECONECTA Y SE CORRIGE LA FALLA.','SE MANTIENE OBSERVACIÓN.',' ','*',16,1),(109,'CONTRATO','0421-2025','EN TRÁMITE       ',' ','OTROS','2025-04-15','58239','GESTIONADO MEDIANTE NOTA N°25-128-SBM-HST POR CONDUCTO DE LA DIRECCIÓN MÉDICA DEL 20/02/2025.',' ','',' ',' ',' ',' ','TOMA DE MUESTRAS',' ','',' ','',' ','',' ','JOSÉ CASTILLO.                ','',1,0,0,0,0,0,0,0,'15/04/2025 01:59:18 PM',' ',1,'','1','250415111001006     ','2025-04-15','2025-04-15','SE TOMA MUESTRA PARA ANÁLISIS BACTERIOLÓGICO Y ENDOTOXINAS.','',' ','*',44,1),(110,'CONTRATO','0422-2025','EN TRÁMITE       ',' ','M. PREVENTIVO','2025-04-15','58240','GESTIONADO MEDIANTE NOTA N°25-128-SBM-HST POR CONDUCTO DE LA DIRECCIÓN MÉDICA GENERAL DEL 20/02/2025.',' ','',' ',' ',' ',' ','TOMA DE MUESTRAS',' ','',' ','',' ','',' ','JOSÉ CASTILLO.                ','',1,0,0,0,0,0,0,0,'15/04/2025 02:01:16 PM',' ',1,'','1','250415111001006     ','2025-04-15','2025-04-15','SE TOMA MUESTRA PARA ANÁLISIS BACTERIOLÓGICO Y ENDOTOXINAS MES DE ABRIL.','',' ','*',44,1),(111,'GARANTIA','0423-2025',' ','4200522983       ','M. PREVENTIVO','2025-04-16','159761','EQUIPO RECIBIDO A SATISFACCIÓN EL 03/06/2025.',' ','',' ',' ',' ',' ','MANTENIMIENTO PREVENTIVO DE ABRIL 2025',' ','',' ','COORDINADO SEGÚN CRONOGRAMA Y DISPONIBILIDAD.',' ','',' ','JOSÉ CASTILLO.                ','',1,0,0,0,0,0,0,0,'16/04/2025 08:22:13 AM',' ',1,'','1','25042122901053      ','2025-04-16','2025-04-16','SE REALIZA MP SEGÚN INDICACIONES DEL FABRICANTE , LIMPIEZA GENERAL, REVISIÓN DE ACCESORIOS, SE SIMULO ECG,SPO2,PANI,TEMP,RESP,ALARMAS Y ARRITMIAS, FUNCIÓN DE BATERIA OK, COMUNICACIÓN CIC OK, FUNCIONAMIENTO OK.','',' ','*',44,1),(112,'CONTRATO','0424-2025','EN TRÁMITE       ',' ','REVISION','2025-04-16','60966','GESTIONADO MEDIANTE NOTA N°2025-034-SBM-HST POR CONDUCTO DE LA DIRECCIÓN MÉDICA GENERAL DEL 28/01/2025.',' ','',' ',' ',' ',' ','INSPECCIÓN GENERAL',' ','',' ','COORDINADO SEGÚN CRONOGRAMA Y DISPONIBILIDAD.',' ','',' ','JOSÉ CASTILLO.                ','',1,0,0,0,0,0,0,0,'16/04/2025 08:25:46 AM',' ',1,'','1','40253               ','2025-04-16','2025-04-16','SE VERIFICA FUNCIONAMIENTO GENERAL, LÁMPARA, RUEDAS, PRUEBA DE EQUILIBRIO, EQUIPO INICIA SIN ERRORES, CONTROLES FUNCIONALES.','','                                                                                                                                                                                                                                                              ','*',31,1),(113,'CONTRATO','0425-2025','EN TRÁMITE       ',' ','M. PREVENTIVO','2025-04-16','61497','GESTIONADO MEDIANTE NOTA N° 25-229-SBM-HST POR CONDUCTO DE LA DIRECCIÓN MÉDICA DEL 27/03/2025.',' ','',' ',' ',' ',' ','MANTENIMIENTO PREVENTIVO DE ABRIL 2025.',' ','',' ','COORDINADO SEGÚN CRONOGRAMA Y DISPONIBILIDAD.',' ','',' ','JOSÉ CASTILLO.                ','',1,0,0,0,0,0,0,1,'16/04/2025 08:30:35 AM',' ',1,'','1','250505130801127     ','2025-04-16','2025-04-23','SE REALIZA CAMBIOS DE FILTROS DE SEDIMENTO Y CARBÓN ACTIVADO, DESINFECCIÓN CON PURISTERIL, CHECK DE RECIDUOS DE PURISTERIL, PRUEBAS DE FUNCIONAMIENTO, SE ADJUNTA TSC DEL FABRICANTE.','VISITA DEL 16/04/2025 SE REPROGRAMA PARA EL 23/04/2025 POR DISPONIBILIDAD DEL EQUIPO','FILTRO DE 5 MICRA Y FILTRO DE CARBÓN ACTIVADO.                                                                                                          ','*',44,1),(114,'GARANTIA','0426-2025',' ','4200534969       ','M. PREVENTIVO','2025-04-16','159757','EQUIPO RECIBIDO A SATISFACCIÓN EL 08/06/2024.','SR. JOSÉ /IMP. MEDICAL        ','2025-04-16','10:36 AM  ',' ',' ',' ','ALARMA DE MANTENIMIENTO PREVENTIVO  Y ALARMA DE CAMBIO DE BATERIA.','LIC. ALEXANDER/T. RESPIRATORIA','2025-04-16','10:05 AM        ','',' ','',' ','JOSÉ CASTILLO.                ','',1,0,0,0,0,0,0,0,'16/04/2025 10:37:51 AM',' ',0,'','1','7125                ','2025-04-16','2025-04-16','REVISIÓN GENERAL, CALIBRACIÓN DE LOS SUBSISTEMAS Y PARÁMETROS VENTILATORIOS, PRUEBA FUNCIONAL.','',' ','*',4,0),(115,'CONTRATO','0427-2025','4200598718       ',' ','M. CORRECTIVO','2025-04-16','63177','GESTIONADO MEDIANTE ORDEN DE COMPRA N° 4200598718.','MARLINA/ELECT. MÉDICA         ','2025-04-16','10:07 AM  ',' ',' ',' ','NO CONECTA EL EQUIPO CON LA VIEW FORUM PARA EL ENVÍO Y RECEPCIÓN DE IMÁGENES.','LIC. FEMENIAS/IMAGINOLOGÍA    ','2025-04-16','10.05 AM        ','',' ','',' ','JOSÉ CASTILLO.                ','',1,0,0,0,0,0,0,0,'16/04/2025 10:40:34 AM',' ',2,'','1','TSO48913            ','2025-04-22','2025-04-22','REVISIÓN DE LA ESTACIÓN VIEW FORUM, LA MISMA ENCENDIÓ SIN PROBLEMAS. PRUEBA DE COMUNICACIONES SIN ERRORES.','',' ','*',16,2),(116,'CONTRATO','0430-2025','4200602634       ',' ','M. PREVENTIVO','2025-04-17','64245','GESTIONADO MEDIANTE ORDEN DE COMPRA N° 4200602634.',' ','',' ',' ',' ',' ','PRUEBAS DE CONTROL DE CALIDAD.',' ','',' ','TRABAJO COORDINADO CON PERSONAL DE PROTECCIÓN RADIOLÓGICA DE LA INSTITUCIÓN.',' ','',' ','JOSÉ CASTILLO.                ','',1,0,0,0,0,0,0,0,'17/04/2025 07:43:56 AM',' ',1,'','1','250509154601075     ','2025-04-17','2025-04-29','SE REPROGRAMA. 29/04/2025 SE PROCEDIÓ A LAS PRUEBAS DE SALUD RADIOLÓGICAS, SIGUIENDO LA PLANTILLA Y MANUAL DE PRUEBAS, PRUEBAS DE CONGRUENCIAS, PUNTO FOCAL, CAPA HEMIREDUCTORA, LINEALIDAD, ENTRE OTRAS.','','                                                                                                                                                                                                                                                              ','*',44,1),(117,'CONTRATO','0431-2025','EN TRÁMITE       ',' ','M. PREVENTIVO','2025-04-17','61498','GESTIONADO SEGÚN NOTA N°25-229-SBM-HST POR CONDUCTO DE LA DIRECCIÓN MÉDICA GENERAL DEL 27/03/2025.',' ','',' ',' ',' ',' ','MANTENIMIENTO PREVENTIVO DE ABRIL 2025.',' ','',' ','COORDINADO SEGÚN CRONOGRAMA Y DISPONIBILIDAD.',' ','',' ','JOSÉ CASTILLO.                ','',1,0,0,0,0,0,0,0,'17/04/2025 07:46:21 AM',' ',2,'','1','250424093601036     ','2025-04-17','2025-04-23','17 REPROG MP USO CON PACIENTE. EL 23 SE REALIZA MP SEGÚN TSC DEL FABRICANTE. SE REEMPLAZA FILTROS DE ENTRADA DE AGUA. CHECK DE NIVEL DE SAL, REGENERACIÓN DE LOS ABLANDADORES, PRUEBA DE FUNCIONAMIENTO EN MODO SUPPLY-RINSE, DESINFECCIÓN Y RPUEBA DE PRESENCIA DE PURISTERIL. PRUEBA DE FUNCIONAMIENTO.','','FILTRO DE ENTRADA 10 U Y FILTRO CARBÓN ACTIVADO.                                                                                                                                                                                                              ','*',44,2),(118,'GARANTIA','0432-2025',' ','4200535878       ','M. PREVENTIVO','2025-04-17','160428','RECIBIDO A SATISFACCIÓN EL 03/09/2025.',' ','',' ',' ',' ',' ','MANTENIMIENTO PREVENTIVO DE ABRIL 2025.',' ','',' ','COORDINADO SEGÚN CRONOGRAMA Y DISPONIBILIDAD.',' ','',' ','JOSÉ CASTILLO.                ','',1,0,0,0,0,0,0,1,'17/04/2025 07:48:12 AM',' ',1,'','1','250506145501127     ','2025-04-16','2025-04-16','MP SE REALIZA INSPECCIÓN, SE ENCUENTRA PROBLEMAS DE SUMINISTRO DE AGUA, SE REEMPLAZA MEMBRANA, CAMBIO DE FILTRO DE CARBÓN Y SEDIMENTO. SE REALIZA DESINFECCIÓN CON PURISTERIL. SE ADJUNTA TSC.','','FFILTRO DE 5 MICRA/FILTRO DE CARBÓN ACTIVADO/MEMBRANA.                                                                                                  ','*',44,1),(119,'GARANTIA','0433-2025',' ','4200522983       ','M. PREVENTIVO','2025-04-17','159760','RECIBIDO A SATISFACCIÓN EL 03/06/2024.',' ','',' ',' ',' ',' ','MANTENIMIENTO PREVENTIVO DE ABRIL 2025.',' ','',' ','COORDINADO SEGÚN CRONOGRAMA Y DISPONIBILIDAD.',' ','',' ','JOSÉ CASTILLO.                ','',1,0,0,0,0,0,0,0,'17/04/2025 07:50:00 AM',' ',1,'','1','250421125401053     ','2025-04-16','2025-04-16','SE REALIZA SEGÚNINDICACIONES DE FABRICANTE MP, LIMPIEZA GENERAL ,REVISIÓN DE ACCESORIOS, SE SIMULA ECG, SPO2,PANI,TEMP,RESP, ALARMAS Y ARRITMIAS, FUNCIÓN DE BATERÍAS,COMUNICACIÓN CON CIC. FUNCIONAMIENTO DEL EQUIPO.','',' ','*',44,1),(120,'GARANTIA','0434-2025',' ','4200534969       ','M. PREVENTIVO','2025-04-17','159758','RECIBIDO A SATISFACCIÓN EL 08/05/2024.',' ','',' ',' ',' ',' ','MANTENIMIENTO PREVENTIVO DE ABRIL 2025',' ','',' ','COORDINADO SEGÚN CRONOGRAMA Y DISPONIBILIDAD.',' ','',' ','JOSÉ CASTILLO.                ','',1,0,0,0,0,0,0,0,'17/04/2025 07:59:00 AM',' ',1,'','1','7249                ','2025-05-12','2025-05-12','EL EQUIPO FUE CALIBRADO EN SU TOTALIDAD, SE PUSO A PRUEBA Y ESTÁ TRABAJANDO A SATISFACCIÓN.','','                                                                                                                                                                                                                                                              ','*',28,1),(121,'GARANTIA','0435-2025',' ','4200534969       ','M. PREVENTIVO','2025-04-17','159757','RECIBIDO A SATISFACCIÓN EL 08/05/2024.',' ','',' ',' ',' ',' ','MANTENIMIENTO PREVENTIVO DE ABRIL 2025.',' ','',' ','COORDINADO SEGÚN CRONOGRAMA Y DISPONIBILIDAD.',' ','',' ','JOSÉ CASTILLO.                ','',0,0,0,0,0,0,0,0,'17/04/2025 08:01:05 AM',' ',0,'','1','ANULADO             ','','','REPORTE REPETIDO POR ERROR.','',' ','*',28,0),(122,'GARANTIA','0436-2025',' ','4200534969       ','M. PREVENTIVO','2025-04-17','159756','RECIBIDO A SATISFACCIÓN EL 08/05/2024.',' ','',' ',' ',' ',' ','MANTENIMIENTO PREVENTIVO DE ABRIL 2025.',' ','',' ','COORDINADO SEGÚN CRONOGRAMA Y DISPONIBILIDAD.',' ','',' ','JOSÉ CASTILLO.                ','',1,0,0,0,0,0,0,0,'17/04/2025 08:03:34 AM',' ',0,'','1','7127                ','2025-04-23','2025-04-23','REVISIÓN GENERAL, CALIBRACIÓN DE TODO LOS SUBSISTEMAS Y PARÁMETROS VENTILATORIOS, PRUEBA DE FUNCIONAMIENTO. EQUIPO FUNCIONAL.','',' ','*',28,0),(123,'GARANTIA','0437-2025',' ','4200534969       ','M. PREVENTIVO','2025-04-17','159755','RECIBIDO A SATISFACCIÓN EL 08/05/2024.',' ','',' ',' ',' ',' ','MANTENIMIENTO PREVENTIVO DE ABRIL 2025.',' ','',' ','COORDINADO SEGÚN CRONOGRAMA Y DISPONIBILIDAD.',' ','',' ','JOSÉ CASTILLO.                ','',1,0,0,0,0,0,0,0,'17/04/2025 08:07:48 AM',' ',1,'','1','7137                ','2025-04-30','2025-04-30','REVISIÓN GENERAL, CALIBRACIÓN DEL SISTEMA Y PARÁMETROS VENTILATORIOS. PRUEBA DE FUNCIONAMIENTO.','','                                                                                                                                                                                                                                                              ','*',28,1),(124,'GARANTIA','0438-2025',' ','4200367887       ','M. PREVENTIVO','2025-04-21','109220','EQUIPO RECIBIDO A SATISFACCIÓN EL 10/08/2022.',' ','',' ',' ',' ',' ','MANTENIMIENTO PREVENTIVO DE ABRIL 2025.',' ','',' ','COORDINADO SEGÚN CRONOGRAMA Y DISPONIBILIDAD.',' ','',' ','JOSÉ CASTILLO.                ','',0,0,0,0,0,0,0,0,'21/04/2025 07:40:31 AM',' ',0,'','','','','','','','','',29,0),(125,'GARANTIA','0439-2025',' ','4200522983       ','M. PREVENTIVO','2025-04-21','159759','EQUIPO RECIBIDO A SATISFACCIÓN EL 03/06/2024.',' ','',' ',' ',' ',' ','MANTENIMIENTO PREVENTIVO DE ABRIL 2025.',' ','',' ','COORDINADO SEGÚN CRONOGRAMA Y DISPONIBILIDAD.',' ','',' ','JOSÉ CASTILLO.                ','',1,0,0,0,0,0,0,0,'21/04/2025 07:44:05 AM',' ',1,'','1','250421125701053     ','2025-04-21','2025-04-21','SE REALIZA MP SEGÚN INDICACIONES DEL FABRICANTE , LIMPIEZA GENERAL, REVISIÓN DE ACCESORIOS, SE SIMULO ECG,SPO2,PANI,TEMP,RESP,ALARMAS Y ARRITMIAS, FUNCIÓN DE BATERIA OK, COMUNICACIÓN CIC OK, FUNCIONAMIENTO OK.','','                                                                                                                                                                                                                                                              ','*',44,1),(126,'CONTRATO','0440-2025','35-2023          ',' ','M. PREVENTIVO','2025-04-18','74301','GESTIONADO MEDIANTE NOTA N°0407-23-SBM-HST POR CONDUCTO DE LA DIRECCIÓN MÉDICA GENERAL ',' ','',' ',' ',' ',' ','MANTENIMIENTO PREVENTIVO DE ABRIL 2025',' ','',' ','COORDINADO SEGÚN CRONOGRAMA Y DISPONIBILIDAD.',' ','',' ','JOSÉ CASTILLO.                ','',1,0,0,0,0,0,0,0,'21/04/2025 07:54:36 AM',' ',1,'','1','250430091701059     ','2025-04-18','2025-04-18','MP REVISIÓN DE BOMBAS, REVISIÓN DE VOLTAJES Y AMPERAJE, NIVELES DE ACEITE CORRECTOFUNCIONES DE ALTERNANCIA CORRECTO. LIMPIEZA DEL EQUIPO, HORAS DE USO 12318.0.','',' ','*',44,1),(127,'CONTRATO','0441-2025','02-2024          ',' ','M. PREVENTIVO','2025-04-21','400552','GESTIONADO MEDIANTE NOTA N°091223-SBM-HST POR CONDUCTO DE LA DIRECCIÓN MÉDICA GENERAL.',' ','',' ',' ',' ',' ','MANTENIMIENTO PREVENTIVO DE ABRIL 2025.',' ','',' ','COORDINADO SEGÚN CRONOGRAMA Y DISPONIBILIDAD.',' ','',' ','JOSÉ CASTILLO.                ','',1,0,0,0,1,0,1,0,'21/04/2025 08:59:08 AM',' ',1,'','1','1513/1514/1515      ','2025-04-21','2025-04-23','REALIZA MP DE TORRE 11,2 Y 3 REEMPLAZO DEL KIT DEL MODULO DE COMPRESIÓN, VALDULA DE SEGURIDAD.SE CAMBIAN SILENCIADORE DE SALIDA DE SOLENOIDE. LAS TORRES QUEDAN OPERANDO CORRECTAMENTE.','TORRE #3 DESHABILITADA EN ESPERA DE REEMPLAZO DE TARJETA DE CONTROL.',' ','*',22,1),(128,'CONTRATO','0442-2025','EN TRÁMITE       ',' ','M. PREVENTIVO','2025-04-21','64465','GESTIONADO MEDIANTE NOTA N° 24-840-SBM-HST DEL 29/11/2025 POR CONDUCTO DE LA DIRECCIÓN MÉDICA GENERAL.',' ','',' ',' ',' ',' ','MANTENIMIENTO PREVENTIVO DE ABRIL 2025',' ','',' ','COORDINADO SEGÚN CRONOGRAMA Y DISPONIBILIDAD.',' ','',' ','JOSÉ CASTILLO.                ','',1,0,0,0,0,0,0,0,'21/04/2025 09:18:35 AM',' ',1,'','1','30160               ','2025-04-30','2025-04-30','SE REALIZÓ LIMPIEZA INTERNA Y EXTERNA, SE VERIFICA CADA UNO DE LOS PARÁMETROS SEÑALADOS EN EL SMART TEST ADJUNTO. PRUEBA DE FUNCIONAMIENTO.','',' ','*',13,1),(129,'CONTRATO','0444-2025','CONT. MINSA      ',' ','M. PREVENTIVO','2025-04-21','71489','CONTRATO GESTIONADO POR EL MINSA-BIOMEDICAL SUPPORT POR UN PERIDO DE 36 MESES.',' ','',' ',' ',' ',' ','MANTENIMIENTO PREVENTIVO DE ABRIL 2025.',' ','',' ','COORDINADO SEGÚN CRONOGRAMA Y DISPONIBILIDAD.',' ','',' ','JOSÉ CASTILLO.                ','',1,0,0,0,0,0,0,0,'21/04/2025 09:21:37 AM',' ',1,'','1','30489               ','2025-04-21','2025-04-21','VERIFICACIÓN ELECTRICA Y ELECTRÓNICA DEL EQUIPO, PRUEBA DE MOVIMIENTOS, FRENOS, VERIFICACIÓN DE PROTOCOLOS, MODOS DE FLUOROSCOPIA Y VASCULAR, REVISIÓN DE LIQUIDO REFRIGERANTE DEL TUBO, PANTALLA TÁCTIL Y MONITOR. REVISIÓN CONECTORES, CABLES, PUNTO LÁSER, RUEDAS, LIMPIEZA GENERAL. ENTRE OTROS.','',' ','*',68,1),(130,'CONTRATO','0443-2025','EN TRÁMITE       ',' ','M. PREVENTIVO','2025-04-21','70416','GESTIONADO MEDIANTE NOTA N° 24-840-SBM-HST. DEL 29/11/2025 POR CONDUCTO DE LA DIRECCIÓN MÉDICA GENERAL.',' ','',' ',' ',' ',' ','MANTENIMIENTO PREVENTIVO DE ABRIL 2025.',' ','',' ','COORDINADO SEGÚN CRONOGRAMA Y DISPONIBILIDAD.',' ','',' ','JOSÉ CASTILLO.                ','',1,0,0,0,0,0,0,0,'21/04/2025 09:33:49 AM',' ',1,'','1','30161               ','2025-04-30','2025-04-30','SE VERIFICARON CADA UNO DE LOS PARÁMETROS SEÑALADOS EN EL SMART TEST ADJUNTO, PRUEBA DE FUNCIONAMIENTO DEL EQUIPO.','',' ','*',13,1),(131,'CONTRATO','0445-2025','EN TRÁMITE       ',' ','M. CORRECTIVO','2025-04-21','37826','GESTIONADO MEDIANTE NOTA N° 25-129-SBM-HST DEL 20/02/2025 POR CONDUCTO DE LA DIRECCIÓN MÉDICA GENERAL.','MARGARITA/PROMED              ','2025-04-21','8:39 PM   ',' ',' ',' ','NO LEVANTA. NO SALE PANTALLA DE INICIO.','LIC. LIDIA/RESONANCIA.        ','2025-04-21','8:14 AM         ','',' ','',' ','JOSÉ CASTILLO.                ','',0,0,1,0,1,0,1,0,'21/04/2025 09:40:24 AM',' ',1,'','1','250422123401078     ','2025-04-21','2025-04-21','EQUIPO NO TERMINÓ DE ENCENDER, SE VERIFICA CONEXIONES DE GABINETES Y LAS HOST PC, SE REINICIA SISTEMA COMPLETO, AL HACER SCAN MUESTRA FALLA DE COMUNICACIÓN, SE VERIFICA APS, AGP Y SPC, SE NOTA PERDIDA DE VOLTAJE DE LA SFR BOARD, LA MISMA ESTPÁ DEFECTUOSA, SE SOLICITARÁ LA MISMA. ','','SRF/TRF CIRCUIT BOARD ASSEMBLY.                                                                                                                         ','*',44,1),(132,'CONTRATO','0446-2025','07-2025          ',' ','M. CORRECTIVO','2025-04-21','38001','GESTIONADO MEDIANTE NOTA N° 2025-067-SBM-HST POR CONDUCTO DE LA DIRECCIÓN MÉDICA GENERAL.','SR. CASTILLERO/ENDOSERVICE    ','2025-04-21','9:40 AM   ',' ',' ',' ','FUGA POSITIVA EN EL TUBO DE LUZ.','DR. PAREDES/NEUMOLOGÍA        ','2025-04-17','11:47 AM        ','ENTREGA DE NOTA POR JEFATURA EL 21/04/2025 PARA REALIZAR REPORTE A LA EMPRESA.',' ','',' ','JOSÉ CASTILLO.                ','',0,0,1,0,0,0,0,0,'21/04/2025 09:45:38 AM',' ',2,'','1','5822                ','2025-04-22','2025-04-22','SE RETIRA EQUIPO PARA EVALUACIÓN EN EL TALLER. DAÑO MAYOR EN TUBO DE LUZ.','EQUIPO EN TALLER','                                                                                                                                                                                                                                                              ','*',17,2),(133,'CONTRATO','0447-2025','4200602634       ',' ','M. CORRECTIVO','2025-04-21','64245','GESTIONADO MEDIANTE ORDEN DE COMPRA 4200602634.','ESTEFANI/PROMED               ','2025-04-21','11:49 AM  ',' ',' ',' ','ARTEFACTO EN LAS IMÁGENES.','LIC. CUMBRERA/URGENCIAS.      ','2025-04-21','11:49 AM        ','',' ','',' ','JOSÉ CASTILLO.                ','',1,0,0,0,0,0,0,0,'21/04/2025 02:20:58 PM',' ',1,'','1','250422072201918     ','2025-04-22','2025-04-22','SE ENCONTRARON MICRO PUNTOS DE PIXELES QUEMADOS EN LAS IMAGENES, SE REALIZA CALIBRACIÓN DE BAD PIXEL Y GANANCIA EN EL DETECTOR, SE REALIZA EL QAP, PRUEBA DE IMAGEN Y NO APARECE. SE REALIZA PRUEBA CON PACIENTE Y NO APARECEN LOS PUNTOS.','',' ','*',44,1),(134,'GARANTIA','0448-2025',' ','4800073174       ','M. CORRECTIVO','2025-04-21','109984','EQUIPO RECIBIDO A SATISFACCIÓN EL 14/07/2025.',' ','',' ',' ',' ',' ','MANGUERA ROTA','                              ','',' ','REPORTE DEL DÍA 17/4/2025 POR PERSONAL DEL SERVICIO A PERSONAL DE BIOMÉDICA DE TURNO.',' ','',' ','JOSÉ CASTILLO.                ','',0,0,0,0,0,0,0,0,'21/04/2025 02:51:08 PM',' ',1,'','','','','','','','','',37,0),(135,'CONTRATO','0449-2025','EN TRÁMITE       ',' ','M. PREVENTIVO','2025-04-22','63219','GESTIONADO MEDIANTE NOTA N°25-213-SBM-HST POR CONDUCTO DE LA DIRECCIÓN MÉDICA GENERAL EL 21/03/2025.',' ','',' ',' ',' ',' ','MANTENIMIENTO PREVENTIVO DE ABRIL 2025',' ','',' ','COORDINADO SEGÚN CRONOGRAMA Y DISPONIBILIDAD.',' ','',' ','JOSÉ CASTILLO.                ','',1,0,0,0,0,0,0,0,'22/04/2025 08:17:05 AM',' ',1,'','1','TSO48683            ','2025-04-22','2025-04-22','SE REALIZA MANTENIMIENTO PREVENTIVO SEGÚN CHECK LIST QUE INCLUYE REVISION DE ERROR LOG, SISTEMA DE SEGURIDAD DEL GANTRY, SISTEMA DESLIZANTE, FILTROS DE AIRE, BALINERAS, DRENAJE COMPRESOR Y MANIFOLD ENTRE OTROS DESCRITOS EN PROTOCOLO.','',' ','*',16,1),(136,'CONTRATO  ','0450-2025','CONT./MINSA         ','                    ','M. PREVENTIVO  ','2025-04-22','58108','CONTRATO GESTIONADO DIRECTAMENTE POR EL MINSA/BIOMEICAL SUPPORT.','                              ','/  /','          ','                              ','          ','          ','MANTENIMIENTO PREVENTIVO DE ABRIL 2025.','                              ','/  /',' ','COORDINADO SEGÚN CRONOGRAMA Y DISPONIBILIDAD.','                              ','/  /','          ','JOSÉ CASTILLO.                ','',1,0,0,0,0,0,0,0,'22/04/2025 08:35:25 AM',' ',1,'2025-04-22','1','31317               ','2025-04-25','2025-04-25','VERIFICACIÓN ELÉCTRICA Y ELECTRÓNICA DEL EQUIPO, AJUSTE DE ESTRUCTURA CIELÍTICA, MOVIMIENTO DE LA MESA, CIELÍTICO Y ESTATIVO DE PARED OK, LUBRICACIÓN DE POLEA DE TENSIÓN DEL CH200 Y EL ESTATIVO DE PAREDCALIBRACIÓN DE LOS PARÁMTETROS FUR DEL TUBO DE RX. LIMPIEZA, PRUEBA DE FUNCIONAMIENTO OK.','',' ','*',68,1),(137,'GARANTIA','0451-2025',' ','4200444628       ','M. PREVENTIVO','2025-04-22','119444','RECIBIDO A SATISFACCIÓN EL 8/6/2023.',' ','',' ',' ',' ',' ','MANTENIMIENTO PREVENTIVO DE ABRIL 2025.',' ','',' ','COORDINADO SEGÚN CRONOGRAMA Y DISPONIBILIDAD.',' ','',' ','JOSÉ CASTILLO.                ','',0,0,0,0,0,0,0,0,'22/04/2025 08:50:58 AM',' ',0,'','','','','','','','','',32,0),(138,'GARANTIA','0452-2025',' ','4200444628       ','M. PREVENTIVO','2025-04-22','119445','RECIBIDO A SATISFACCIÓN EL 08/06/2023.',' ','',' ',' ',' ',' ','MANTENIMIENTO PREVENTIVO DE ABRIL 2025.',' ','',' ','COORDINADO SEGÚN CRONOGRAMA Y DISPONIBILIDAD.',' ','',' ','JOSÉ CASTILLO.                ','',1,0,0,0,0,0,0,0,'22/04/2025 08:52:22 AM',' ',1,'','1','9983                ','2025-04-23','2025-04-23','FISICAMENTE EQUIPO NO PRESENTA SIGNOS DE GOLPES O CAIDAS, POSEE TODOS SUS ACCESORIOS Y FUNCIONAN CORRECTAMENTE. SE DEJA EN OBSERVACIÓN POR ANOMALÍA REPORTADA LA CUÁL NO SE DETECTO EN MP','BAJO OBERVACIÓN.',' ','*',32,1),(139,'GARANTIA','0453-2025',' ','4200444628       ','M. PREVENTIVO','2025-04-22','119446','RECIBIDO A SATISFACCIÓN 08/06/2023.',' ','',' ',' ',' ',' ','MANTENIMIENTO PREVENTIVO DE ABRIL 2025.',' ','',' ','COORDINADO SEGÚN CRONOGRAMA Y DISPONIBILIDAD.',' ','',' ','JOSÉ CASTILLO.                ','',1,0,0,0,0,0,0,0,'22/04/2025 08:59:36 AM',' ',1,'','1','9974                ','2025-04-22','2025-04-22','EQUIPO NO PRESENTA SIGNOS DE GLPES O MAL USO, ENCIENDE CON NORMALIDAD PERO LOS TRANSDUCTORES  DE CONTRACCIÓN UTERINA O FC  A PESAR DE CUMPLIR CON LA FUNCIÓN SE VEN FISICAMENTE DETERIORADOS(TIENEN CINTA PEGADA). CARGADOR OPERATIVO.','',' ','*',32,1),(140,'GARANTIA','0454-2025',' ','4200444628       ','M. PREVENTIVO','2025-04-22','119447','EQUIPO RECIBIDO A SATISFACCIÓN EL 08/06/2023.',' ','',' ',' ',' ',' ','MANTENIMIENTO PREVENTIVO DE ABRIL 2025.',' ','',' ','COORDINADO SEGÚN CRONOGRAMA Y DISPONIBILIDAD.',' ','',' ','JOSÉ CASTILLO.                ','',1,0,0,0,0,0,0,0,'22/04/2025 09:01:07 AM',' ',1,'','1','9975                ','2025-04-22','2025-04-22','EQUIPO NO PRESENTA GOLPES O CAIDAS , CARGADOR NO FUNCIONA. EL TRANSDUCTOR DE CONTRACCIÓN UTERINA ESTÁ QUEBRADO Y LOS TRANSDUCTORES DE FRECUENCIA CARDIÁCA ESTÁN OPERATIVOS. CON UN CARGADOR DE PRUEBAS SE PROBÓ EL EQUIPO.','','                                                                                                                                                                                                                                                              ','*',32,1),(141,'GARANTIA','0455-2025',' ','4200444628       ','M. PREVENTIVO','2025-04-22','119448','RECIBIDO A SATISFACCIÓN EL 08/06/2023.',' ','',' ',' ',' ',' ','MANTENIMIENTO PREVENTIVO DE ABRIL 2025.',' ','',' ','COORDINADO SEGÚN CRONOGRAMA Y DISPONIBILIDAD.',' ','',' ','JOSÉ CASTILLO.                ','',0,0,1,0,1,1,0,0,'22/04/2025 09:02:48 AM',' ',1,'','1','9982                ','2025-04-22','2025-04-22','EQUIPO PRESENTA INTERFERENCIA EN LA PANTALLA, LA PANTALLA POSEE DESPERFECTOS DE FABRICA SERA REEMPLAZADA POR LA EMPRESA ','A COTIZAR TRANSDUCTORES Y CARGADOR.','FLEXIBLE DE LA PANTALLA                                                                                                                                                                                                                                       ','*',32,1),(142,'GARANTIA','0456-2025',' ','4200444628       ','M. PREVENTIVO','2025-04-22','119449','RECIBIDO A SATISFACCIÓN EL 08/06/2023.',' ','',' ',' ',' ',' ','MANTENIMIENTO PREVENTIVO DE ABRIL 2025.',' ','',' ','COORDINADO SEGÚN CRONOGRAMA Y DISPONIBILIDAD.',' ','',' ','JOSÉ CASTILLO.                ','',1,0,0,0,0,0,0,0,'22/04/2025 09:04:13 AM',' ',1,'','1','9981                ','2025-04-23','2025-04-23','FISICAMENTE EL EQUIPO PRESENTA UNA LEVE SEPARACIÓN ENTRE LAS CARCASA POR MALFORMACION DE LOS MISMOS. TRANSDUCTOR UTERINO ESTA FISICAMENTE DETERIORADO POR GOLPE Y LA TAPA DE LA IMPRESORA SE ENCUENTRA MOVIDA. SIN EMBARGO EL EQUIPO ENCIENDE CON NORMALIDAD Y EL TRANSDUCTOR DE FC ESTÁ OPERATIVO.','',' ','*',32,1),(143,'CONTRATO','0457-2025','EN TRÁMITE       ',' ','OTROS','2025-04-22','58240','GESTIONADO',' ','',' ',' ',' ',' ','REMUESTREO.',' ','',' ','',' ','',' ','JOSÉ CASTILLO.                ','',1,0,0,0,0,0,0,0,'22/04/2025 09:51:17 AM',' ',1,'','1','250422111601006     ','2025-04-22','2025-04-22','SE REALIZA REMUESTRO  PARA ANALISIS DE ENDOTOXINAS INICIO Y RETORNO DE LOOPING. DE ABRIL.','',' ','*',44,1),(144,'GARANTIA','0458-2025',' ','4200537741       ','M. CORRECTIVO','2025-04-22','159766','EQUIPO RECIBIDO A SATISFACCIÓN EL 30/05/2024.',' ','/  /',' ',' ',' ',' ','MANTENIMIENTO PREVENTIVO DE ABRIL 2025.',' ','/  /',' ','COORDINADO SEGÚN CRONOGRAMA Y DISPONIBILIDAD.',' ','/  /',' ','JOSÉ CASTILLO.                ','',1,0,0,0,0,0,0,0,'22/04/2025 10:32:40 AM',' ',1,'2025-04-22','1','TSO49188            ','2025-04-21','2025-05-05','SE REALIZÓ RETIRO Y ENTREGA DE LA ESTACIÓN XCELERA LUEGO DE LA REPARACIÓN DE LA FUENTE DE PODER EN EL LABORATORIO DE EMSA. SE REALIZA LA ENTREGA PARA QUE EL INGENIERO ENCARGADO DE LA MODALIDAD REALICE LAS CONFIGURACIONES Y PRUEBAS CORRESPONDINTES.','',' ','*',40,1),(145,'GARANTIA  ','0458A-2025','                    ','4200537741','M. CORRECTIVO  ','2025-04-22','159766','EQUIPO RECIBIDO A SATISFACCIÓN EL 30/05/2024.','                              ','','          ','                              ','          ','          ','MANTENIMIENTO PREVENTIVO DE ABRIL 2025.','                              ','',' ','COORDINADO SEGÚN CRONOGRAMA Y DISPONIBILIDAD.','                              ','','          ','JOSÉ CASTILLO.                ','',1,0,0,0,0,0,0,0,'22/04/2025 10:34:46 AM',' ',1,'','1','403532930           ','2025-04-24','2025-04-24','SE REALIZA LIMPIEZA DEL EQUIPO, CALIBRACIÓN DEL SENSOR DE OXIGENO, PRUEBA DE FUNCIONAMIENTO COMPLETA PVT, AUTOTEST GLOBAL ATG, ATC, PRUEBA DE VENTILACIÓN CON PULMÓN DE PRUEBA, EQUIPO NO PRESENTA ERRORES NI FALLAS Y ES APTO PARA SU USO.','',' ','*',40,1),(146,'CONTRATO','0459-2025','TRÁMITE          ',' ','M. CORRECTIVO','2025-04-22','63232','GESTIONADO MEDIANTE NOTA N° 25-090-SBM-HST POR CONDUCTO DE LA DIRECCIÓN MÉDICA GENERAL EL 13/02/2025.','MARLINA/ELECT. MÉDICA         ','2025-04-22','10:20 AM  ',' ',' ',' ','PANTALLA PRINCIPAL DE FLUOROSCOPIA EN VIVO PRESENTA RUÍDO EN LA SEÑAL.','LIC. DANNI/HEMODINÁMICA       ','2025-04-22','10:10 AM        ','',' ','',' ','JOSÉ CASTILLO.                ','',1,0,0,0,0,0,0,0,'22/04/2025 10:39:26 AM',' ',1,'','1','TSO48935            ','2025-04-23','2025-04-23','SE VERIFICA PANTALLA PRINCIPAL, FUNCIONAMIENTO SIN LA SEÑAL DE RUIDO, SE REALIZA LIMPIEZA DE CONECTORES EN GABINETE Y SISTEMA REINICIADO SIN ERRORES.','',' ','*',16,1),(147,'CONTRATO','0460-2025','TRÁMITE          ',' ','M. CORRECTIVO','2025-04-22','63232','GESTIONADO MEDIANTE NOTA N°25-090-SBM-HST POR CONDUCTO DE LA DIRECCIÓN MÉDICA GENERAL EL 13/02/2025.','MARLINA/ELECT. MÉDICA         ','2025-04-22','10:20 AM  ',' ',' ',' ','PANTALLA DE LA INTERVENTIONAL TOOLS QUE RECONSTRUYE, SE APAGA Y CPU QUEDA ENCENDIDO.','LIC. ROBERTO/HEMODINÁMICA     ','2025-04-22','10:10 AM        ','',' ','',' ','JOSÉ CASTILLO.                ','',1,0,0,0,0,0,0,0,'22/04/2025 10:46:19 AM',' ',1,'','1','TSO48934            ','2025-04-23','2025-04-23','SE VERIFICA PANTALLA PRINCIPAL Y SE ENCONTRÓ EN FUNCIONAMIENTO. SE REALIZA LIMPIEZA DE CONECTORES Y EL SISTEMA FUE REINICIADO SIN ERRORES. SE REALIZAN PACIENTES SIN PRESENTAR INCONVENIENTES.','',' ','*',16,1),(148,'CONTRATO','0461-2025','TRÁMITE          ',' ','M. CORRECTIVO','2025-04-22','68462','GESTIONADO MEDIANTE NOTA N° 2025-067-SBM-HST POR CONDUCTO DE LA DIRECCIÓN MÉDICA GENERAL.',' ','',' ',' ',' ',' ','ENTREGA DE EQUIPO REPARADO.',' ','',' ','SE REGISTRA ENTREGA CON ACTA Y PERSONAL DE BIENES PATRIMONIALES.',' ','',' ','JOSÉ CASTILLO.                ','',1,0,0,0,0,0,0,1,'22/04/2025 10:52:21 AM',' ',1,'','1','5821                ','2025-04-22','2025-04-22','EQUIPO CON CANAL DE TRABAJO PERFORADO, FUE REEMPLAZADO, CAMBIO DE A-RUBBER, AJUSTE DE ALEVADOR. PRUEBA DE FUNCIONAMIENTO.','','CANAL DE TRABAJO, A-RUBBER.                                                                                                                             ','*',17,1),(149,'GARANTIA','0462-2025',' ','C51-2023 M       ','M. CORRECTIVO','2025-04-22','2324113304','EQUIPO RECIBIDO A SATISFACCIÓN EL 07/02/2025.\r\n','JORGE/RESERMA                 ','2025-04-22','10:27 AM  ',' ',' ',' ','SE APAGÓ EL EQUIPO, SE DA EXPOSICIÓN Y NO GUARDÓ LAS IMÁGENES.','LIC. ANGELA/RAYOS X PPAL. MAMO','2025-04-22','10:18 AM        ','',' ','',' ','JOSÉ CASTILLO.                ','',1,0,0,0,0,0,0,0,'22/04/2025 10:56:08 AM',' ',1,'','1','29382               ','2025-04-22','2025-04-22','REVISIÓN DEL EQUIPO, NO ENCONTRAMOS FALLO EN LA OPERACIÓN DEL SISTEMA, TAMPOCO HAY REGISTRO EN ERROR LOG. EQUIPO OPERATIVO.','',' ','*',45,1),(150,'CONTRATO','0463-2025','4200602634       ',' ','M. CORRECTIVO','2025-04-22','64245','GESTIONADO MEDIANTE ORDEN DE COMPRA 4200602634.',' ','',' ',' ',' ',' ','NO CARGA.',' ','',' ','REPORTE DE TURNO DEL 17/04/2025 POR PERSONAL DEL SERVICIO A PERSONAL DE BIOMÉDICA.',' ','',' ','JOSÉ CASTILLO.                ','',0,0,1,0,1,0,1,0,'23/04/2025 07:38:55 AM',' ',1,'','1','250421101301918     ','2025-04-17','2025-04-17','SE UTILIZA EL YOYO DE LA PORTATIL #9 YA QUE MANDO UN ERROR QUE ESTÁ POR DIAGNOSTICAR Y ADICIONAL SE MANDA A PEDIR EL YOYO PARA ESTA PORTÁTIL PARA DEJAR EQUIPO OPERATIVO. ','','CORD REEL WITH PLUG. N/P 5444444-2                                                                                                                      ','*',44,1),(151,'CONTRATO','0464-2025','4200602634       ',' ','M. CORRECTIVO','2025-04-22','64243','GESTIONADO MEDIANTE ORDEN DE COMPRA N° 4200602634.',' ','',' ',' ',' ',' ','ERROR DE PROPULSOR.',' ','',' ','REPORTE DE TURNO DEL DÍA 19/04/2025 POR PERSONAL DEL SERVICIO A PERSONAL DE BIOMÉDICA.',' ','',' ','JOSÉ CASTILLO.                ','',0,0,1,0,1,0,1,0,'23/04/2025 07:41:13 AM',' ',1,'','1','250422074601918     ','2025-04-19','2025-04-19','SE DEJÓ EL EQUIPO FUERA DE SERVICIO YA QUE SE TOMÓ EL YOYO CONECTOR DE CORRIENTE PARA LEVANTA EQUIPO #5. SE CONTINUARÁ CON EL DIAGNÓSTICO A LLEGAR LA PIEZA DE LA PORTÁTIL 5','','                                                                                                                                                        ','*',44,1),(152,'CONTRATO  ','0465-2025','4200602634','                    ','M. CORRECTIVO  ','2025-04-22','64246','GESTIONADO MEDIANTE ORDEN DE COMPRA N° 4200602634.','                              ','/  /','          ','                              ','          ','          ','NO CARGA.','                              ','/  /',' ','REPORTE DE TURNO DEL 14/03/2025 EN HORARIO DE 3-11 PM Y 16/04/2025 POR PERSONAL DEL SERVICIO A PERSONAL DE BIOMÉDICA.','                              ','/  /','          ','JOSÉ CASTILLO.                ','',0,0,0,0,1,0,1,0,'23/04/2025 07:52:03 AM',' ',1,'2025-04-22','1','250318143001918     ','2025-04-14','2025-04-16','PROBLEMAS CON LA FIRE FLY, SE REALIZA CAMBIO DE FIREFLY PERO DEBIDO A QUE LA TARJETA VINO DAÑADA SE REALIZA PEDIDO NUEVAMENTE, SE PEDIRA TAMBIEN LAS BATERIAS. SE TOMAN BATERIAS  Y LA TARJETA DE PORTATIL #8 PARA DEJAR EQUIPO OPERATIVO.','','PIEZA A PEDIR FIREFLY Y BATTERY FOUR PACK                                                                                                                                                                                                                     ','*',44,1),(153,'CONTRATO','0466-2025','4200602634       ',' ','M. CORRECTIVO','2025-04-22','64242','GESTIONADO MEDIANTE ORDEN DE COMPRA N°4200602634.',' ','',' ',' ',' ',' ','YOYO NO RETRAE.',' ','',' ','REPORTE DE TURNO DEL 17/04/2025 POR PERSONAL DEL SERVICIO A PERSONAL DE BIOMÉDICA.',' ','',' ','JOSÉ CASTILLO.                ','',1,0,0,0,1,0,1,0,'23/04/2025 07:54:32 AM',' ',2,'','1','25042100601918      ','2025-04-17','2025-04-17','SE REALIZA PEDIDO DE YOYO; YA QUE LA PORTÁTIL NO RETRAE.','','CORD REEL WITH PLUG. N/P 5444444-2.                                                                                                                     ','*',44,2),(154,'CONTRATO','0467-2025','EN TRÁMITE       ',' ','M. CORRECTIVO','2025-04-22','37826','GESTIONADO MEDIANTE NOTA N°25-129-SBM-HST POR CONDUCTO DE LA DIRECCIÓN MÉDICA GENERAL.',' ','',' ',' ',' ',' ','ALARMA ','                              ','',' ','REPORTE DE FIN DE SEMANA DÍA 13/04/2025, SE PRESENTÓ ALARMA EN EL EQUIPO.',' ','',' ','JOSÉ CASTILLO.                ','',1,0,0,0,0,0,0,0,'23/04/2025 08:08:38 AM',' ',1,'','1','250417120801928     ','2025-04-13','2025-04-13','LA ENERGÍA SE HABIA IDO Y NO SE ENERGIZABA EL COMPRESOR, AL LLEGAR LA ENERGÍA EL COMPRESOR LEVANTÓ. SE MANTUVO EN OBSERVACIÓN PARA LA ESTABILIDAD, EQUIPO ESTUVO EN OPTIMAS CONDICIONES.','',' ','*',44,1),(155,'CONTRATO','0468-2025','EN TRÁMITE       ',' ','M. CORRECTIVO','2025-04-22','37826','GESTIONADO MEDIANTE NOTA N°25-129-SBM-HST POR CONDUCTO DE LA DIRECCIÓN MÉDICA GENERAL.',' ','',' ',' ',' ',' ','PANTALLA SE REINICIA.',' ','',' ','DAÑO NOTIFICADO EN SITIO, NO REPORTADO A BIOMÉDICA.',' ','',' ','JOSÉ CASTILLO.                ','',1,0,0,0,0,0,1,0,'23/04/2025 08:20:17 AM',' ',1,'','1','250416131901078     ','2025-04-16','2025-04-16','SE REALIZA SAVE INFO Y SAVE GI, CDS DEL SOFTWARE DEL EQUIPO SE EXTRAVIÓ DE LA CONSOLA PARTE INFERIOR, NO SE UBICA FOLDER. SE PROCEDE A SOLICITAR KIT DE SSOFTWARE NUEVO. SE POSPONE CAMBIO DE LA HOST PC HASTA QUE LLEGUE EL NUEVO KIT DE CDS. ','','KIT DE SOFTWARE NUEVO.                                                                                                                                  ','*',44,1),(156,'CONTRATO  ','0469-2025','EN TRÁMITE','                    ','M. CORRECTIVO  ','2025-04-22','37826','GESTIONADO MEDIANTE NOTA N°25-129-SBM-HST POR CONDUCTO DE LA DIRECCIÓN MÉDICA GENERAL.','                              ','','          ','                              ','          ','          ','ARQUEO ELÉCTRICO EN FUENTES DE GRADIENTES.','                              ','',' ','TRABAJO COORDINADO CON EL SERVICIO DE IMAGINOLOGÍA.','                              ','','          ','JOSÉ CASTILLO.                ','',1,0,0,0,0,0,0,1,'23/04/2025 08:22:07 AM',' ',1,'','1','250416141401078     ','2025-04-16','2025-04-16','SE REALIZA CAMBIO DE LA FUENTE DE GRADIENTES, SE REALIZA DC OFFSET CALIBRATION, SE REALIZA DQA, PRUEBA DE FUNCIONAMIENTO GENERAL. EQUIPO OK.','','ACGD SGA PS ASM W/FRU PACKAGING. N/P 2334862-2-R                                                                                                        ','*',44,1),(157,'GARANTIA','0470-2025',' ','4200431135       ','M. PREVENTIVO','2025-04-23','119284','RECIBIDO A SATISFACCIÓN EL 23/04/2023.',' ','',' ',' ',' ',' ','MANTENIMIENTO PREVENTIVO DE ABRIL 2025.',' ','',' ','COORDINADO SEGÚN CRONOGRAMA Y DISPONIBILIDAD.',' ','',' ','JOSÉ CASTILLO.                ','',1,0,0,0,0,0,0,0,'23/04/2025 08:49:36 AM',' ',1,'','1','47544               ','2025-03-26','2025-03-26','VISITA REVISIÓN DE MANTENIMIENTO. CABINA CON MANUALES, CABLES. NO HA SIDO CONECTADA LINEA AC, NO HA SIDO INSTALADA.','',' ','*',52,1),(158,'CONTRATO','0471-2025','EN TRÁMITE       ',' ','M. CORRECTIVO','2025-04-23','61497','GESTIONADO SEGÚN NOTA N° 25-229-SBM-HST POR CONDUCTO DE LA DIRECCIÓN MÉDICA DEL 27/03/2025.','MARGARITA/PROMED              ','2025-04-23','10:00 AM  ',' ',' ',' ','ALARMA, MARCA INSUFICIENCIA DE AGUA.','MIS SORAIDA/SALA 3            ','2025-04-23','9:00 AM         ','',' ','',' ','JOSÉ CASTILLO.                ','',1,0,0,0,0,0,0,0,'23/04/2025 10:22:07 AM',' ',1,'','1','250427235101127     ','2025-04-23','2025-04-23','SE VERIFICARON LOS FILTROS DE SEDIMENTO Y CARBÓN ACTIVADO, SE REALZIA DESINCRUSTACIÓN CON CITROSTERIL, PRUEBA DE FUNCIONAMIENTO, SE REALIZA DESINFECCIÓN DE AMBOS RIÑONES AL MISMO TIEMPO. SE REALIZÓ MEDICIÓN DEL PRODUCTO 2500ML.','',' ','*',44,1),(159,'GARANTIA','0472-2025',' ','4200537741       ','M. PREVENTIVO','2025-04-23','159770','RECIBIDO A SATISFACCIÓN EL 30/05/2024.',' ','',' ',' ',' ',' ','MANTENIMIENTO PREVENTIVO DE ABRIL 2025.',' ','',' ','',' ','',' ','JOSÉ CASTILLO.                ','',1,0,0,0,0,0,0,0,'23/04/2025 11:35:31 AM',' ',1,'','1','403534978           ','2025-04-22','2025-04-22','LIMPIEZA DEL EQUIPO, CALIBRACIÓN DEL SENSOR DE OXÍGENO, PRUEBA DE PVT, AUTOTEST GLOBAL ATG, AUTOTEST CORTO ATC, PRUEBA DE VENTILACIÓN CON PULMÓN DE PRUEBA. EQUIPO NO PRESENTA ERRORES NI FALLAS Y ES APTO PARA SU USO.','',' ','*',40,1),(160,'GARANTIA','0474-2025',' ','4200521814       ','M. PREVENTIVO','2025-04-24','159702','RECIBIDO A SATISFACCIÓN EL 23/06/2025.',' ','',' ',' ',' ',' ','MANTENIMIENTO PREVENTIVO DE ABRIL 2025.',' ','',' ','COORDINADO SEGÚN CRONOGRAMA Y DISPONIBILIDAD.',' ','',' ','JOSÉ CASTILLO.                ','',1,0,0,0,0,0,0,0,'24/04/2025 08:36:36 AM',' ',1,'','1','****                ','','','INSPECCIÓN DEL EQUIPO, PRUEBA DE FUNCIONAMIENTO, LIMPIEZA Y LUBRICACIÓN DE PARTES MÓVILES.','',' ','*',11,1),(161,'GARANTIA','0475-2025',' ','4200521814       '