# Host: 192.168.10.175  (Version 5.5.5-10.1.24-MariaDB)
# Date: 2025-08-13 15:14:32
# Generator: MySQL-Front 6.0  (Build 2.20)


#
# Structure for table "control_servicio"
#

CREATE TABLE `control_servicio` (
  `Id` int(11) NOT NULL AUTO_INCREMENT,
  `servicio` varchar(10) NOT NULL DEFAULT '',
  `reporte` char(10) NOT NULL DEFAULT '',
  `contrato` varchar(20) NOT NULL DEFAULT '',
  `orde_compra` varchar(20) NOT NULL DEFAULT '',
  `tipo_servicio` varchar(15) NOT NULL DEFAULT '',
  `fecha` char(10) NOT NULL DEFAULT '',
  `activo` char(10) NOT NULL DEFAULT '',
  `nota` text,
  `emp_reportado` varchar(30) NOT NULL DEFAULT '',
  `emp_fecha` char(10) NOT NULL DEFAULT '',
  `emp_hora` varchar(10) NOT NULL DEFAULT '',
  `emp_nombre_emp` varchar(30) NOT NULL DEFAULT '',
  `emp_hora_ent` varchar(10) NOT NULL DEFAULT '',
  `emp_hora_sal` varchar(10) NOT NULL DEFAULT '',
  `ser_daño` text NOT NULL,
  `ser_reportado` varchar(30) NOT NULL DEFAULT '',
  `serv_fecha_rep` char(10) DEFAULT '',
  `ser_hora_rep` varchar(255) NOT NULL DEFAULT '',
  `ser_nota` text NOT NULL,
  `bio_super` varchar(30) NOT NULL DEFAULT '',
  `bio_fecha` char(10) NOT NULL DEFAULT '',
  `bio_hora` varchar(10) NOT NULL DEFAULT '',
  `bio_jefe` varchar(30) NOT NULL DEFAULT '',
  `bio_obs` text NOT NULL,
  `bio_operacional` int(1) NOT NULL DEFAULT '0',
  `bio_par_oper` int(1) NOT NULL DEFAULT '0',
  `bio_fue_serv` int(1) NOT NULL DEFAULT '0',
  `bio_esp_inf` int(1) NOT NULL DEFAULT '0',
  `bio_espera_pieza` int(1) NOT NULL DEFAULT '0',
  `bio_cotizar` int(1) NOT NULL DEFAULT '0',
  `bio_a_pedir` int(1) NOT NULL DEFAULT '0',
  `bio_pieza_col` int(1) NOT NULL DEFAULT '0',
  `fecha_reg` varchar(30) NOT NULL DEFAULT '',
  `usuario` varchar(15) NOT NULL DEFAULT '',
  `estado` int(1) NOT NULL DEFAULT '0',
  `fecha2` char(10) NOT NULL DEFAULT '',
  `cerrada` char(1) NOT NULL DEFAULT '',
  PRIMARY KEY (`Id`)
) ENGINE=InnoDB AUTO_INCREMENT=717 DEFAULT CHARSET=latin1 ROW_FORMAT=COMPACT;

#
# Data for table "control_servicio"
#

INSERT INTO `control_servicio` VALUES (3,'CONTRATO','0115-2025','EN TRÁMITE       ',' ','M. PREVENTIVO','2025-02-13','59820','CONTRATO GESTIONADO MEDIANTE NOTA N°2025-067-SBM-HST POR CONDUCTO DE LA DIRECCIÓN MEDICA GENERAL EL 29/1/2025.',' ','',' ','JOSÉ MURILLO                  ',' ',' ','               MANTENIMIENTO PREVENTIVO DE FEBRERO 2025',' ','',' ','SERVICIO COORDINADO SEGÚN CRONOGRAMA Y DISPONIBILIDAD DEL SERVICIO.',' ','',' ',' ','',0,0,0,0,0,0,0,0,'14/02/2025 03:43:17 PM',' ',0,'',''),(4,'CONTRATO  ','0146-2025','35-2023             ','                    ','M. CORRECTIVO  ','2025-02-19','74301','GESTIONADO MEDIANTE NOTA N° 0407-23-SBM-HST POR CONDUCTO DE LA DIRECCIÓN MÉDICA. CONTRATO REFRENDADO.','SR. RENE/PROMED               ','2025-02-19','1:50 PM.  ','                              ','          ','          ','ALARMA EN EL SISTEMA.','TÉC. ANDRÉS/BIOMÉDICA         ','2025-02-19','1:50 PM         ','','                              ','','          ','                              ','',0,0,0,0,0,0,0,0,'19/02/2025 03:47:03 PM',' ',1,'',''),(5,'GARANTIA  ','0148-2025','                    ','4200533513','M. PREVENTIVO  ','2025-02-20','160391','RECIBIDO A SATISFACCIÓN 3/9/2024.','                              ','','          ','                              ','          ','          ','MANTENIMIENTO PREVENTIVO DE FEBRERO 2025.','                              ','',' ','','                              ','','          ','                              ','',0,0,0,0,0,0,0,0,'21/02/2025 02:19:53 PM',' ',0,'',''),(6,'GARANTIA','0149-2025',' ','4200533513       ','M. PREVENTIVO','2025-02-20','160393','RECIBIDO A SATISFACCIÓN EL 3/9/2024.',' ','',' ',' ',' ',' ','                  MANTENIMIENTO PREVENTIVO DE FEBRERO 2025',' ','',' ','',' ','',' ',' ','',0,0,0,0,0,0,0,0,'20/02/2025 10:46:18 AM',' ',2,'',''),(7,'GARANTIA','0150-2025',' ','4200489878       ','M. PREVENTIVO','2025-02-20','119726','RECIBIDO A SATISFACCIÓN 1/8/2023.',' ','',' ',' ',' ',' ','               MANTENIMIENTO PREVENTIVO DE FEBRERO 2025',' ','',' ','',' ','',' ',' ','',0,0,0,0,0,0,0,0,'20/02/2025 10:56:17 AM',' ',0,'',''),(8,'GARANTIA','0151-2025',' ','4200338626       ','M. PREVENTIVO','2025-02-20','108336','RECIBIDO A SATISFACCIÓN 27/10/2021.',' ','',' ',' ',' ',' ','            MANTENIMIENTO PREVENTIVO DE FEBRERO 2024 (ÚLTIMO).',' ','',' ','',' ','',' ',' ','',0,0,0,0,0,0,0,0,'20/02/2025 12:28:11 PM',' ',0,'','1'),(9,'CONTRATO  ','0152-2025','35-2023             ','                    ','M. CORRECTIVO  ','2025-02-19','74301','GESTIONADO MEDIANTE NOTA N° 0407-23-SBM-HST POR CONDUCTO DE LA DIRECCIÓN MÉDICA. CONTRATO REFRENDADO.','SR. RENE/PROMED               ','2025-02-19','1:50 PM.  ','                              ','          ','          ','ALARMA EN EL SISTEMA.','TÉC. ANDRÉS/BIOMÉDICA         ','2025-02-19','1:50 PM         ','','                              ','','          ','                              ','',0,0,0,0,0,0,0,0,'20/02/2025 12:46:16 PM',' ',1,'',''),(10,'GARANTIA  ','0153-2025','                    ','4200518460','M. CORRECTIVO  ','2025-02-20','160296','RECIBIDO A SATISFACCIÓN EL 17/7/2024.','SR. JOSE /HORACIO ICAZA       ','20/02/2025','12:50 PM  ','                              ','          ','          ','MANDA COLOR ROJO EN LA PARTE INFERIOR.','LIC. MENDOZA/MEDICINA DE VARON','20/02/2025','12:14 PM        ','','                              ','/  /','          ','                              ','',0,0,0,0,0,0,0,0,'28/03/2025 07:19:12 AM',' ',0,'2025-02-20',''),(11,'GARANTIA  ','0154-2025','                    ','4200442385','M. CORRECTIVO  ','2025-02-20','119082','RECIBIDO A SATISFACCIÓN 30/11/2022.','NILKA/PRODUCTOS  A LA MANO    ','19/02/2025','          ','                              ','          ','          ','FALTA UN FOCO PARA VER EL PRIMER # DE PRESIÓN Y TIEMPO.','LIC. JEANNETTE/SALÓN DE OPERAC','19/02/2025','                ','','                              ','/  /','          ','                              ','',0,0,0,0,0,0,0,0,'27/03/2025 02:06:37 PM',' ',0,'2025-02-20',''),(12,'GARANTIA','0155-2025',' ','                 ','M. CORRECTIVO','2025-02-20','120412','','ING. CARMEN/PROMED            ','2025-02-20','          ',' ',' ',' ','ERROR TÉCNICO','LIC. JEANNETTE/SALÓN DE OPERAC','2025-02-20','                ','',' ','',' ',' ','',0,0,0,0,0,0,0,0,'20/02/2025 02:21:12 PM',' ',0,'',''),(13,'GARANTIA','0166-2025',' ','4200578663       ','M. CORRECTIVO','2025-02-24','160630','RECIBIDO A SATISFACCIÓN 31/12/2025.','EINAR BARRAZA/ORTOMEDIC.      ','2025-02-24','12:17 PM  ',' ',' ',' ','LA PUERTA NO CIERRA','DR. DE WITT/URGENCIAS         ','2025-02-24','11:24 AM        ','',' ','',' ',' ','',0,0,0,0,0,0,0,0,'24/02/2025 12:37:52 PM',' ',1,'',''),(14,'GARANTIA','0285-2025',' ','4200513879','M. CORRECTIVO','2025-03-19','160346','EQUIPO ADQUIRIDO POR ORDEN DE COMPRA N° 4200513879. RECIBIDIO A SATISFACCIÓN EL 07/08/2024.','SRA. DINA/DENTI CLINICA.      ','2025-03-19','12:26 PM  ',' ',' ',' ','BARANDALES NO FUNCIONAN','DRA. LLOYD/SALA DE PARTO      ','2025-03-19','12:00 PM        ','',' ','',' ','JOSÉ CASTILLO.                ','',0,0,0,0,0,0,0,0,'19/03/2025 02:54:07 PM',' ',1,'','1'),(15,'GARANTIA','0297-2025',' ','4200381888       ','M. CORRECTIVO','2025-03-21','110144','ADQUIRIDO POR ORDEN DE COMPRA 4200381888, RECIBICO A SATISFACCIÓN EL 20/09/2022.','BENJAMIN/HEALTHCARE           ','21/03/2025','1:53 PM   ',' ',' ',' ','PROBLEMA DE LOS BARANDALES','LIC. MOYA/SALA 23             ','21/03/2025','1:49 PM         ','CAMA #656, ÁREA DE SEMI-INTENSIVO.',' ','/  /',' ','JOSÉ CASTILLO                 ','',0,0,0,0,0,0,0,0,'24/03/2025 08:45:14 AM',' ',0,'2025-03-21',''),(16,'GARANTIA  ','0334-2025','                    ','4200535878          ','M. CORRECTIVO  ','2025-03-28','160427','EQUIPO RECIBIDO A SATISFACCIÓN EL 03/09/2024.','MAYLENIS/PROMED               ','28/03/2025','1:33 PM   ','                              ','          ','          ','MANGUERA BOTANDO AGUA.','MIS DANIA/HEMODIÁLISIS        ','28/03/2025','1:30 PM         ','','                              ','/  /','          ','JOSÉ CASTILLO.                ','',0,0,0,0,0,0,0,0,'28/03/2025 02:18:46 PM',' ',1,'',''),(17,'GARANTIA','0335-2025',' ','4200535878       ','M. CORRECTIVO','2025-03-28','160428','EQUIPO RECIBIDO A SATISFACCIÓN EL 03/09/2024.','MAYLENIS/PROMED               ','2025-03-28','1:33 PM   ',' ',' ',' ','RECARGA DE SAL','LIC. PAULINA/HEMODIÁLISIS     ','2025-03-28','1:30 PM         ','',' ','',' ','JOSÉ CASTILLO,                ','',0,0,0,0,0,0,0,0,'28/03/2025 02:21:30 PM',' ',1,'',''),(18,'GARANTIA','0340-2025',' ','4200537741       ','M. PREVENTIVO','2025-04-01','159769','EQUIPO RECIBIDO A SATISFACCIÓN EL 30/05/2024.','ING. PAOLA/MEDTRONIC.         ','2025-04-01','12:00 PM  ',' ',' ',' ','MANTENIMIENTO DEL VENTILADOR','LIC. BILLARD/TERAPIA RESPIRATO','2025-04-01','10:22 AM        ','',' ','',' ','JOSÉ CASTILLO.                ','',0,0,0,0,0,0,0,0,'02/04/2025 07:45:31 AM',' ',1,'','1'),(19,'CONTRATO','0337-2025','TRÁMITE          ',' ','M. CORRECTIVO','2025-04-01','61629','CONTRATO GESTIONADO MEDIANTE NOTA N°2025-067-SBM-HST POR LA DIRECCIÓN MÉDICA GENERAL.',' ','',' ',' ',' ',' ','ENTREGA DE EQUIPO',' ','',' ','EQUIPO EVALUADO EN TALLER CON COTIZACIÓN ADJUNTA DE PIEZAS  MAYORES, TRÁMITE DE COMPRA.',' ','',' ',' ','',0,0,0,0,0,0,0,0,'02/04/2025 08:30:42 AM',' ',2,'',''),(20,'CONTRATO','0336-2025','TRÁMITE          ',' ','M. CORRECTIVO','2025-03-31','71633','CONTRATO GESTIONADO MEDIANTE NOTA N° 2025-067-SBM-HST POR LA DIRECCIÓN MÉDICA GENERAL.','SR. CASTILLERO/ENDOSERVICE    ','2025-03-31','8:51 AM   ',' ',' ',' ','MANDOS RÍGIDOS','DR. JAN CUBILLA/GASTRO        ','2025-03-31','8:50 AM         ','',' ','',' ','JOSÉ CASTILLO.                ','',0,0,0,0,0,0,0,0,'02/04/2025 08:47:18 AM',' ',1,'',''),(21,'CONTRATO','0224-2025','4200602634       ',' ','M. CORRECTIVO','2025-03-12','64243','','TANISHA/PROMED                ','2025-03-12','          ',' ',' ',' ','BATERIAS DEL DETECTOR NO ENCIENDEN','LIC. CUMBRERA/IMAGINOLOGÍA    ','2025-03-12','11:32 AM        ','',' ','',' ',' ','',0,0,0,0,0,0,0,0,'02/04/2025 11:24:04 AM',' ',1,'',''),(22,'CONTRATO','0223-2025','4200602634       ',' ','M. CORRECTIVO','2025-03-12','64241','',' ','',' ',' ',' ',' ',' BATERIA DEL DETECTOR NO ENCIENDE','                              ','',' ','',' ','',' ','JOSE CASTILLO.                ','',0,0,0,0,0,0,0,0,'02/04/2025 11:33:14 AM',' ',1,'',''),(23,'CONTRATO','0341-2025','4200602634       ',' ','M. CORRECTIVO','2025-04-02','64243','GESTIONADO MEDIANTE ORDEN DE COMPRA 4200602634 POR UN PERIODO DE 4 MESES.',' ','',' ',' ',' ',' ','ENTREGA DE BATERIAS DE DETECTOR','                              ','',' ','PIEZAS SOLICITADAS BAJO REPORTE ANTERIOR.',' ','',' ','JOSE CASTILLO.                ','',0,0,0,0,0,0,0,0,'02/04/2025 12:02:34 PM',' ',1,'','1'),(24,'CONTRATO','0342-2025','4200602634       ',' ','M. CORRECTIVO','2025-04-02','64246','GESTIONADO MEDIANTE ORDEN DE COMPRA N° 4200602634 POR UN PERIODO DE 4 MESES.',' ','',' ',' ',' ',' ','ENTREGA DE BATERIAS N/P 5382000',' ','',' ','PEDIDO REALIZADO EN REPORTE ANTERIOR.',' ','',' ','JOSE CASTILLO.                ','',0,0,0,0,0,0,0,0,'02/04/2025 12:07:49 PM',' ',1,'',''),(25,'CONTRATO','0319-2025','4200602634       ',' ','M. CORRECTIVO','2025-03-25','64243','',' ','',' ',' ',' ',' ','ENTREGA DE CABLE DE DETECTOR N/P5389155',' ','',' ','PIEZA SOLICITADA EN REPORTE ANTERIOR.',' ','',' ','JOSÉ CASTILLO.                ','',0,0,0,0,0,0,0,0,'02/04/2025 12:17:50 PM',' ',1,'',''),(26,'CONTRATO','0318-2025','4200602634       ',' ','M. CORRECTIVO','2025-03-26','64241','',' ','',' ',' ',' ',' ','ENTREGA DE CABLE DE DETECTOR N/P5389155.',' ','',' ','ENTREGA DE PARTE SOLICITADO EN REPORTE ANTERIOR.',' ','',' ','JOSÉ CASTILLO.                ','',0,0,0,0,0,0,0,0,'02/04/2025 12:22:26 PM',' ',1,'',''),(27,'CONTRATO','0320-2025','4200602634       ',' ','M. CORRECTIVO','2025-03-25','64245','',' ','',' ',' ',' ',' ','ENTREGA DE BATERIAS DEL DETECTOR N/P 538200',' ','',' ','PEDIDO DE PARTES BAJO REPORTE ANTERIOR.',' ','',' ','JOSÉ CASTILLO.                ','',0,0,0,0,0,0,0,0,'02/04/2025 01:45:06 PM',' ',1,'',''),(28,'CONTRATO','0343-2025','4200602634',' ','M. CORRECTIVO','2025-04-03','64241','EQUIPO BAJO CONTRATO DE MANTENIMIENTO SEGÚN ORDEN DE COMPRA N°4200602634',' ','',' ','ARMANDO DELGADO               ',' ',' ','NO ESTÁ CARGANGO/REEMPLAZO DE FIREFLY BOARD.',' ','',' ','PEDIDO DE PARTE SEGÚN REPORTE ANTERIOR. PIEZA REEMPLAZADA EL DÍA 2/04/2025.',' ','',' ','JOSÉ CASTILLO.                ','',0,0,0,0,0,0,0,0,'03/04/2025 01:25:27 PM',' ',1,'','1'),(29,'CONTRATO','0344-2025','EN TRÁMITE       ',' ','M. CORRECTIVO','2025-04-03','37826','GESTIONADO MEDIANTE NOTA N° 25-129-SBM-HST POR CONDUCTO DE LA DIRECCIÓN MÉDICA GENERAL.',' ','',' ','JULIO RODRÍGUEZ               ',' ',' ','LA MESA NO FUNCIONA',' ','',' ','REPORTE DE TURNO DEL 27/3/2025 POR PERSONAL DEL SERVICIO A PERSONAL DE BIOMÉDICA.',' ','',' ','JOSÉ CASTILLO.                ','',0,0,0,0,0,0,0,0,'03/04/2025 01:49:23 PM',' ',1,'','1'),(30,'CONTRATO','0345-2025','4200602634',' ','M. CORRECTIVO','2025-04-03','64245','GESTIONADO MEDIANTE NOTA N°25-094-SBM-HST POR CONDUCTO DE LA DIRECCIÓN MÉDICA GENERAL. OC 4200602634.',' ','',' ','JULIO RODRÍGUEZ.              ',' ',' ','PANTALLA TÁCTIL ROTA.','                              ','',' ','REPORTE DE TURNO DEL DÍA 28/3/2025 POR PERSONAL DEL SERVICIO A PERSONAL DE BIOMÉDICA.',' ','',' ','JOSÉ CASTILLO.                ','',0,0,0,0,0,0,0,0,'03/04/2025 01:56:53 PM',' ',1,'',''),(31,'CONTRATO','0192-2025','4200602634       ',' ','M. CORRECTIVO','2025-03-07','64244','',' ','',' ','EMILIO BUENO                  ',' ',' ','PROBLEMA DE CARGA, PEDIDO DE LOCUST BOARD',' ','',' ','REPORTE REALIZADO EN BASE A REPORTE EN SITIO POR RECORRIDO EN EL ÁREA.',' ','',' ','JOSE CASTILLO.                ','',0,0,0,0,0,0,0,0,'03/04/2025 02:09:04 PM',' ',1,'',''),(32,'CONTRATO','0288-2025','EN TRÁMITE       ',' ','M. CORRECTIVO','2025-03-20','37826','',' ','',' ','JULIO RODRÍGUEZ               ',' ',' ','SUGETADOR DE ANTENA DE CEREBRO ROTA.',' ','',' ','',' ','',' ','JOSE CASTILLO.                ','',0,0,0,0,0,0,0,0,'03/04/2025 02:20:26 PM',' ',1,'',''),(33,'CONTRATO','0346-2025','4200602634       ',' ','M. CORRECTIVO','2025-04-03','64246','',' ','',' ','YESFFRY PEÑALBA               ',' ',' ','REEMPLAZO DE BRAZO HORIZONTAL N/P 5506700',' ','',' ','PEDIDO REALIZADO EN REPORTE ANTERIOR.',' ','',' ','JOSÉ CASTILLO.                ','',0,0,0,0,0,0,0,0,'03/04/2025 02:28:07 PM',' ',1,'',''),(34,'CONTRATO','0186-2025','4200602634       ',' ','M. CORRECTIVO','2025-03-06','64245','',' ','',' ','EMILIO BUENO                  ',' ',' ','REEMPLAZO DE HAND SWITCH (DISPARADOR) N/P 5503500-3',' ','',' ','REPORTE REALIZADO POR EL SERVICIO, PREVIO AL INICIO DE CONTRATO. NOTIFICADO EL 6/3/2025 POR ING. EMILIO BUENO.',' ','',' ','JOSÉ CAASTILLO.               ','',0,0,0,0,0,0,0,0,'03/04/2025 02:45:50 PM',' ',1,'',''),(35,'CONTRATO','0347-2025','07-2025          ',' ','M. PREVENTIVO','2025-04-04','71741-D','CONTRATO GESTIONADO MEDIANTE NOTA N° 2025-067-SBM-HST POR LA DIRECCIÓN MÉDICA GENERAL. CONTRATO POR REFRENDO.',' ','/  /',' ',' ',' ',' ','  MANTENIMIENTO PREVENTIVO DE ABRIL 2025.',' ','/  /',' ','COORDINADO SEGÚN CRONOGRAMA Y DISPONIBILIDAD.',' ','/  /',' ','JOSÉ CASTILLO.                ','',0,0,0,0,0,0,0,0,'04/04/2025 07:22:21 AM',' ',0,'2025-04-04',''),(36,'CONTRATO','0348-2025','07-2025          ',' ','M. PREVENTIVO','2025-04-04','71741-E','GESTIONADO MEDIANTE NOTA N° 2025-067-SBM-HST POR CONDUCTO DE LA DIRECCIÓN MÉDICA GENERAL.CONTRATO POR REFRENDO.',' ','',' ',' ',' ',' ','    MANTENIMIENTO PREVENTIVO DE ABRIL 2025',' ','',' ','COORDINADO SEGÚN CRONOGRAMA Y DISPONIBILIDAD.',' ','',' ','  JOSÉ CASTILLO.              ','',0,0,0,0,0,0,0,0,'04/04/2025 07:26:26 AM',' ',0,'',''),(37,'CONTRATO','0349-2025','07-2025          ',' ','M. PREVENTIVO','2025-04-04','71741-H','GESTIONADO MEDIANTE N° 2025-067-SBM-HST POR CONDUCTO DE LA DIRECCIÓN MÉDICA GENERAL. CONTRATO POR REFRENDO.',' ','',' ',' ',' ',' ','  MANTENIMIENTO PREVENTIVO DE ABRIL 2025.',' ','',' ','COORDINADO SEGÚN CRONOGRAMA  Y DISPONIBILIDAD.',' ','',' ','JOSÉ CASTILLO.                ','',0,0,0,0,0,0,0,0,'04/04/2025 07:30:49 AM',' ',0,'',''),(38,'CONTRATO','0350-2025','07-2025          ',' ','M. PREVENTIVO','2025-04-04','71741*','GESTIONADO MEDIANTE NOTA N°2025-067-SBM-HST POR CONDUCTO DE LA DIRECCIÓN MÉDICA GENERAL. CONTRATO POR REFRENDO.',' ','',' ',' ',' ',' ','  MANTENIMIENTO PREVENTIVO DE ABRIL 2025.',' ','',' ','COORDINADO SEGÚN CRONOGRAMA Y DISPONIBILIDAD.',' ','',' ','JOSÉ CASTILLO.                ','',0,0,0,0,0,0,0,0,'04/04/2025 07:35:07 AM',' ',0,'',''),(39,'CONTRATO','0351-2025','07-2025          ',' ','M. PREVENTIVO','2025-04-04','71741-L','GESTIONADO MEDIANTE NOTA N° 2025-067-SBM-HST POR CONDUCTO DE LA DIRECCIÓN MÉDICA GENERAL. CONTRATO POR REFRENDO.',' ','',' ',' ',' ',' ','  MANTENIMIENTO PREVENTIVO DE ABRIL 2025',' ','',' ','COORDINADO SEGÚN CRONOGRAMA Y DISPONIBILIDAD.',' ','',' ','JOSÉ CASTILLO.                ','',0,0,0,0,0,0,0,0,'04/04/2025 07:38:09 AM',' ',0,'',''),(40,'CONTRATO','0352-2025','07-2025          ',' ','M. PREVENTIVO','2025-04-04','71741**','GESTIONADO MEDIANTE NOTA N° 2025-067-SBM-HST POR CONDUCTO DE LA DIRECCIÓN MÉDICA GENERAL. CONTRATO POR REFRENDO.',' ','',' ',' ',' ',' ','      MANTENIMIENTO PREVENTIVO DE ABRIL 2025.',' ','',' ','       COORDINADO SEGÚN CRONOGRAMA Y DISPONIBILIDAD.',' ','',' ','JO´SE CASTILLO.               ','',0,0,0,0,0,0,0,0,'04/04/2025 07:41:40 AM',' ',0,'',''),(41,'CONTRATO','0347A-2025','4200602634       ',' ','M. PREVENTIVO','2025-04-04','64246','GESTIONADO MEDIANTE ORDEN DE COMPRA N°4200602634.',' ','',' ',' ',' ',' ',' MANTENIMIENTO PREVENTIVO DE ABRIL 2025.',' ','',' ','  COORDINADO SEGÚN CRONOGRAMA Y DISPONIBILIDAD.',' ','',' ','JOSÉ CASTILLO.                ','',0,0,0,0,0,0,0,0,'04/04/2025 07:55:34 AM',' ',1,'','1'),(42,'CONTRATO','0291-2025','4200602634       ',' ','M. PREVENTIVO','2025-03-21','64241','',' ','',' ',' ',' ',' ','MANTENIMIENTO PREVENTIVO DE MARZO 2025.',' ','',' ','',' ','',' ','JOSÉ CASTILLO.                ','',0,0,0,0,0,0,0,0,'04/04/2025 08:17:11 AM',' ',1,'',''),(43,'CONTRATO','0301-2025','4200602634       ',' ','M. PREVENTIVO','2025-04-04','64242','',' ','',' ',' ',' ',' ','MANTENIMIENTO PREVENTIO DE ABRIL 2025',' ','',' ','',' ','',' ','JOSÉ CASTILLO.                ','',0,0,0,0,0,0,0,0,'04/04/2025 08:19:58 AM',' ',2,'',''),(44,'CONTRATO','0283-2025','4200602634       ',' ','M. PREVENTIVO','2025-03-20','64243','',' ','',' ',' ',' ',' ','  MANTENIMIENTO PREVENTIVO DE MARZO 2025',' ','',' ','',' ','',' ','JOSÉ CASTILLO.                ','',0,0,0,0,0,0,0,0,'04/04/2025 08:26:35 AM',' ',1,'',''),(45,'CONTRATO','0307-2025','4200602634       ',' ','M. CORRECTIVO','2025-03-24','64241','',' ','',' ',' ',' ',' ','PIERDE COMUNICACIÓN DEL DETECTOR CON EL EQUIPO.',' ','',' ','',' ','',' ','JOSÉ CASTILLO.                ','',0,0,0,0,0,0,0,0,'04/04/2025 08:39:49 AM',' ',1,'',''),(46,'CONTRATO','0353-2025','EN TRÁMITE       ',' ','M. CORRECTIVO','2025-04-04','61496','GESTIONADO MEDIANTE NOTA N° 25-229-SMB-HST DEL 27/03/2025 POR CONDUCTO DE LA DIRECCIÓN MÉDICA GENERAL.','MAYLENIS/PROMED               ','2025-04-04','12:01 PM  ',' ',' ',' ','    RECARGA DE SAL','    LIC. ARTURO VALDÉZ/SALA 3 ','2025-04-04','12:01 PM        ','',' ','',' ','JOSÉ CASTILLO.                ','',0,0,0,0,0,0,0,0,'04/04/2025 01:35:28 PM',' ',1,'',''),(47,'GARANTIA','0354-2025',' ','4200535878       ','M. CORRECTIVO','2025-04-04','160428','EQUIPO RECIBIDO A SATISFACCIÓN EL 03/09/2024.','MAYLENIS/PROMED               ','2025-04-04','12:01 PM  ',' ',' ',' ','  RECARGA DE SAL','LIC. ARTURO VALDÉZ/SALA 3 HEMO','2025-04-04','12:01 PM        ','',' ','',' ','JOSÉ CASTILLO.                ','',0,0,0,0,0,0,0,0,'04/04/2025 01:40:36 PM',' ',1,'',''),(48,'CONTRATO','0355-2025','EN TRÁMITE       ',' ','M. CORRECTIVO','2025-04-04','61498','GESTIONADO MEDIANTE NOTA N° 25-229-SBM-HST DEL 27/3/2025 POR CONDUCTO DE LA DIRECCIÓN MÉDICA GENERAL.','           MARICRUZ/PROMED    ','2025-04-04','1:24 PM   ',' ',' ',' ',' PRODUCCIÓN DE AGUA POR DEBAJO DE LO ESPERADO, MÁQUINA NO PREPARA MÁS DE UNA HORA DE ESPERA.','MIS DANIA/HEMODIÁLISIS.       ','2025-04-04','1:11 PM         ','',' ','',' ','JOSÉ CASTILLO.                ','',0,0,0,0,0,0,0,0,'04/04/2025 01:46:37 PM',' ',2,'',''),(49,'CONTRATO','0356-2025','EN TRÁMITE       ',' ','M. CORRECTIVO','2025-04-04','37826','','   MELISSA/PROMED             ','2025-04-04','12:37 PM  ',' ',' ',' ','   MOTOR DE LA CAMILLA SE QUEDÓ TRABADO, NO FUNCIONA.\r\n\r\n','   LIC. DE ARRIBA/RESONANCIA  ','2025-04-04','12:29 PM        ','',' ','',' ','  JOSÉ CASTILLO.              ','',0,0,0,0,0,0,0,0,'04/04/2025 01:51:00 PM',' ',1,'',''),(50,'CONTRATO','0357-2025','15-2023          ',' ','M. PREVENTIVO','2025-04-07','65492','GESTIONADO MEDIANTE NOTA N° 0319-23-SBM-HST DEL 29/5/2023 POR CONDUCTO DE LA DIRECCIÓN MÉDICA.',' ','',' ',' ',' ',' ','MANTENIMIENTO PREVENTIVO DE ABRIL 2025',' ','',' ','COORDINADO SEGÚN CRONOGRAMA Y DISPONIBILIDAD.',' ','',' ','JOSÉ CASTILLO.                ','',0,0,0,0,0,0,0,0,'07/04/2025 09:36:33 AM',' ',1,'','1'),(51,'CONTRATO','0358-2025','4200602634       ',' ','M. PREVENTIVO','2025-04-07','64244','GESTIONADO MEDIANTE ORDEN DE COMPRA N°4200602634 (2025),POR 4 MESES.',' ','',' ',' ',' ',' ','MANTENIMIENTO PREVENTIVO DE ABRIL 2025.',' ','',' ','COORDINADO SEGÚN CRONOGRAMA Y DISPONIBILIDAD. ',' ','',' ','JOSÉ CASTILLO.                ','',0,0,0,0,0,0,0,0,'07/04/2025 09:39:52 AM',' ',1,'','1'),(52,'GARANTIA','0362-2025',' ','4200537741       ','M. PREVENTIVO','2025-04-07','159768','EQUIPO RECIBIDO A SATISFACCIÓN EL 30/05/2024.',' ','',' ',' ',' ',' ',' MANTENIMIENTO PREVENTIVO DE ABRIL 2025.',' ','',' ','COORDINADO SEGÚN CRONOGRAMA Y DISPONIBILIDAD.',' ','',' ','JOSÉ CASTILLO.                ','',0,0,0,0,0,0,0,0,'07/04/2025 11:18:49 AM',' ',0,'',''),(53,'CONTRATO','0363-2025','07-2025          ',' ','M. PREVENTIVO','2025-04-08','71741-F','GESTIONADO MEDIANTE NOTA N°2025-067-SBM-HST POR CONDUCTO DE LA DIRECCIÓN MÉDICA.',' ','',' ',' ',' ',' ','MANTENIMIENTO PREVENTIVO DE ABRIL 2025.',' ','',' ','COORDINADO SEGÚN CRONOGRAMA Y DISPONIBILIDAD',' ','',' ','JOSÉ CASTILLO.                ','',0,0,0,0,0,0,0,0,'08/04/2025 07:21:07 AM',' ',0,'',''),(54,'CONTRATO','0364-2025','07-2025          ',' ','M. PREVENTIVO','2025-04-08','71741-M','GESTIONADO MEDIANTE NOTA N° 2025-067-SBM-HST POR CONDUCTO DE LA DIRECCIÓN MÉDICA.',' ','',' ',' ',' ',' ','MANTENIMIENTO PREVENTIVO DE ABRIL 2025.',' ','',' ','COORDINADO SEGÚN CRONOGRAMA Y DISPONIBILIDAD.',' ','',' ','JOSÉ CASTILLO.                ','',0,0,0,0,0,0,0,0,'08/04/2025 07:23:53 AM',' ',0,'',''),(55,'CONTRATO','0365-2025','07-2025          ',' ','M. PREVENTIVO','2025-04-08','68472','GESTIONADO MEDIANTE NOTA N°2025-067-SBM-HST POR CONDUCTO DE LA DIRECIÓN MÉDICA GENERAL.',' ','',' ',' ',' ',' ','MANTENIMIENTO PREVENTIVO DE ABRIL 2025.',' ','',' ','COORDINADO SEGÚN CRONOGRAMA Y DISPONIBILIDAD.',' ','',' ','JOSÉ CASTILLO.                ','',0,0,0,0,0,0,0,0,'08/04/2025 07:31:14 AM',' ',0,'',''),(56,'CONTRATO','0366-2025','07-2025          ',' ','M. PREVENTIVO','2025-04-08','64089','GESTIONADO MEDIANTE NOTA N° 2025-067-SBM-HST POR CONDUCTO DE LA DIRECCIÓN MÉDICA.',' ','',' ',' ',' ',' ','MANTENIMIENTO PREVENTIVO DE ABRIL 2025.',' ','',' ','COORDINADO SEGÚN CRONOGRAMA Y DISPONIBILIDAD.',' ','',' ','JOSÉ CASTILLO.                ','',0,0,0,0,0,0,0,0,'08/04/2025 07:40:52 AM',' ',0,'',''),(57,'CONTRATO','0367-2025','07-2025          ',' ','M. PREVENTIVO','2025-04-08','64083','GESTIONADO MEDIANTE NOTA N° 2025-067-SBM-HST POR CONDUCTO DE LA DIRECCIÓN MÉDICA.',' ','',' ',' ',' ',' ','MANTENIMIENTO PREVENTIVO DE ABRIL 2025.',' ','',' ','COORDINADO SEGÚN CRONOGRAMA Y DISPONIBILIDAD.',' ','',' ','JOSÉ CASTILLO.                ','',0,0,0,0,0,0,0,0,'08/04/2025 07:43:58 AM',' ',0,'',''),(58,'CONTRATO','0368-2025','TRÁMITE          ',' ','M. PREVENTIVO','2025-04-08','64084','GESTIONADO MEDIANTE NOTA N° 2025-067-SBM-HST. POR CONDUCTO DE LA DIRECCIÓN MÉDICA GENERAL.',' ','',' ',' ',' ',' ','MANTENIMIENTO PREVENTIVO DE ABRIL 2025.',' ','',' ','COORDINADO SEGÚN CRONOGRAMA Y DISPONIBILIDAD.',' ','',' ','JOSÉ CASTILLO.                ','',0,0,0,0,0,0,0,0,'08/04/2025 07:46:49 AM',' ',0,'',''),(59,'GARANTIA','0369-2025',' ','4200535878       ','M. CORRECTIVO','2025-04-08','160428','RECIBIDO A SATISFACCIÓN EL 3/9/2025.','MARGARITA/PROMED              ','2025-04-08','8:12 AM   ',' ',' ',' ','ALARMA DE FALLA EN EL SOFTWARE DEL AGUA.','LIC. IDANIA/HEMODIALISIS      ','2025-04-08','8:10 AM         ','',' ','',' ','JOSÉ CASTILLO.                ','',0,0,0,0,0,0,0,0,'08/04/2025 09:21:34 AM',' ',1,'','1'),(60,'GARANTIA','0370-2025',' ','4200513879','M. CORRECTIVO','2025-04-08','160346','RECIBIDO A SATISFACCIÓN EL 7/8/2024.','LIC. DINA/DENTI CLINICA       ','2025-04-08','1:46 PM   ',' ',' ',' ','NO SUBE Y EN LA PARTE DE ABAJO ESTÁ QUEBRADA.','LIC. INDIRA BARRIOS/SALA DE PA','2025-04-08','12:22 PM        ','',' ','',' ','JOSÉ CASTILLO.                ','',0,0,0,0,0,0,0,0,'08/04/2025 01:50:40 PM',' ',1,'','1'),(61,'CONTRATO','0371-2025','4200602634       ',' ','M. CORRECTIVO','2025-04-08','64245','GESTIONADO MEDIANTE ORDEN DE COMPRA 4200602634.',' ','',' ',' ',' ',' ','REEMPLAZO DE PANTALLA TÁCTIL N/P 5926611.',' ','',' ','PIEZA SOLICITADA EN REPORTE ANTERIOR.',' ','',' ','JOSÉ CASTILLO.                ','',0,0,0,0,0,0,0,0,'08/04/2025 02:50:49 PM',' ',1,'','1'),(62,'CONTRATO','0372-2025','4200602634       ',' ','M. CORRECTIVO','2025-04-08','64242','GESTIONADO MEDIANTE ORDEN DE COMPRA N°4200602634','TANISHA/PROMED                ','2025-04-08','2:48 PM   ',' ',' ',' ','AL BAJAR EL TUBO EL SEGURO SE ATASCA Y SE MANTIENE PANTALLA ENCENDIDA.','LIC. SAAVEDRA/IMAGINOLOGÍA    ','2025-04-08','2:45 PM         ','',' ','',' ','JOSÉ CASTILLO                 ','',0,0,0,0,0,0,0,0,'08/04/2025 02:55:02 PM',' ',2,'',''),(63,'GARANTIA','0373-2025',' ','4200447584       ','M. CORRECTIVO','2025-04-08','119257','RECIBIDO A SATISFACCIÓN EL 30/03/2023.','DAYRA/HEALTHCARE              ','2025-04-08','2:30 PM   ',' ',' ',' ','REVISIÓN DE LA CAMILLA.','DR. DE WITT/URGENCIAS         ','',' ','CAMILLA ASIGNADA AL SERVICIO DE URGENCIAS SEGÚN NOTA 150/SU-HST.',' ','',' ','JOSÉ CASTILLO                 ','',0,0,0,0,0,0,0,0,'08/04/2025 02:58:11 PM',' ',0,'',''),(64,'CONTRATO','0374-2025','EN TRÁMITE       ',' ','M. CORRECTIVO','2025-04-09','61498','CONTRATO GESTIONADO  MEDIANTE NOTA N° 25-229-SBM-HST POR CONDUCTO DE LA DIRECCIÓN MÉDICA.','MARIA LOURDES/PROMED          ','09/04/2025','7:25 AM   ',' ',' ',' ','INSUFICIENCIA DE AGUA, WATER SUPPLY/ Y FALTA DE SAL','LIC. LISBETH/HEMODIÁLISIS     ','09/04/2025','7:23 AM         ','',' ','/  /',' ','JOSÉ CASTILLO.                ','',0,0,0,0,0,0,0,0,'09/04/2025 08:00:39 AM',' ',2,'2025-04-09',''),(65,'CONTRATO','0375-2025','31-2024          ',' ','REVISION','2025-04-09','64971','CONTRATO GESTIONADO MEDIANTE NOTA N° 24-628-SBM-HST POR CONDUCTO DE LA DIRECCIÓN MÉDICA GENERAL.',' ','',' ',' ',' ',' ','INSPECCIÓN GENERAL',' ','',' ','COORDINADO SEGÚN CRONOGRAMA Y DISPONIBILIDAD.',' ','',' ','JOSÉ CASTILLO.                ','',0,0,0,0,0,0,0,0,'09/04/2025 08:08:28 AM',' ',1,'','1'),(66,'CONTRATO','0376-2025','4200602634       ',' ','M. PREVENTIVO','2025-04-09','64258','GESTIONADO MEDIANTE ORDEN DE COMPRA N° 4200602634.',' ','',' ',' ',' ',' ','MANTENIMIENTO PREVENTIVO DE ABRIL 2025.',' ','',' ','COORDINADO SEGÚN CRONOGRAMA Y DISPONIBILIDAD.',' ','',' ','JOSÉ CASTILLO.                ','',0,0,0,0,0,0,0,0,'09/04/2025 08:10:56 AM',' ',1,'','1'),(67,'CONTRATO','0377-2025','4200598718       ',' ','M. CORRECTIVO','2025-04-09','63177','GESTIONADO MEDIANTE ORDEN DE COMPRA N° 4200598718.','GRACE/ELECT. MÉDICA           ','2025-04-09','8:42 AM   ',' ',' ',' ','MENSAJE \"UNABLE TO LOG YOU ON BECAIUSE YOUR ACCOUNT HAS BEEN LOCKED OUT\"','LIC. LILIANA/IMAGINOLOGÍA     ','2025-04-09','8:40 AM         ','',' ','',' ','JOSÉ CASTILLO.                ','',0,0,0,0,0,0,0,0,'09/04/2025 09:05:22 AM',' ',2,'',''),(68,'CONTRATO','0378-2025','15-2023          ',' ','M. CORRECTIVO','2025-04-09','67794','EQUIPO BAJO CONTRATO REFRENDADO N° 15-2023.','MARLINA/ELECT. MÉDICA.        ','2025-04-09','10:38 AM  ',' ',' ',' ','ALARMA DE LA BATERÍA.','SEC. YASIRA/CARDIOLOGÍA       ','2025-04-09','10:38 AM        ','',' ','',' ','JOSÉ CASTILLO.                ','',0,0,0,0,0,0,0,0,'09/04/2025 10:51:49 AM',' ',1,'','1'),(69,'CONTRATO','0379-2025','EN TRÁMITE       ',' ','M. CORRECTIVO','2025-04-09','37826','GESTIONADO MEDIANTE NOTA N° 25-129-SBM-HST POR CONDUCTO DE LA DIRECCIÓN MÉDICA GENERAL. EL 20/2/2025.',' ','',' ','JULIO RODRÍGUEZ.              ',' ',' ','CAMBIO DE SWITCH DEL DOCK, PROBLEMAS CON LA CAMILLA. N/P 46-136334P56.',' ','',' ','PARTE SOLICITADA EN REPORTE ANTERIOR.',' ','',' ','JOSÉ CASTILLO.                ','',0,0,0,0,0,0,0,0,'09/04/2025 12:32:39 PM',' ',1,'','1'),(70,'CONTRATO','0380-2025','4200602634       ',' ','M. CORRECTIVO','2025-04-09','64244','CONTRATO GESTIONADO POR ORDEN DE COMPRA N° 4200602634 POR 4 MESES.',' ','',' ','EMILIO BUENO                  ',' ',' ','REEMPLAZO DE PIEZAS (LOCUST BOARD N/P 800812323 Y FIRE FLY N/P 535000-2',' ','',' ','PIEZAS SOLICITADAS EN REPORTE ANTERIOR.',' ','',' ','JOSÉ CASTILLO.                ','',0,0,0,0,0,0,0,0,'09/04/2025 01:46:06 PM',' ',1,'','1'),(71,'CONTRATO','0381-2025','07-2025          ',' ','M. CORRECTIVO','2025-04-09','68462','GESTIONADO MEDIANTE NOTA N° 2025-067-SBM-HST POR CONDUCTO DE LA DIRECCIÓN MÉDICA GENERAL.','CASTILLERO/ENDOSERVICE        ','2025-04-09','          ',' ',' ',' ','PRESENTA PRUEBA DE FUGA POSITIVA.','DR. JAN CUBILLA/GASTRO        ','2025-04-09','1:32 PM         ','',' ','',' ','JOSÉ CASTILLO.                ','',0,0,0,0,0,0,0,0,'09/04/2025 02:03:41 PM',' ',1,'',''),(72,'GARANTIA  ','0382-2025','                    ','4200535878          ','M. PREVENTIVO','2025-04-10','160427','EQUIPO RECIBIDO A SATISFACCIÓN EL 3/09/2024.','                              ','/  /','          ','                              ','          ','          ','MANTENIMIENTO PREVENTIVO DE ABRIL 2025.','                              ','/  /',' ','COORDINADO SEGÚN CRONOGRAMA Y DISPONIBILIDAD.','                              ','/  /','          ','JOSÉ CASTILLO.                ','',0,0,0,0,0,0,0,0,'10/04/2025 08:06:28 AM',' ',1,'2025-04-10','1'),(73,'CONTRATO  ','0383-2025','4200602634','                    ','OTROS','/  /','64242','CONTRATO GESTIONADO MEDIANTE ORDEN DE COMPRA 4200602634. POR UN PERIODO DE 4 MESES.','                              ','/  /','          ','                              ','          ','          ','PRUEBAS DE CONTROL DE CALIDAD','                              ','/  /',' ','COORDINADO SEGÚN CRONOGRAMA Y DISPONIBILIDAD CON PERSONAL DE PROTECCIÓN RADIOLÓGICA.','                              ','/  /','          ','JOSÉ CASTILLO.                ','',0,0,0,0,0,0,0,0,'11/04/2025 02:59:19 PM',' ',2,'','1'),(74,'CONTRATO','0384-2025','07-2025          ',' ','M. PREVENTIVO','2025-04-10','64086','GESTIONADO MEDIANTE NOTA N°2025-067-SBM-HST POR CONDUCTO DE LA DIRECCIÓN MÉDICA GENERAL.',' ','',' ',' ',' ',' ','MANTENIMIENTO PREVENTIVO DE ABRIL 2025.',' ','',' ','COORDINADO SEGÚN CRONOGRAMA Y DISPONIBILIDAD.',' ','',' ','JOSÉ CASTILLO.                ','',0,0,0,0,0,0,0,0,'10/04/2025 08:22:51 AM',' ',1,'','1'),(75,'CONTRATO','0385-2025','07-2025          ',' ','M. PREVENTIVO','2025-04-10','64088','GESTIONADO MEDIANTE NOTA N° 2025-067-SBM-HST POR CONDUCTO DE LA DIRECCIÓN MÉDICA GENERAL.',' ','',' ',' ',' ',' ','MANTENIMIENTO PREVENTIVO DE ABRIL 2025.',' ','',' ','COORDINADO SEGÚN CRONOGRAMA Y DISPONIBILIDAD.',' ','',' ','JOSPE CASTILLO.               ','',0,0,0,0,0,0,0,0,'10/04/2025 08:25:13 AM',' ',1,'','1'),(76,'CONTRATO','0386-2025','07-2025          ',' ','M. PREVENTIVO','2025-04-10','64087','GESTIONADO MEDIANTE NOTA N° 2025-067-SBM-HST POR CONDUCTO DE  LA DIRECCIÓN MÉDICA GENERAL.',' ','',' ',' ',' ',' ','MANTENIMIENTO PREVENTIVO DE ABRIL 2025.',' ','',' ','COORDINADO SEGÚN CRONOGRAMA Y DISPONIBILIDAD.',' ','','          ','JOSÉ CASTILLO.                ','',0,0,0,0,0,0,0,0,'10/04/2025 08:27:44 AM',' ',1,'','1'),(77,'CONTRATO','0387-2025','07-2025          ',' ','M. PREVENTIVO','2025-04-10','64082','GESTIONADO MEDIANTE NOTA N° 2025-067-SBM-HST POR CONDUCTO DE LA DIRECCIÓN MÉDICA GENERAL.',' ','',' ',' ',' ',' ','MANTENIMIENTO PREVENTIVO DE ABRIL 2025.',' ','',' ','COORDINADO SEGÚN CRONOGRAMA Y DISPONIBILIDAD.',' ','',' ','JOSÉ CASTILLO.                ','',0,0,0,0,0,0,0,0,'10/04/2025 08:29:54 AM',' ',0,'','1'),(78,'CONTRATO','0388-2025','TRÁMITE          ',' ','M. PREVENTIVO','2025-04-10','68469','GESTIONADO MEDIANTE NOTA N° 2025-067-SBM-HST POR CONDUCTO DE LA DIRECCIÓN MÉDICA GENERAL.',' ','',' ',' ',' ',' ','MANTENIMEINTO PREVENTIVO DE ABRIL 2025.',' ','',' ','COORDINADO SEGÚN CRONOGRAMA Y DISPONIBILIDAD.',' ','',' ','JOSÉ CASTILLO.                ','',0,0,0,0,0,0,0,0,'10/04/2025 08:51:53 AM',' ',1,'','1'),(79,'GARANTIA','0389-2025',' ','4200510162       ','M. CORRECTIVO','2025-04-10','120021','EQUIPO RECIBIDO A SATISFACCIÓN EL 11/12/2023.','MERIL/MED. INTERNACIONAL.     ','2025-04-10','8:20 AM   ',' ',' ',' ','PC DESCARGADA TOTALMENTE A PESAR DE ESTAR CONECTADA.','LIC. IDAYRA/NEUMOLOÍA         ','2025-04-10','8:15 AM         ','',' ','',' ','JOSÉ CASTILLO.                ','',0,0,0,0,0,0,0,0,'10/04/2025 09:23:13 AM',' ',1,'',''),(80,'GARANTIA','0390-2025',' ','4200526264       ','M. CORRECTIVO','2025-04-09','131544','','JONATHAN ZAMORA/OBRIGADO      ','2025-04-08','2:34 PM   ',' ',' ',' ','REVISIÓN DE LA CAMILLA.','DR. DE WITT/URGENCIAS         ','2025-04-09','1:41 PM         ','EQUIPO ENTRO DIRECTO AL SERVICIO, NO HAY EXPEDIENTE REGISTRADO EN BIOMÉDICA.',' ','',' ','JOSÉ CASTILLO.                ','',0,0,0,0,0,0,0,0,'10/04/2025 09:48:49 AM',' ',0,'',''),(81,'GARANTIA','0391-2025',' ','4200526264       ','M. CORRECTIVO','2025-04-09','131543','',' ','',' ',' ',' ',' ','REVISIÓN DE LA CAMILLA.',' ','',' ','EQUIPO ENTRÓ DIRECTO POR EL SERVICIO, NO HAY EXPEDIENTE CON INFORMACIÓN DETALLADA DE LA ORDEN Y RECIBIDO.',' ','',' ','JOSÉ CASTILLO.                ','',0,0,0,0,0,0,0,0,'10/04/2025 09:51:15 AM',' ',0,'',''),(82,'CONTRATO','0392-2025','13-2023          ',' ','REVISION','2025-04-11','65995','GESTIONADO CON NOTA N° 0251-23-SBM-HST EL 28/4/2023 POR CONDUCTO DE LA DIRECCIÓN MÉDICA GENERAL. CONTRATO REFRENDADO.',' ','',' ',' ',' ',' ','INSPECCIÓN GENERAL',' ','',' ','COORDINADO SEGÚN CRONOGRAMA Y DISPONIBILIDAD.',' ','',' ','JOSÉ CASTILLO.                ','',0,0,0,0,0,0,0,0,'11/04/2025 07:55:48 AM',' ',1,'','1'),(83,'GARANTIA','0393-2025',' ','4200538044       ','M. PREVENTIVO','2025-04-11','160531','',' ','',' ','JHONSON CEBALLOS.             ',' ',' ','MANTENIMIENTO PREVENTIVO DE ABRIL 2025.',' ','',' ','REVISIÓN INCLUYE REVISIÓN DE TODOS LOS COMPONENES ID 33462/35049/33463/35055',' ','',' ','JOSÉ CASTILLO                 ','',0,0,0,0,0,0,0,0,'11/04/2025 08:00:01 AM',' ',1,'','1'),(84,'GARANTIA','0395-2025',' ','4800078822       ','M. CORRECTIVO','2025-04-11','110172','RECIBIDO A SATISFACCIÓN EL 7/10/2025 .','MARICRUZ/PROMED               ','2025-04-11','9:41 AM   ',' ',' ',' ','REVISIÓN DEL MARCO DE MANIGUETA DEL AREA DE COMPARTIMENTO DEL BLOQUE ELECTRÓNICO.','LIC. ADALBERTO/SOP PERFUSIÓN  ','2025-04-11','9:27 AM         ','',' ','',' ','JOSÉ CASTILLO.                ','',0,0,0,0,0,0,0,0,'11/04/2025 10:56:55 AM',' ',0,'',''),(85,'CONTRATO','0396-2025','EN TRÁMITE       ',' ','M. CORRECTIVO','2025-04-11','70417','SE GESTIONA MEDIANTE NOTA N°24-840-SBM-HST DEL 29/11/2024 POR CONDUCTO DE LA DIRECCIÓN MÉDICA GENERAL. ','MIGUEL /DRAEGUER              ','2025-04-11','11:48 AM  ',' ',' ',' ','NO PASÓ EL TEST. REVISAR VÁLVULAS.','LIC. SERRANO/SOP MATERNIDAD.  ','2025-04-11','11:45 AM        ','',' ','',' ','JOSÉ CASTILLO.                ','',0,0,0,0,0,0,0,0,'11/04/2025 12:10:02 PM',' ',1,'','1'),(86,'GARANTIA','0397-2025',' ','4200537904       ','REVISION','2025-04-11','160499','EQUIPO RECIBIDO A SATISFACCIÓN EL 18/10/2024.',' ','',' ',' ',' ',' ','RECARGA DE SAL',' ','',' ','SE COORDINA SEGÚN INSPECCIÓN.',' ','',' ','JOSÉ CASTILLO.                ','',0,0,0,0,0,0,0,0,'11/04/2025 02:02:31 PM',' ',1,'','1'),(87,'GARANTIA','0398-2025',' ','4200533572       ','REVISION','2025-04-11','160425','RECIBIDO A SATISFACCIÓN EL 27/08/2024.',' ','',' ',' ',' ',' ','RECARGA DE SAL',' ','',' ','SE COORDINA SEGÚN INSPECCIÓN CON EL SERVICIO.',' ','',' ','JOSÉ CASTILLO.                ','',0,0,0,0,0,0,0,0,'11/04/2025 02:20:44 PM',' ',1,'','1'),(88,'CONTRATO','0399-2025','4200602634       ',' ','M. PREVENTIVO','2025-04-14','64241','CONTRATO GESTIONADO MEDIANTE ORDEN DE COMPRA N° 4200602634.',' ','',' ',' ',' ',' ','PRUEBAS DE CONTROL DE CALIDAD.',' ','',' ','COORDINADO SEGÚN CRONOGRAMA Y DISPONIBILIDAD CON PERSONAL DE PROTECCIÓN RADIOLÓGICA.',' ','',' ','JOSÉ CASTILLO.                ','',0,0,0,0,0,0,0,0,'14/04/2025 07:42:12 AM',' ',1,'','1'),(89,'GARANTIA  ','0400-2025','                    ','4200518630','M. PREVENTIVO  ','2025-04-14','131257','EQUIPO RECIBIDO A SATISFACCIÓN EL 03/01/2023.','                              ','/  /','          ','                              ','          ','          ','MANTENIMIENTO PREVENTIVO DE ABRIL 2025.','                              ','/  /',' ','COORDINADO SEGÚN CRONOGRAMA Y DISPONIBILIDAD.','                              ','/  /','          ','JOSÉ CASTILLO.                ','',0,0,0,0,0,0,0,0,'14/04/2025 08:31:14 AM',' ',1,'2025-04-14','1'),(90,'GARANTIA  ','0401-2025','                    ','4200514657','M. PREVENTIVO  ','2025-04-14','131256','EQUIPO RECIBIDO A SATISFACCIÓN EL 03/01/2024.','                              ','/  /','          ','                              ','          ','          ','MANTENIMIENTO PREVENTIVO DE ABRIL 2025.','                              ','/  /',' ','COORDINADO SEGÍN CRONOGRAMA Y DISPONIBILIDAD.','                              ','/  /','          ','JOSÉ CASTILLO.                ','',0,0,0,0,0,0,0,0,'14/04/2025 08:30:18 AM',' ',1,'2025-04-14','1'),(91,'GARANTIA  ','0402-2025','                    ','4200510980','M. PREVENTIVO  ','2025-04-14','131255','EQUIPO RECIBIDO A SATISFACCIÓN EL 10/01/2023.','                              ','/  /','          ','                              ','          ','          ','MANTENIMIENTO PREVENTIVO DE ABRIL 2025.','                              ','/  /',' ','COORDINADO SEGÚN CRONOGRAMA Y DISPONIBILIDAD.','                              ','/  /','          ','JOSÉ CASTILLO.                ','',0,0,0,0,0,0,0,0,'14/04/2025 08:29:24 AM',' ',1,'2025-04-14','1'),(92,'GARANTIA','0403-2025',' ','C51-2023 M       ','M. PREVENTIVO','2025-04-14','2324113304','EQUIPO RECIBIDO A SATISFACCIÓN EL 07/04/2025.',' ','',' ',' ',' ',' ','MANTENIMIENTO DEL SISTEMA DE BIOPSIA CON PERSONAL DE PROMED.',' ','',' ','COORDINADO SEGÚN CRONOGRAMA Y DISPONIBILIDAD.',' ','',' ','JOSÉ CASTILLO.                ','',0,0,0,0,0,0,0,0,'14/04/2025 08:09:48 AM',' ',1,'','1'),(93,'GARANTIA','0405-2025',' ','4200537741       ','M. PREVENTIVO','2025-04-14','159767','EQUIPO RECIBIDO A SATISFACCIÓN EL 30/05/2024.',' ','',' ',' ',' ',' ','MANTENIMIENTO PREVENTIVO DE ABRIL 2025',' ','',' ','COORDINADO SEGÚN DISPONIBILIDAD DEL SERVICIO.',' ','',' ','JOSÉ CASTILLO.                ','',0,0,0,0,0,0,0,0,'14/04/2025 08:54:12 AM',' ',1,'','1'),(94,'CONTRATO','0406-2025','EN TRÁMITE       ',' ','M. CORRECTIVO','2025-04-14','37826','GESTIONADO MEDIANTE NOTA N° 25-129-SBM-HST POR CONDUCTO DE LA DIRECCIÓN MÉDICA GENERAL.','MARGARITA/PROMED              ','2025-04-14','8:38 AM   ',' ',' ',' ','NO DEJA HACE PERFUSIONES Y EN LAS SECUENCIAS DE DIFUSIONES SE ENVUELVE EN RM DE CEREBRO.','LIC. DE ARRIBA/RESONANCIA     ','2025-04-14','8:24 AM         ','',' ','',' ','JO´SE CASTILLO.               ','',0,0,0,0,0,0,0,0,'14/04/2025 08:59:20 AM',' ',1,'','1'),(95,'GARANTIA','0407-2025',' ','4200552851       ','M. CORRECTIVO','2025-04-14','160426','EQUIPO RECIBIDO A SATISFACCIÓN EL 30/08/2024.','ING. OLGA/INV. SAGRAV         ','2025-04-14','9:30 AM   ',' ',' ',' ','LA PUERTA NO CIERRA BIÉN Y NO CENTRIFUGA.','LIC. BALLESTEROS/BANCO DE SANG','2025-04-14','9:05 AM         ','',' ','',' ','JOSÉ CASTILLO.                ','',0,0,0,0,0,0,0,0,'14/04/2025 09:39:49 AM',' ',1,'','1'),(96,'CONTRATO','0408-2025','EN TRÁMITE       ',' ','M. PREVENTIVO','2025-04-15','61496','CONTRATO GESTIONADO MEDIANTE NOTA N°25-229-SBM-HST POR CONDUCTO DE LA DIRECCIÓN MÉDICA.',' ','',' ',' ',' ',' ','MANTENIMIENTO PREVENTIVO DE ABRIL 2025.','                              ','',' ','COORDINADO SEGÚN CRONOGRAMA Y DISPONIBILIDAD.',' ','',' ','JOSÉ CASTILLO.                ','',0,0,0,0,0,0,0,0,'15/04/2025 07:51:43 AM',' ',1,'','1'),(97,'CONTRATO  ','0409-2025','TRÁMITE   ','                    ','M. PREVENTIVO  ','2025-04-15','63232','GESTIONADO MEDIANTE NOTA N° 25-090-SBM-HST POR CONDUCTO DE LA DIRECCIÓN MÉDICA GENERAL DEL 13/2/2025.','                              ','/  /','          ','                              ','          ','          ','MANTENIMIENTO PREVENTIVO DE ABRIL 2025.','                              ','/  /',' ','COORDINADO SEGÚN CRONOGRAMA Y DISPONIBILIDAD.','                              ','/  /','          ','JOSÉ CASTILLO.                ','',0,0,0,0,0,0,0,0,'03/06/2025 09:04:33 AM',' ',1,'2025-04-15','1'),(98,'CONTRATO','0410-2025','EN TRÁMITE       ',' ','M. PREVENTIVO','2025-04-14','64256','GESTIONADO MEDIANTE NOTA N°25-129-SBM-HST POR CONDUCTO DE LA DIRECCIÓN MÉDICA GENERAL DEL 20/2/2025.',' ','',' ',' ',' ',' ','MANTENIMIENTO PREVENTIVO DE ABRIL 2025.',' ','',' ','COORDINADO SEGÚN CRONOGRAMA Y DISPONIBILIDAD.',' ','',' ','JOSÉ CASTILLO.                ','',0,0,0,0,0,0,0,0,'15/04/2025 08:06:52 AM',' ',1,'','1'),(99,'GARANTIA','0411-2025',' ','4200510162       ','M. PREVENTIVO','2025-04-15','120021','EQUIPO RECIBIDO A SATISFACCIÓN EL 11/12/2023.',' ','',' ',' ',' ',' ','MANTENIMIENTO PREVENTIVO DE ABRIL 2025.',' ','',' ','COORDINADO SEGÚN CRONOGRAMA Y DISPONIBILIDAD.',' ','',' ','JOSÉ CASTILLO.                ','',0,0,0,0,0,0,0,0,'15/04/2025 08:09:21 AM',' ',1,'','1'),(100,'GARANTIA','0412-2025',' ','4200533612       ','M. PREVENTIVO','2025-04-15','159753','EQUIPO RECIBIDO A SATISFACCIÓN EL 30/05/2024.',' ','',' ',' ',' ',' ','MANTENIMIENTO PREVENTIVO DE ABRIL 2025',' ','',' ','COORDINADO SEGÚN CRONOGRAMA Y DISPONIBILIDAD.',' ','',' ','JOSÉ CASTILLO.                ','',0,0,0,0,0,0,0,0,'15/04/2025 08:11:15 AM',' ',1,'','1'),(101,'GARANTIA','0413-2025',' ','4200533612       ','M. PREVENTIVO','2025-04-15','159752','EQUIPO RECIBIDO A SATISFACCIÓN EL 30/05/2025.',' ','',' ',' ',' ',' ','MANTENIMIENTO PREVENTIVO DE ABRIL 2025.',' ','',' ','COORDINADO SEGÚN CRONOGRAMA Y DISPONIBILIDAD.',' ','',' ','JOSÉ CASTILLO.                ','',0,0,0,0,0,0,0,0,'15/04/2025 08:17:17 AM',' ',1,'','1'),(102,'CONTRATO','0414-2025','07-2025          ',' ','M. PREVENTIVO','2025-04-15','68468','GESTIONADO MEDIANTE NOTA N°2025-067-SBM-HST POR CONDUCTO DE LA DIRECCIÓN MÉDICA GENERAL.',' ','',' ',' ',' ',' ','MANTENIMIENTO PREVENTIVO DE ABRIL 2025',' ','',' ','COORDINADO SEGÚN CRONOGRAMA Y DISPONIBILIDAD.',' ','',' ','JOSÉ CASTILLO.                ','',0,0,0,0,0,0,0,0,'15/04/2025 08:32:45 AM',' ',1,'','1'),(103,'CONTRATO','0415-2025','07-2025          ',' ','M. PREVENTIVO','2025-04-15','38001','GESTIONADO MEDIANTE NOTA N° 2025-067-SBM-HST POR CONDUCTO DE LA DIRECCIÓN MÉDICA GENERAL.',' ','',' ',' ',' ',' ','MANTENIMIENTO PREVENTIVO DE ABRIL 2025.',' ','',' ','COORDINADO SEGÚN CRONOGRAMA Y DISPONIBILIDAD.',' ','',' ','JOSÉ CASTILLO.                ','',0,0,0,0,0,0,0,0,'15/04/2025 08:37:34 AM',' ',0,'','1'),(104,'CONTRATO','0416-2025','07-2025          ',' ','M. PREVENTIVO','2025-04-15','62501','GESTIONADO MEDIANTE NOTA N° 2025-067-SBM-HST POR CONDUCTO DE LA DIRECCIÓN MÉDICA GENERAL.',' ','',' ',' ',' ',' ','MANTENIMIENTO PREVENTIVO DE ABRIL DE 2025.',' ','',' ','COORDINADO SEGÚN CRONOGRAMA Y DISPONIBILIDAD.',' ','',' ','JOSÉ CASTILLO.                ','',0,0,0,0,0,0,0,0,'15/04/2025 08:42:27 AM',' ',1,'','1'),(105,'CONTRATO','0417-2025','07-2025          ',' ','M. PREVENTIVO','2025-04-15','31144','GESTIONADO MEDIANTE NOTA N° 2025-067-SBM-HST POR CONDUCTO DE LA DIRECCIÓN MÉDICA.',' ','',' ',' ',' ',' ','MANTENIMIENTO PREVENTIVO DE ABRIL 2025.',' ','',' ','COORDINADO SEGÚN CRONOGRAMA Y DISPONIBILIDAD.',' ','',' ','JOSÉ CASTILLO.                ','',0,0,0,0,0,0,0,0,'15/04/2025 08:44:42 AM',' ',1,'','1'),(106,'CONTRATO  ','0418-2025','TRÁMITE   ','                    ','M. PREVENTIVO  ','2025-04-15','31143','GESTIONADO MEDIANTE NOTA N° 2025-067-SBM-HST POR CONDUCTO DE LA DIRECCIÓN MÉDICA GENERAL.','                              ','/  /','          ','                              ','          ','          ','MANTENIMIENTO PREVENTIVO DE ABRIL 2025','                              ','/  /',' ','COORDINADO SEGÚN CRONOGRAMA Y DISPONIBILIDAD.','                              ','/  /','          ','JOSÉ CASTILLO.                ','',0,0,0,0,0,0,0,0,'15/04/2025 08:49:46 AM',' ',1,'2025-04-15','1'),(107,'GARANTIA','0419-2025',' ','4800096289       ','M. CORRECTIVO','2025-04-15','160307','EQUIPO RECIBIDO A SATISFACCIÓN EL 27/06/2025.','MAYLENIS/PROMED               ','2025-04-15','9:32 AM   ',' ',' ',' ','NO MARCA EL TRAZO, SALE MUY CLARO CASI NO SE VE.','DRA ARIS DE MENDIETA/SEGO     ','2025-04-15','9:21 AM         ','',' ','',' ','JOSÉ CASTILLO.                ','',0,0,0,0,0,0,0,0,'15/04/2025 09:35:50 AM',' ',1,'',''),(108,'CONTRATO  ','0420-2025','TRÁMITE   ','                    ','M. PREVENTIVO  ','2025-04-15','63232','GESTIONADO MEDIANTE NOTA N°25-090-SBM-HST POR CONDUCTO DE LA DIRECCIÓN MÉDICA GENERAL DEL 13/02/2025.','MARLINA/ELECT. MÉDICA.        ','15/04/2025','10:58 AM  ','                              ','          ','          ','LA PANTALLA DEL MONITOR DE LA EXTRAVISIÓN SE APAGÓ DURANTE EL PROCEDIMIENTO.','LIC. YESSICA/HEMODINÁMICA     ','15/04/2025','10:55 AM        ','\r\n\r\n','                              ','/  /','          ','JOSÉ CASTILLO.                ','',0,0,0,0,0,0,0,0,'03/06/2025 09:03:47 AM',' ',1,'2025-04-15','1'),(109,'CONTRATO','0421-2025','EN TRÁMITE       ',' ','OTROS','2025-04-15','58239','GESTIONADO MEDIANTE NOTA N°25-128-SBM-HST POR CONDUCTO DE LA DIRECCIÓN MÉDICA DEL 20/02/2025.',' ','',' ',' ',' ',' ','TOMA DE MUESTRAS',' ','',' ','',' ','',' ','JOSÉ CASTILLO.                ','',0,0,0,0,0,0,0,0,'15/04/2025 01:59:18 PM',' ',1,'','1'),(110,'CONTRATO','0422-2025','EN TRÁMITE       ',' ','M. PREVENTIVO','2025-04-15','58240','GESTIONADO MEDIANTE NOTA N°25-128-SBM-HST POR CONDUCTO DE LA DIRECCIÓN MÉDICA GENERAL DEL 20/02/2025.',' ','',' ',' ',' ',' ','TOMA DE MUESTRAS',' ','',' ','',' ','',' ','JOSÉ CASTILLO.                ','',0,0,0,0,0,0,0,0,'15/04/2025 02:01:16 PM',' ',1,'','1'),(111,'GARANTIA','0423-2025',' ','4200522983       ','M. PREVENTIVO','2025-04-16','159761','EQUIPO RECIBIDO A SATISFACCIÓN EL 03/06/2025.',' ','',' ',' ',' ',' ','MANTENIMIENTO PREVENTIVO DE ABRIL 2025',' ','',' ','COORDINADO SEGÚN CRONOGRAMA Y DISPONIBILIDAD.',' ','',' ','JOSÉ CASTILLO.                ','',0,0,0,0,0,0,0,0,'16/04/2025 08:22:13 AM',' ',2,'','1'),(112,'CONTRATO','0424-2025','EN TRÁMITE       ',' ','REVISION','2025-04-16','60966','GESTIONADO MEDIANTE NOTA N°2025-034-SBM-HST POR CONDUCTO DE LA DIRECCIÓN MÉDICA GENERAL DEL 28/01/2025.',' ','',' ',' ',' ',' ','INSPECCIÓN GENERAL',' ','',' ','COORDINADO SEGÚN CRONOGRAMA Y DISPONIBILIDAD.',' ','',' ','JOSÉ CASTILLO.                ','',0,0,0,0,0,0,0,0,'16/04/2025 08:25:46 AM',' ',1,'','1'),(113,'CONTRATO','0425-2025','EN TRÁMITE       ',' ','M. PREVENTIVO','2025-04-16','61497','GESTIONADO MEDIANTE NOTA N° 25-229-SBM-HST POR CONDUCTO DE LA DIRECCIÓN MÉDICA DEL 27/03/2025.',' ','',' ',' ',' ',' ','MANTENIMIENTO PREVENTIVO DE ABRIL 2025.',' ','',' ','COORDINADO SEGÚN CRONOGRAMA Y DISPONIBILIDAD.',' ','',' ','JOSÉ CASTILLO.                ','',0,0,0,0,0,0,0,0,'16/04/2025 08:30:35 AM',' ',1,'','1'),(114,'GARANTIA','0426-2025',' ','4200534969       ','M. PREVENTIVO','2025-04-16','159757','EQUIPO RECIBIDO A SATISFACCIÓN EL 08/06/2024.','SR. JOSÉ /IMP. MEDICAL        ','2025-04-16','10:36 AM  ',' ',' ',' ','ALARMA DE MANTENIMIENTO PREVENTIVO  Y ALARMA DE CAMBIO DE BATERIA.','LIC. ALEXANDER/T. RESPIRATORIA','2025-04-16','10:05 AM        ','',' ','',' ','JOSÉ CASTILLO.                ','',0,0,0,0,0,0,0,0,'16/04/2025 10:37:51 AM',' ',0,'','1'),(115,'CONTRATO','0427-2025','4200598718       ',' ','M. CORRECTIVO','2025-04-16','63177','GESTIONADO MEDIANTE ORDEN DE COMPRA N° 4200598718.','MARLINA/ELECT. MÉDICA         ','2025-04-16','10:07 AM  ',' ',' ',' ','NO CONECTA EL EQUIPO CON LA VIEW FORUM PARA EL ENVÍO Y RECEPCIÓN DE IMÁGENES.','LIC. FEMENIAS/IMAGINOLOGÍA    ','2025-04-16','10.05 AM        ','',' ','',' ','JOSÉ CASTILLO.                ','',0,0,0,0,0,0,0,0,'16/04/2025 10:40:34 AM',' ',2,'','1'),(116,'CONTRATO','0430-2025','4200602634       ',' ','M. PREVENTIVO','2025-04-17','64245','GESTIONADO MEDIANTE ORDEN DE COMPRA N° 4200602634.',' ','',' ',' ',' ',' ','PRUEBAS DE CONTROL DE CALIDAD.',' ','',' ','TRABAJO COORDINADO CON PERSONAL DE PROTECCIÓN RADIOLÓGICA DE LA INSTITUCIÓN.',' ','',' ','JOSÉ CASTILLO.                ','',0,0,0,0,0,0,0,0,'17/04/2025 07:43:56 AM',' ',1,'','1'),(117,'CONTRATO','0431-2025','EN TRÁMITE       ',' ','M. PREVENTIVO','2025-04-17','61498','GESTIONADO SEGÚN NOTA N°25-229-SBM-HST POR CONDUCTO DE LA DIRECCIÓN MÉDICA GENERAL DEL 27/03/2025.',' ','',' ',' ',' ',' ','MANTENIMIENTO PREVENTIVO DE ABRIL 2025.',' ','',' ','COORDINADO SEGÚN CRONOGRAMA Y DISPONIBILIDAD.',' ','',' ','JOSÉ CASTILLO.                ','',0,0,0,0,0,0,0,0,'17/04/2025 07:46:21 AM',' ',2,'','1'),(118,'GARANTIA','0432-2025',' ','4200535878       ','M. PREVENTIVO','2025-04-17','160428','RECIBIDO A SATISFACCIÓN EL 03/09/2025.',' ','',' ',' ',' ',' ','MANTENIMIENTO PREVENTIVO DE ABRIL 2025.',' ','',' ','COORDINADO SEGÚN CRONOGRAMA Y DISPONIBILIDAD.',' ','',' ','JOSÉ CASTILLO.                ','',0,0,0,0,0,0,0,0,'17/04/2025 07:48:12 AM',' ',1,'','1'),(119,'GARANTIA','0433-2025',' ','4200522983       ','M. PREVENTIVO','2025-04-17','159760','RECIBIDO A SATISFACCIÓN EL 03/06/2024.',' ','',' ',' ',' ',' ','MANTENIMIENTO PREVENTIVO DE ABRIL 2025.',' ','',' ','COORDINADO SEGÚN CRONOGRAMA Y DISPONIBILIDAD.',' ','',' ','JOSÉ CASTILLO.                ','',0,0,0,0,0,0,0,0,'17/04/2025 07:50:00 AM',' ',1,'','1'),(120,'GARANTIA','0434-2025',' ','4200534969       ','M. PREVENTIVO','2025-04-17','159758','RECIBIDO A SATISFACCIÓN EL 08/05/2024.',' ','',' ',' ',' ',' ','MANTENIMIENTO PREVENTIVO DE ABRIL 2025',' ','',' ','COORDINADO SEGÚN CRONOGRAMA Y DISPONIBILIDAD.',' ','',' ','JOSÉ CASTILLO.                ','',0,0,0,0,0,0,0,0,'17/04/2025 07:59:00 AM',' ',1,'','1'),(121,'GARANTIA','0435-2025',' ','4200534969       ','M. PREVENTIVO','2025-04-17','159757','RECIBIDO A SATISFACCIÓN EL 08/05/2024.',' ','',' ',' ',' ',' ','MANTENIMIENTO PREVENTIVO DE ABRIL 2025.',' ','',' ','COORDINADO SEGÚN CRONOGRAMA Y DISPONIBILIDAD.',' ','',' ','JOSÉ CASTILLO.                ','',0,0,0,0,0,0,0,0,'17/04/2025 08:01:05 AM',' ',0,'','1'),(122,'GARANTIA','0436-2025',' ','4200534969       ','M. PREVENTIVO','2025-04-17','159756','RECIBIDO A SATISFACCIÓN EL 08/05/2024.',' ','',' ',' ',' ',' ','MANTENIMIENTO PREVENTIVO DE ABRIL 2025.',' ','',' ','COORDINADO SEGÚN CRONOGRAMA Y DISPONIBILIDAD.',' ','',' ','JOSÉ CASTILLO.                ','',0,0,0,0,0,0,0,0,'17/04/2025 08:03:34 AM',' ',0,'','1'),(123,'GARANTIA','0437-2025',' ','4200534969       ','M. PREVENTIVO','2025-04-17','159755','RECIBIDO A SATISFACCIÓN EL 08/05/2024.',' ','',' ',' ',' ',' ','MANTENIMIENTO PREVENTIVO DE ABRIL 2025.',' ','',' ','COORDINADO SEGÚN CRONOGRAMA Y DISPONIBILIDAD.',' ','',' ','JOSÉ CASTILLO.                ','',0,0,0,0,0,0,0,0,'17/04/2025 08:07:48 AM',' ',1,'','1'),(124,'GARANTIA','0438-2025',' ','4200367887       ','M. PREVENTIVO','2025-04-21','109220','EQUIPO RECIBIDO A SATISFACCIÓN EL 10/08/2022.',' ','',' ',' ',' ',' ','MANTENIMIENTO PREVENTIVO DE ABRIL 2025.',' ','',' ','COORDINADO SEGÚN CRONOGRAMA Y DISPONIBILIDAD.',' ','',' ','JOSÉ CASTILLO.                ','',0,0,0,0,0,0,0,0,'21/04/2025 07:40:31 AM',' ',0,'',''),(125,'GARANTIA','0439-2025',' ','4200522983       ','M. PREVENTIVO','2025-04-21','159759','EQUIPO RECIBIDO A SATISFACCIÓN EL 03/06/2024.',' ','',' ',' ',' ',' ','MANTENIMIENTO PREVENTIVO DE ABRIL 2025.',' ','',' ','COORDINADO SEGÚN CRONOGRAMA Y DISPONIBILIDAD.',' ','',' ','JOSÉ CASTILLO.                ','',0,0,0,0,0,0,0,0,'21/04/2025 07:44:05 AM',' ',1,'','1'),(126,'CONTRATO','0440-2025','35-2023          ',' ','M. PREVENTIVO','2025-04-18','74301','GESTIONADO MEDIANTE NOTA N°0407-23-SBM-HST POR CONDUCTO DE LA DIRECCIÓN MÉDICA GENERAL ',' ','',' ',' ',' ',' ','MANTENIMIENTO PREVENTIVO DE ABRIL 2025',' ','',' ','COORDINADO SEGÚN CRONOGRAMA Y DISPONIBILIDAD.',' ','',' ','JOSÉ CASTILLO.                ','',0,0,0,0,0,0,0,0,'21/04/2025 07:54:36 AM',' ',1,'','1'),(127,'CONTRATO','0441-2025','02-2024          ',' ','M. PREVENTIVO','2025-04-21','400552','GESTIONADO MEDIANTE NOTA N°091223-SBM-HST POR CONDUCTO DE LA DIRECCIÓN MÉDICA GENERAL.',' ','',' ',' ',' ',' ','MANTENIMIENTO PREVENTIVO DE ABRIL 2025.',' ','',' ','COORDINADO SEGÚN CRONOGRAMA Y DISPONIBILIDAD.',' ','',' ','JOSÉ CASTILLO.                ','',0,0,0,0,0,0,0,0,'21/04/2025 08:59:08 AM',' ',1,'','1'),(128,'CONTRATO','0442-2025','EN TRÁMITE       ',' ','M. PREVENTIVO','2025-04-21','64465','GESTIONADO MEDIANTE NOTA N° 24-840-SBM-HST DEL 29/11/2025 POR CONDUCTO DE LA DIRECCIÓN MÉDICA GENERAL.',' ','',' ',' ',' ',' ','MANTENIMIENTO PREVENTIVO DE ABRIL 2025',' ','',' ','COORDINADO SEGÚN CRONOGRAMA Y DISPONIBILIDAD.',' ','',' ','JOSÉ CASTILLO.                ','',0,0,0,0,0,0,0,0,'21/04/2025 09:18:35 AM',' ',1,'','1'),(129,'CONTRATO','0444-2025','CONT. MINSA      ',' ','M. PREVENTIVO','2025-04-21','71489','CONTRATO GESTIONADO POR EL MINSA-BIOMEDICAL SUPPORT POR UN PERIDO DE 36 MESES.',' ','',' ',' ',' ',' ','MANTENIMIENTO PREVENTIVO DE ABRIL 2025.',' ','',' ','COORDINADO SEGÚN CRONOGRAMA Y DISPONIBILIDAD.',' ','',' ','JOSÉ CASTILLO.                ','',0,0,0,0,0,0,0,0,'21/04/2025 09:21:37 AM',' ',1,'','1'),(130,'CONTRATO','0443-2025','EN TRÁMITE       ',' ','M. PREVENTIVO','2025-04-21','70416','GESTIONADO MEDIANTE NOTA N° 24-840-SBM-HST. DEL 29/11/2025 POR CONDUCTO DE LA DIRECCIÓN MÉDICA GENERAL.',' ','',' ',' ',' ',' ','MANTENIMIENTO PREVENTIVO DE ABRIL 2025.',' ','',' ','COORDINADO SEGÚN CRONOGRAMA Y DISPONIBILIDAD.',' ','',' ','JOSÉ CASTILLO.                ','',0,0,0,0,0,0,0,0,'21/04/2025 09:33:49 AM',' ',1,'','1'),(131,'CONTRATO','0445-2025','EN TRÁMITE       ',' ','M. CORRECTIVO','2025-04-21','37826','GESTIONADO MEDIANTE NOTA N° 25-129-SBM-HST DEL 20/02/2025 POR CONDUCTO DE LA DIRECCIÓN MÉDICA GENERAL.','MARGARITA/PROMED              ','2025-04-21','8:39 PM   ',' ',' ',' ','NO LEVANTA. NO SALE PANTALLA DE INICIO.','LIC. LIDIA/RESONANCIA.        ','2025-04-21','8:14 AM         ','',' ','',' ','JOSÉ CASTILLO.                ','',0,0,0,0,0,0,0,0,'21/04/2025 09:40:24 AM',' ',1,'','1'),(132,'CONTRATO','0446-2025','07-2025          ',' ','M. CORRECTIVO','2025-04-21','38001','GESTIONADO MEDIANTE NOTA N° 2025-067-SBM-HST POR CONDUCTO DE LA DIRECCIÓN MÉDICA GENERAL.','SR. CASTILLERO/ENDOSERVICE    ','2025-04-21','9:40 AM   ',' ',' ',' ','FUGA POSITIVA EN EL TUBO DE LUZ.','DR. PAREDES/NEUMOLOGÍA        ','2025-04-17','11:47 AM        ','ENTREGA DE NOTA POR JEFATURA EL 21/04/2025 PARA REALIZAR REPORTE A LA EMPRESA.',' ','',' ','JOSÉ CASTILLO.                ','',0,0,0,0,0,0,0,0,'21/04/2025 09:45:38 AM',' ',0,'','1'),(133,'CONTRATO','0447-2025','4200602634       ',' ','M. CORRECTIVO','2025-04-21','64245','GESTIONADO MEDIANTE ORDEN DE COMPRA 4200602634.','ESTEFANI/PROMED               ','2025-04-21','11:49 AM  ',' ',' ',' ','ARTEFACTO EN LAS IMÁGENES.','LIC. CUMBRERA/URGENCIAS.      ','2025-04-21','11:49 AM        ','',' ','',' ','JOSÉ CASTILLO.                ','',0,0,0,0,0,0,0,0,'21/04/2025 02:20:58 PM',' ',1,'','1'),(134,'GARANTIA','0448-2025',' ','4800073174       ','M. CORRECTIVO','2025-04-21','109984','EQUIPO RECIBIDO A SATISFACCIÓN EL 14/07/2025.',' ','',' ',' ',' ',' ','MANGUERA ROTA','                              ','',' ','REPORTE DEL DÍA 17/4/2025 POR PERSONAL DEL SERVICIO A PERSONAL DE BIOMÉDICA DE TURNO.',' ','',' ','JOSÉ CASTILLO.                ','',0,0,0,0,0,0,0,0,'21/04/2025 02:51:08 PM',' ',1,'',''),(135,'CONTRATO','0449-2025','EN TRÁMITE       ',' ','M. PREVENTIVO','2025-04-22','63219','GESTIONADO MEDIANTE NOTA N°25-213-SBM-HST POR CONDUCTO DE LA DIRECCIÓN MÉDICA GENERAL EL 21/03/2025.',' ','',' ',' ',' ',' ','MANTENIMIENTO PREVENTIVO DE ABRIL 2025',' ','',' ','COORDINADO SEGÚN CRONOGRAMA Y DISPONIBILIDAD.',' ','',' ','JOSÉ CASTILLO.                ','',0,0,0,0,0,0,0,0,'22/04/2025 08:17:05 AM',' ',2,'','1'),(136,'CONTRATO  ','0450-2025','CONT./MINSA         ','                    ','M. PREVENTIVO  ','2025-04-22','58108','CONTRATO GESTIONADO DIRECTAMENTE POR EL MINSA/BIOMEICAL SUPPORT.','                              ','/  /','          ','                              ','          ','          ','MANTENIMIENTO PREVENTIVO DE ABRIL 2025.','                              ','/  /',' ','COORDINADO SEGÚN CRONOGRAMA Y DISPONIBILIDAD.','                              ','/  /','          ','JOSÉ CASTILLO.                ','',0,0,0,0,0,0,0,0,'22/04/2025 08:35:25 AM',' ',1,'2025-04-22','1'),(137,'GARANTIA','0451-2025',' ','4200444628       ','M. PREVENTIVO','2025-04-22','119444','RECIBIDO A SATISFACCIÓN EL 8/6/2023.',' ','',' ',' ',' ',' ','MANTENIMIENTO PREVENTIVO DE ABRIL 2025.',' ','',' ','COORDINADO SEGÚN CRONOGRAMA Y DISPONIBILIDAD.',' ','',' ','JOSÉ CASTILLO.                ','',0,0,0,0,0,0,0,0,'22/04/2025 08:50:58 AM',' ',0,'',''),(138,'GARANTIA','0452-2025',' ','4200444628       ','M. PREVENTIVO','2025-04-22','119445','RECIBIDO A SATISFACCIÓN EL 08/06/2023.',' ','',' ',' ',' ',' ','MANTENIMIENTO PREVENTIVO DE ABRIL 2025.',' ','',' ','COORDINADO SEGÚN CRONOGRAMA Y DISPONIBILIDAD.',' ','',' ','JOSÉ CASTILLO.                ','',0,0,0,0,0,0,0,0,'22/04/2025 08:52:22 AM',' ',1,'','1'),(139,'GARANTIA','0453-2025',' ','4200444628       ','M. PREVENTIVO','2025-04-22','119446','RECIBIDO A SATISFACCIÓN 08/06/2023.',' ','',' ',' ',' ',' ','MANTENIMIENTO PREVENTIVO DE ABRIL 2025.',' ','',' ','COORDINADO SEGÚN CRONOGRAMA Y DISPONIBILIDAD.',' ','',' ','JOSÉ CASTILLO.                ','',0,0,0,0,0,0,0,0,'22/04/2025 08:59:36 AM',' ',1,'','1'),(140,'GARANTIA','0454-2025',' ','4200444628       ','M. PREVENTIVO','2025-04-22','119447','EQUIPO RECIBIDO A SATISFACCIÓN EL 08/06/2023.',' ','',' ',' ',' ',' ','MANTENIMIENTO PREVENTIVO DE ABRIL 2025.',' ','',' ','COORDINADO SEGÚN CRONOGRAMA Y DISPONIBILIDAD.',' ','',' ','JOSÉ CASTILLO.                ','',0,0,0,0,0,0,0,0,'22/04/2025 09:01:07 AM',' ',1,'','1'),(141,'GARANTIA','0455-2025',' ','4200444628       ','M. PREVENTIVO','2025-04-22','119448','RECIBIDO A SATISFACCIÓN EL 08/06/2023.',' ','',' ',' ',' ',' ','MANTENIMIENTO PREVENTIVO DE ABRIL 2025.',' ','',' ','COORDINADO SEGÚN CRONOGRAMA Y DISPONIBILIDAD.',' ','',' ','JOSÉ CASTILLO.                ','',0,0,0,0,0,0,0,0,'22/04/2025 09:02:48 AM',' ',0,'','1'),(142,'GARANTIA','0456-2025',' ','4200444628       ','M. PREVENTIVO','2025-04-22','119449','RECIBIDO A SATISFACCIÓN EL 08/06/2023.',' ','',' ',' ',' ',' ','MANTENIMIENTO PREVENTIVO DE ABRIL 2025.',' ','',' ','COORDINADO SEGÚN CRONOGRAMA Y DISPONIBILIDAD.',' ','',' ','JOSÉ CASTILLO.                ','',0,0,0,0,0,0,0,0,'22/04/2025 09:04:13 AM',' ',1,'','1'),(143,'CONTRATO','0457-2025','EN TRÁMITE       ',' ','OTROS','2025-04-22','58240','GESTIONADO',' ','',' ',' ',' ',' ','REMUESTREO.',' ','',' ','',' ','',' ','JOSÉ CASTILLO.                ','',0,0,0,0,0,0,0,0,'22/04/2025 09:51:17 AM',' ',1,'','1'),(144,'GARANTIA','0458-2025',' ','4200537741       ','M. CORRECTIVO','2025-04-22','159766','EQUIPO RECIBIDO A SATISFACCIÓN EL 30/05/2024.',' ','/  /',' ',' ',' ',' ','MANTENIMIENTO PREVENTIVO DE ABRIL 2025.',' ','/  /',' ','COORDINADO SEGÚN CRONOGRAMA Y DISPONIBILIDAD.',' ','/  /',' ','JOSÉ CASTILLO.                ','',0,0,0,0,0,0,0,0,'22/04/2025 10:32:40 AM',' ',1,'2025-04-22','1'),(145,'GARANTIA  ','0458A-2025','                    ','4200537741','M. CORRECTIVO  ','2025-04-22','159766','EQUIPO RECIBIDO A SATISFACCIÓN EL 30/05/2024.','                              ','','          ','                              ','          ','          ','MANTENIMIENTO PREVENTIVO DE ABRIL 2025.','                              ','',' ','COORDINADO SEGÚN CRONOGRAMA Y DISPONIBILIDAD.','                              ','','          ','JOSÉ CASTILLO.                ','',0,0,0,0,0,0,0,0,'22/04/2025 10:34:46 AM',' ',1,'','1'),(146,'CONTRATO','0459-2025','TRÁMITE          ',' ','M. CORRECTIVO','2025-04-22','63232','GESTIONADO MEDIANTE NOTA N° 25-090-SBM-HST POR CONDUCTO DE LA DIRECCIÓN MÉDICA GENERAL EL 13/02/2025.','MARLINA/ELECT. MÉDICA         ','2025-04-22','10:20 AM  ',' ',' ',' ','PANTALLA PRINCIPAL DE FLUOROSCOPIA EN VIVO PRESENTA RUÍDO EN LA SEÑAL.','LIC. DANNI/HEMODINÁMICA       ','2025-04-22','10:10 AM        ','',' ','',' ','JOSÉ CASTILLO.                ','',0,0,0,0,0,0,0,0,'22/04/2025 10:39:26 AM',' ',1,'','1'),(147,'CONTRATO','0460-2025','TRÁMITE          ',' ','M. CORRECTIVO','2025-04-22','63232','GESTIONADO MEDIANTE NOTA N°25-090-SBM-HST POR CONDUCTO DE LA DIRECCIÓN MÉDICA GENERAL EL 13/02/2025.','MARLINA/ELECT. MÉDICA         ','2025-04-22','10:20 AM  ',' ',' ',' ','PANTALLA DE LA INTERVENTIONAL TOOLS QUE RECONSTRUYE, SE APAGA Y CPU QUEDA ENCENDIDO.','LIC. ROBERTO/HEMODINÁMICA     ','2025-04-22','10:10 AM        ','',' ','',' ','JOSÉ CASTILLO.                ','',0,0,0,0,0,0,0,0,'22/04/2025 10:46:19 AM',' ',1,'','1'),(148,'CONTRATO','0461-2025','TRÁMITE          ',' ','M. CORRECTIVO','2025-04-22','68462','GESTIONADO MEDIANTE NOTA N° 2025-067-SBM-HST POR CONDUCTO DE LA DIRECCIÓN MÉDICA GENERAL.',' ','',' ',' ',' ',' ','ENTREGA DE EQUIPO REPARADO.',' ','',' ','SE REGISTRA ENTREGA CON ACTA Y PERSONAL DE BIENES PATRIMONIALES.',' ','',' ','JOSÉ CASTILLO.                ','',0,0,0,0,0,0,0,0,'22/04/2025 10:52:21 AM',' ',1,'','1'),(149,'GARANTIA','0462-2025',' ','C51-2023 M       ','M. CORRECTIVO','2025-04-22','2324113304','EQUIPO RECIBIDO A SATISFACCIÓN EL 07/02/2025.\r\n','JORGE/RESERMA                 ','2025-04-22','10:27 AM  ',' ',' ',' ','SE APAGÓ EL EQUIPO, SE DA EXPOSICIÓN Y NO GUARDÓ LAS IMÁGENES.','LIC. ANGELA/RAYOS X PPAL. MAMO','2025-04-22','10:18 AM        ','',' ','',' ','JOSÉ CASTILLO.                ','',0,0,0,0,0,0,0,0,'22/04/2025 10:56:08 AM',' ',1,'','1'),(150,'CONTRATO','0463-2025','4200602634       ',' ','M. CORRECTIVO','2025-04-22','64245','GESTIONADO MEDIANTE ORDEN DE COMPRA 4200602634.',' ','',' ',' ',' ',' ','NO CARGA.',' ','',' ','REPORTE DE TURNO DEL 17/04/2025 POR PERSONAL DEL SERVICIO A PERSONAL DE BIOMÉDICA.',' ','',' ','JOSÉ CASTILLO.                ','',0,0,0,0,0,0,0,0,'23/04/2025 07:38:55 AM',' ',1,'','1'),(151,'CONTRATO','0464-2025','4200602634       ',' ','M. CORRECTIVO','2025-04-22','64243','GESTIONADO MEDIANTE ORDEN DE COMPRA N° 4200602634.',' ','',' ',' ',' ',' ','ERROR DE PROPULSOR.',' ','',' ','REPORTE DE TURNO DEL DÍA 19/04/2025 POR PERSONAL DEL SERVICIO A PERSONAL DE BIOMÉDICA.',' ','',' ','JOSÉ CASTILLO.                ','',0,0,0,0,0,0,0,0,'23/04/2025 07:41:13 AM',' ',1,'','1'),(152,'CONTRATO  ','0465-2025','4200602634','                    ','M. CORRECTIVO  ','2025-04-22','64246','GESTIONADO MEDIANTE ORDEN DE COMPRA N° 4200602634.','                              ','/  /','          ','                              ','          ','          ','NO CARGA.','                              ','/  /',' ','REPORTE DE TURNO DEL 14/03/2025 EN HORARIO DE 3-11 PM Y 16/04/2025 POR PERSONAL DEL SERVICIO A PERSONAL DE BIOMÉDICA.','                              ','/  /','          ','JOSÉ CASTILLO.                ','',0,0,0,0,0,0,0,0,'23/04/2025 07:52:03 AM',' ',1,'2025-04-22','1'),(153,'CONTRATO','0466-2025','4200602634       ',' ','M. CORRECTIVO','2025-04-22','64242','GESTIONADO MEDIANTE ORDEN DE COMPRA N°4200602634.',' ','',' ',' ',' ',' ','YOYO NO RETRAE.',' ','',' ','REPORTE DE TURNO DEL 17/04/2025 POR PERSONAL DEL SERVICIO A PERSONAL DE BIOMÉDICA.',' ','',' ','JOSÉ CASTILLO.                ','',0,0,0,0,0,0,0,0,'23/04/2025 07:54:32 AM',' ',2,'','1'),(154,'CONTRATO','0467-2025','EN TRÁMITE       ',' ','M. CORRECTIVO','2025-04-22','37826','GESTIONADO MEDIANTE NOTA N°25-129-SBM-HST POR CONDUCTO DE LA DIRECCIÓN MÉDICA GENERAL.',' ','',' ',' ',' ',' ','ALARMA ','                              ','',' ','REPORTE DE FIN DE SEMANA DÍA 13/04/2025, SE PRESENTÓ ALARMA EN EL EQUIPO.',' ','',' ','JOSÉ CASTILLO.                ','',0,0,0,0,0,0,0,0,'23/04/2025 08:08:38 AM',' ',1,'','1'),(155,'CONTRATO','0468-2025','EN TRÁMITE       ',' ','M. CORRECTIVO','2025-04-22','37826','GESTIONADO MEDIANTE NOTA N°25-129-SBM-HST POR CONDUCTO DE LA DIRECCIÓN MÉDICA GENERAL.',' ','',' ',' ',' ',' ','PANTALLA SE REINICIA.',' ','',' ','DAÑO NOTIFICADO EN SITIO, NO REPORTADO A BIOMÉDICA.',' ','',' ','JOSÉ CASTILLO.                ','',0,0,0,0,0,0,0,0,'23/04/2025 08:20:17 AM',' ',1,'','1'),(156,'CONTRATO  ','0469-2025','EN TRÁMITE','                    ','M. CORRECTIVO  ','2025-04-22','37826','GESTIONADO MEDIANTE NOTA N°25-129-SBM-HST POR CONDUCTO DE LA DIRECCIÓN MÉDICA GENERAL.','                              ','','          ','                              ','          ','          ','ARQUEO ELÉCTRICO EN FUENTES DE GRADIENTES.','                              ','',' ','TRABAJO COORDINADO CON EL SERVICIO DE IMAGINOLOGÍA.','                              ','','          ','JOSÉ CASTILLO.                ','',0,0,0,0,0,0,0,0,'23/04/2025 08:22:07 AM',' ',1,'','1'),(157,'GARANTIA','0470-2025',' ','4200431135       ','M. PREVENTIVO','2025-04-23','119284','RECIBIDO A SATISFACCIÓN EL 23/04/2023.',' ','',' ',' ',' ',' ','MANTENIMIENTO PREVENTIVO DE ABRIL 2025.',' ','',' ','COORDINADO SEGÚN CRONOGRAMA Y DISPONIBILIDAD.',' ','',' ','JOSÉ CASTILLO.                ','',0,0,0,0,0,0,0,0,'23/04/2025 08:49:36 AM',' ',1,'','1'),(158,'CONTRATO','0471-2025','EN TRÁMITE       ',' ','M. CORRECTIVO','2025-04-23','61497','GESTIONADO SEGÚN NOTA N° 25-229-SBM-HST POR CONDUCTO DE LA DIRECCIÓN MÉDICA DEL 27/03/2025.','MARGARITA/PROMED              ','2025-04-23','10:00 AM  ',' ',' ',' ','ALARMA, MARCA INSUFICIENCIA DE AGUA.','MIS SORAIDA/SALA 3            ','2025-04-23','9:00 AM         ','',' ','',' ','JOSÉ CASTILLO.                ','',0,0,0,0,0,0,0,0,'23/04/2025 10:22:07 AM',' ',1,'','1'),(159,'GARANTIA','0472-2025',' ','4200537741       ','M. PREVENTIVO','2025-04-23','159770','RECIBIDO A SATISFACCIÓN EL 30/05/2024.',' ','',' ',' ',' ',' ','MANTENIMIENTO PREVENTIVO DE ABRIL 2025.',' ','',' ','',' ','',' ','JOSÉ CASTILLO.                ','',0,0,0,0,0,0,0,0,'23/04/2025 11:35:31 AM',' ',1,'','1'),(160,'GARANTIA','0474-2025',' ','4200521814       ','M. PREVENTIVO','2025-04-24','159702','RECIBIDO A SATISFACCIÓN EL 23/06/2025.',' ','',' ',' ',' ',' ','MANTENIMIENTO PREVENTIVO DE ABRIL 2025.',' ','',' ','COORDINADO SEGÚN CRONOGRAMA Y DISPONIBILIDAD.',' ','',' ','JOSÉ CASTILLO.                ','',0,0,0,0,0,0,0,0,'24/04/2025 08:36:36 AM',' ',1,'','1'),(161,'GARANTIA','0475-2025',' ','4200521814       ','M. PREVENTIVO','2025-04-24','159703','RECIBIDO A SATISFACCIÓN EL 23/05/2024.',' ','',' ',' ',' ',' ','MANTENIMIENTO PREVENTIVO DE ABRIL 2025',' ','',' ','COORDINADO SEGÚN CRONOGRAMA Y DISPONIBILIDAD.',' ','',' ','JOSÉ CASTILLO.                ','',0,0,0,0,0,0,0,0,'24/04/2025 08:41:49 AM',' ',1,'','1'),(162,'CONTRATO','0476-2025','EN TRÁMITE       ',' ','M. PREVENTIVO','2025-04-24','61499','GESTIONADO MEDIANTE NOTA N°25-229-SBM-HST POR CONDUCTO DE LA DIRECCIÓN MÉDICA GENERAL DEL 27/03/2025.',' ','',' ',' ',' ',' ','MANTENIMIENTO PREVENTIVO DE ABRIL 2025.',' ','',' ','COORDINADO SEGÚN CRONOGRAMA Y DISPONIBILIDAD.',' ','',' ','JOSÉ CASTILLO.                ','',0,0,0,0,0,0,0,0,'24/04/2025 08:47:22 AM',' ',2,'','1'),(163,'GARANTIA','0477-2025',' ','4200533742       ','M. CORRECTIVO','2025-04-24','159705','RECIBIDO A SATISFACCIÓN EL 17/04/2025.','LIC. DINA/DENTI CLINICA       ','24/04/2025','12:24 PM. ',' ',' ',' ','REVISIÓN DE LA CAMILLA','DR. DE WITT/URGENCIAS         ','24/04/2025','10:40 AM        ','',' ','/  /',' ','JOSÉ CASTILLO.                ','',0,0,0,0,0,0,0,0,'24/04/2025 02:13:19 PM',' ',1,'2025-04-24','1'),(164,'CONTRATO','0487-2025','07-2025          ',' ','M. CORRECTIVO','2025-04-28','2500431','GESTIONADO MEDIANTE NOTA N° 2025-067-SBM-HST POR CONDUCTO DE LA DIRECCIÓN MÉDICA GENERAL.','SR. CASTILLERO/ENDOSERVICE    ','2025-04-25','2:00 PM   ',' ',' ',' ','ELEVADOR DAÑADO','DR. JAN CUBILLA/GASTRO        ','2025-04-25','1:44 PM         ','',' ','',' ','JOSÉ CASTILLO.                ','',0,0,0,0,0,0,0,0,'28/04/2025 07:59:14 AM',' ',1,'','1'),(165,'GARANTIA','0488-2025',' ','4200510162       ','M. CORRECTIVO','2025-04-28','120021','RECIBIDO A SATISFACCIÓN DE 11/12/2023.',' ','',' ',' ',' ',' ','ENTREGA DE PC EVALUADA EN TALLER.',' ','',' ','',' ','',' ','JOSÉ CASTILLO.                ','',0,0,0,0,0,0,0,0,'28/04/2025 08:17:31 AM',' ',1,'','1'),(166,'CONTRATO','0489-2025','4200598718       ',' ','M. CORRECTIVO','2025-04-28','63163','SE GESTIONA MEDIANTE NOTA N° 25-195-SBM-HST Y ORDEN DE COMPRA N° 4200598718.',' ','',' ',' ',' ',' ','MANTENIMIENTO PREVENTIVO DE ABRIL 2025',' ','',' ','COORDINADO SEGÚN CRONOGRAMA Y DISPONIBILIDAD.',' ','',' ','JOSÉ CASTILLO.                ','',0,0,0,0,0,0,0,0,'28/04/2025 08:30:19 AM',' ',1,'','1'),(167,'GARANTIA','0490-2025',' ','4200542249       ','M. PREVENTIVO','2025-04-28','159764','EQUIPO RECIBIDO A SATISFACCIÓN EL 08/05/2024.',' ','',' ',' ',' ',' ','MANTENIMIENTO PREVENTIVO DE ABRIL 2025.',' ','',' ','COORDINADO SEGÚN CRONOGRAMA Y DISPONIBILIDAD.',' ','',' ','JOSÉ CASTILLO.                ','',0,0,0,0,0,0,0,0,'28/04/2025 08:32:15 AM',' ',0,'',''),(168,'GARANTIA','0491-2025',' ','4200524713       ','M. CORRECTIVO','2025-04-28','120678','EQUIPO RECIBIDO A SATISFACCIÓN EL 15/12/2023.','ANA LEYDI/BIOMATERIALES       ','2025-04-28','8:10 AM   ',' ',' ',' ','NO VIBRA.','TÉCNICA CARMEN CRUZ/MAXILOFACI','2025-04-28','7:55 AM         ','',' ','',' ','JOSÉ CASTILLO.                ','',0,0,0,0,0,0,0,0,'28/04/2025 08:36:54 AM',' ',0,'','1'),(169,'GARANTIA','0493-2025',' ','4200535878       ','M. CORRECTIVO','2025-04-28','160427','EQUIPO RECIBIDO A SATISFACCIÓN EL 03/09/2024.',' ','',' ',' ',' ',' ','FALTA DE SAL','                              ','',' ','REPORTE DE TURNO FIN DE SEMANA DÍA 27/04/2025 POR PERSONAL DE HEMODIÁLISIS A PERSONAL DE BIOMÉDICA.',' ','',' ','JOSÉ CASTILLO.                ','',0,0,0,0,0,0,0,0,'28/04/2025 08:41:56 AM',' ',1,'','1'),(170,'GARANTIA','0492-2025',' ','4200524713       ','M. CORRECTIVO','2025-04-28','120679','EQUIPO RECIBIDO A SATISFACCIÓN EL 15/12/2023.','ANA LEYDI/BIOMATERIALES       ','2025-04-28','8:10 AM   ',' ',' ',' ','PROBLEMAS CON LA MANGUERA.','TÉC. CARMEN CRUZ./MAXILOFACIAL','2025-04-28','7:55 AM         ','TÉCNICA INDICA QUE EQUIPO ESTÁ DAÑADO DESDE EL 9/04/2025, REPORTADO EL DÍA DE HOY.',' ','',' ','JOSÉ CASTILLO.                ','',0,0,0,0,0,0,0,0,'28/04/2025 08:52:31 AM',' ',0,'','1'),(171,'CONTRATO  ','0494-2025','EN TRÁMITE','                    ','OTROS          ','2025-04-28','61498','GESTIONADO MEDIANTE NOTA N° 25-229-SBM-HST POR CONDUCTO DE LA DIRECCIÓN MÉDICA DEL 27/03/2025.','                              ','/  /','          ','                              ','          ','          ','TOMA DE MUESTRA.','                              ','/  /',' ','COORDINADO SEGÚN DISPONIBILIDAD CON EL SERVICIO.','                              ','/  /','          ','JOSÉ CASTILLO.                ','',0,0,0,0,0,0,0,0,'28/04/2025 11:15:20 AM',' ',2,'2025-04-28','1'),(172,'CONTRATO','0495-2025','35-2023   ',' ','INSTALACION','2025-04-28','74301','',' ','',' ',' ',' ',' ','INSTALACIÓN DE SISTEMA DE ALARMA.',' ','',' ','ACCIÓN REALIZADA POR LA EMPRESA.',' ','',' ','JOSÉ CASTILLO.                ','',0,0,0,0,0,0,0,0,'28/04/2025 02:32:53 PM',' ',1,'','1'),(173,'GARANTIA','0496-2025',' ','4200535878       ','M. CORRECTIVO','2025-04-28','160427','EQUIPO RECIBIDO A SATISFACCIÓN EL 3/09/2024.','MAYLENI/PROMED                ','2025-04-28','1:32 AM   ',' ',' ',' ','CONDUCTIVIDAD ALTA, NO ARRANCA.','LIC. ARIANA MONTERREY/UCI 3   ','2025-04-28','1:30 PM         ','',' ','',' ','JOSÉ CASTILLO.                ','',0,0,0,0,0,0,0,0,'28/04/2025 02:47:58 PM',' ',1,'','1'),(174,'GARANTIA','0497-2025',' ','4200525765       ','M. PREVENTIVO','2025-04-29','131402','RECIBIDO A SATISFACCIÓN EL 01/04/2024.',' ','',' ',' ',' ',' ','MANTENIMIENTO PREVENTIVO DE ABRIL 2025.',' ','',' ','',' ','',' ','JOSÉ CASTILLO.                ','',0,0,0,0,0,0,0,0,'29/04/2025 10:55:14 AM',' ',0,'','1'),(175,'GARANTIA','0498-2025',' ','4200525765       ','M. PREVENTIVO','2025-04-29','131403','EQUIPO RECIBIDO A SATISFACCIÓN EL 01/02/2024.',' ','',' ',' ',' ',' ','MANTENIMIENTO PREVENTIVO DE ABRIL 2025.',' ','',' ','COORDINADO SEGÚN CRONOGRAMA Y DISPONIBILIDAD.',' ','',' ','JOSÉ CASTILLO.                ','',0,0,0,0,0,0,0,0,'29/04/2025 10:57:05 AM',' ',0,'','1'),(176,'CONTRATO','0499-2025','4200526326       ',' ','M. PREVENTIVO','2025-04-29','71621','GESTIONADO POR ORDEN DE COMPRA MANTENIMIENTO OC 4200526326.',' ','',' ',' ',' ',' ','MANTENIMIENTO PREVENTIVO (PENDIENTE)',' ','',' ','',' ','',' ','JOSÉ CASTILLO.                ','EN BASE A NOTA DE COMPROMISO LA EMPRESA REALIZA VISITAS DE MP PENDIENTES.',0,0,0,0,0,0,0,0,'29/04/2025 11:11:35 AM',' ',0,'',''),(177,'GARANTIA','0500-2025',' ','4200443854       ','M. CORRECTIVO','2025-04-29','119259','EQUIPO RECIBIDO A SATISFACCIÓN 06/04/2023.','CANDY/HOSPITALAR              ','2025-04-29','10:50 AM  ',' ',' ',' ','SE SALIÓ TAPIZ DEL FRENTE.','TÉC. QUINTERO/BIOMÉDICA.      ','2025-04-29','10:45 AM        ','',' ','',' ','JOSÉ CASTILLO.                ','',0,0,0,0,0,0,0,0,'29/04/2025 11:15:35 AM',' ',1,'','1'),(178,'CONTRATO','0501-2025','TRÁMITE          ',' ','M. CORRECTIVO','2025-04-29','63232','GESTIONADO MEDIANTE NOTA N° 25-090-SBM-HST. POR CONDUCTO DE LA DIRECCIÓN MÉDICA GENERAL.','MARLINA/ELECT. MÉDICA         ','2025-04-29','10:00 AM  ',' ',' ',' ','MONITOR DE LA INTERVENTIONAL TOOLS PARA ADQUISICIÓN EN 3D SE APAGÓ DOS VECES DURANTE PROCEDIMIENTO CON NEURO.','LIC. DANNI/HEMODINÁMICA       ','2025-04-29','9:53 AM         ','',' ','',' ','JOSÉ CASTILLO.                ','',0,0,0,0,0,0,0,0,'29/04/2025 11:28:15 AM',' ',1,'','1'),(179,'CONTRATO  ','0502-2025','EN TRÁMITE','          ','OTROS          ','2025-04-29','61497','GESTIONADO MEDIANTE NOTA N° 25-229-SBM-HST POR CONDUCTO DE LA DIRECCIÓN MÉDICA DEL 27/03/2025.','                              ','/  /','          ','                              ','          ','          ','TOMA DE MUESTRA','                              ','/  /',' ','COORDINADO SEGÚN DISPONIBILIDAD.','                              ','/  /','          ','JOSÉ CASTILLO.                ','',0,0,0,0,0,0,0,0,'15/07/2025 02:50:13 PM',' ',1,'2025-04-29','1'),(180,'GARANTIA','0503-2025',' ','4200516376       ','M. CORRECTIVO','2025-04-29','120398','EQUIPO RECIBIDO A SATISFACCIÓN EL 23/11/2023.','DAYRA/HEALTHCARE              ','30/04/2025','8:15 AM   ',' ',' ',' ','NO SE ESCUCHA, SE COLOCÓ BATERÍA NUEVA Y NO FUNCIONA.','DR. BRAVO/SEGO                ','29/04/2025','11:58 AM        ','',' ','/  /',' ','JOSÉ CASTILLO.                ','',0,0,0,0,0,0,0,0,'30/04/2025 07:40:12 AM',' ',1,'2025-04-29','1'),(181,'GARANTIA  ','0503A-2025','                    ','4200516376','M. CORRECTIVO  ','2025-04-29','120398','EQUIPO RECIBIDO A SATISFACCIÓN EL 23/11/2023.','DAYRA/HEALTHCARE              ','','8:15 AM   ','                              ','          ','          ','NO SE ESCUCHA, SE COLOCÓ BATERÍA NUEVA Y NO FUNCIONA.','DR. BRAVO/SEGO                ','','11:58 AM        ','','                              ','','          ','JOSÉ CASTILLO.                ','',0,0,0,0,0,0,0,0,'30/04/2025 07:47:09 AM',' ',1,'',''),(182,'CONTRATO','0504-2025','4200602634       ',' ','M. CORRECTIVO','2025-04-30','64242','GESTIONADO SEGÚN ORDEN DE COMPRA N° 4200602634.',' ','',' ',' ',' ',' ','REEMPLAZO  DE CABLE AC RETRÁCTIL. N/P 444444-2',' ','',' ','',' ','',' ','JOSÉ CASTILLO.                ','',0,0,0,0,0,0,0,0,'30/04/2025 02:49:29 PM',' ',2,'',''),(183,'GARANTIA','0505-2025',' ','4200535878       ','M. PREVENTIVO','2025-05-02','160428','RECIBIDO A SATISFACCIÓN EL 03/09/2024',' ','',' ',' ',' ',' ','TOMA DE MUESTRA.',' ','',' ','',' ','',' ','JOSÉ CASTILLO.                ','',0,0,0,0,0,0,0,0,'02/05/2025 07:29:58 AM',' ',1,'','1'),(184,'GARANTIA  ','0506-2025','                    ','4200535878','M. PREVENTIVO  ','2025-05-02','160428','RECIBIDO A SATISFACCIÓN EL 03/09/2024','                              ','','          ','                              ','          ','          ','RE-INSTALACIÓN CON MÁQUINA DE HEMODIÁLISIS.','                              ','',' ','REALIZADO POR NECESIDAD DEL SERVICIO Y FALLA EN EQUIPO CON        ID 36577.','                              ','','          ','JOSÉ CASTILLO.                ','',0,0,0,0,0,0,0,0,'02/05/2025 07:32:13 AM',' ',1,'','1'),(185,'CONTRATO','0507-2025','EN TRÁMITE       ',' ','M. PREVENTIVO','2025-05-02','61496','GESTIONADO MEDIANT ENOTA N° 25-229-SBM-HST POR CONDUCTO DE LA DIRECCIÓN MÉDICA GENERAL EL 27/03/2025.',' ','',' ',' ',' ',' ','MANTENIMIENTO PREVENTIVO DE MAYO 2025.',' ','',' ','COORDINADO SEGÚN CRONOGRAMA Y DISPONIBILIDAD.',' ','',' ','JOSÉ CASTILLO.                ','',0,0,0,0,0,0,0,0,'02/05/2025 07:39:29 AM',' ',1,'','1'),(186,'CONTRATO','0508-2025','15-2023          ',' ','REVISION','2025-05-05','67794','GESTIONADO MEDIANTE NOTA N°0319-23-SBM-HST DEL 29/5/2023 POR \t\t\t\t\r\nCONDUCTO DE LA DIRECCIÓN MÉDICA. CONTRATO REFRENDADO.\t\t\t\t\r\n',' ','',' ',' ',' ',' ','INSPECCIÓN GENERAL.',' ','',' ','COORDINADO SEGÚN CRONOGRAMA Y DISPONIBILIDAD.',' ','',' ','JOSÉ CASTILLO.                ','',0,0,0,0,0,0,0,0,'05/05/2025 07:38:51 AM',' ',1,'','1'),(187,'GARANTIA','0509-2025',' ','C51-2023 M       ','M. PREVENTIVO','2025-05-05','2324113304','EQUIPO ADQUIRIDO POR EL MINSA BAJO CONTRATO 51-2023. RECIBIDO A SATISFACCIÓN 07/02/2024.',' ','',' ',' ',' ',' ','MANTENIMIENTO PREVENTIVO DE MAYO 2025.',' ','',' ','COORDINADO SEGÚN CRONOGRAMA Y DISPONIBILIDAD.',' ','',' ','JOSÉ CASTILLO.                ','',0,0,0,0,0,0,0,0,'05/05/2025 07:42:39 AM',' ',1,'',''),(188,'CONTRATO','0510-2025','CONT./MINS       ',' ','M. CORRECTIVO','2025-05-02','58108','CONTRATO GESTIONADO POR EL MINSA.','JANIS CABALLERO/BIOMEDICAL SUP','2025-05-02','11:48 AM  ',' ',' ',' ','NO DA EXPOSICIÓN.','LIC. ROSALES/C. EXTERNA ORTOPE','2025-05-02','11:45 AM        ','',' ','',' ','JOSÉ CASTILLO.                ','',0,0,0,0,0,0,0,0,'05/05/2025 08:24:03 AM',' ',1,'','1'),(189,'CONTRATO','0511-2025','EN TRÁMITE       ',' ','M. CORRECTIVO','2025-05-05','63219','','GREYS/E. MÉDICA.              ','2025-05-05','10:25 AM  ',' ',' ',' ','SE DETUVO ADQUISICIÓN EN MITAD DEL PROCEDIMIENTO.','LIC. DANNI/CAT PPAL.          ','2025-05-05','10:23 AM        ','',' ','',' ','JOSÉ CASTILLO.                ','',0,0,0,0,0,0,0,0,'05/05/2025 11:13:19 AM',' ',2,'','1'),(190,'CONTRATO  ','0512-2025','EN TRÁMITE','                    ','OTROS          ','2025-05-05','61496','GESTIONADO MEDIANTE NOTA N° 25-229-SBM-HST POR CONDUCTO DE LA DIRECCIÓN MÉDICA GENERAL DEL 27/03/2025.','                              ','/  /','          ','                              ','          ','          ','TOMA DE MUESTRA DEL MES DE ABRIL.','                              ','/  /',' ','SE REPROGRAMA SEGÚN DISPONIBILIDAD.','                              ','/  /','          ','JOSÉ CASTILLO.                ','',0,0,0,0,0,0,0,0,'05/05/2025 11:17:03 AM',' ',1,'2025-05-05','1'),(191,'CONTRATO  ','0513-2025','EN TRÁMITE','                    ','OTROS          ','2025-05-05','61496','GESTIONADO MEDIANTE NOTA N° 25-229-SBM-HST POR CONDUCTO DE LA DIRECCIÓN MÉDICA GENERAL DEL 27/03/2025.','                              ','','          ','                              ','          ','          ','TOMA DE MUESTRA DEL MES DE ABRIL.','                              ','',' ','SE REPROGRAMA SEGÚN DISPONIBILIDAD.','                              ','','          ','JOSÉ CASTILLO.                ','',0,0,0,0,0,0,0,0,'05/05/2025 11:17:55 AM',' ',1,'','1'),(192,'CONTRATO  ','0514-2025','TRÁMITE   ','                    ','M. CORRECTIVO  ','2025-05-05','63232','CONTRATO GESTIONADO MEDIANTE NOTA N° 25-090-SBM-HST POR CONDUCTO DE LA DIRECCIÓN MEDICA GENERAL DEL 13/2/2025.\t\t\t\t\t\r\n','                              ','/  /','          ','                              ','          ','          ','ENTREGA DE CPU DE EXCELERA N/S 65SC95J','                              ','/  /',' ','EQUIPO EN TALLER BAJO EVALUACIÓN Y REPARACIÓN.','                              ','/  /','          ','JOSÉ CASTILLO.                ','',0,0,0,0,0,0,0,0,'05/05/2025 11:50:55 AM',' ',1,'2025-05-05','1'),(193,'CONTRATO','05115-2025','4200598718       ',' ','M. CORRECTIVO','2025-05-05','63163','SE GESTIONA MEDIANTE NOTA N° 25-195-SBM-HST. MEDIANTE ORDEN DE COMPRA N° 4200598718.\t\t\t\t\r\n',' ','',' ',' ',' ',' ','ENTREGA DE CCPU DE LA VIEWFORUM N/P 6DPPQL1',' ','',' ','CPU FUE EVALUADA Y REPARADA EN TALLER DE LA EMPRESA.',' ','',' ','JOSÉ CASTILLO.                ','',0,0,0,0,0,0,0,0,'05/05/2025 11:58:39 AM',' ',1,'',''),(194,'CONTRATO  ','0515-2025','4200598718','                    ','M. CORRECTIVO  ','2025-05-05','63163','SE GESTIONA MEDIANTE NOTA N° 25-195-SBM-HST. MEDIANTE ORDEN DE COMPRA N° 4200598718.\t\t\t\t\r\n','                              ','','          ','                              ','          ','          ','ENTREGA DE CCPU DE LA VIEWFORUM N/P 6DPPQL1','                              ','',' ','CPU FUE EVALUADA Y REPARADA EN TALLER DE LA EMPRESA.','                              ','','          ','JOSÉ CASTILLO.                ','',0,0,0,0,0,0,0,0,'05/05/2025 11:59:19 AM',' ',1,'','1'),(195,'CONTRATO','0516-2025','4200602634       ',' ','M. CORRECTIVO','2025-05-05','64241','CONTRATO GESTIONADO MEDIANTE ORDEN DE COMPRA N°4200602634.',' ','',' ',' ',' ',' ','CABLE DE CONEXIÓN DEL TUBO QUE SOPORTA EL COLIMADOR DAÑADO.','LIC. PICADO/URGENCIAS         ','2025-05-05','12:25 PM        ','',' ','',' ','JOSÉ CASTILLO.                ','',0,0,0,0,0,0,0,0,'05/05/2025 01:42:44 PM',' ',1,'','1'),(196,'GARANTIA','0517-2025',' ','4200446629       ','M. CORRECTIVO','2025-05-05','119237','RECIBIDO A SATISFACCIÓN EL 23/02/2023.','KARINA/HOSPITALAR             ','2025-05-05','2:27 PM   ',' ',' ',' ','REVISIÓN GENERAL','LIC. MENDOZA/MEDICINA DE VAROE','2025-05-05','2:14 PM         ','',' ','',' ','JOSÉ CASTILLO.                ','',0,0,0,0,0,0,0,0,'05/05/2025 02:33:45 PM',' ',0,'','1'),(197,'CONTRATO','0519-2025','4200602634       ',' ','M. PREVENTIVO','2025-05-06','39740','GESTIONADO MEDIANTE ORDEN DE COMPRA N° 4200602634.',' ','',' ',' ',' ',' ','MANTENIMIENTO PREVENTIVO DE MAYO 2025.',' ','',' ','COORDINADO SEGÚN CRONOGRAMA Y DISPONIBILIDAD.',' ','',' ','JOSÉ CASTILLO.                ','',0,0,0,0,0,0,0,0,'06/05/2025 11:58:57 AM',' ',0,'','1'),(198,'CONTRATO','0521-2025','EN TRÁMITE       ',' ','M. CORRECTIVO','2025-05-06','61498','GESTIONADO MEDIANTE NOTA N° 25-229-SBM-HST POR CONDUCTO DE LA DIRECCIÓN MÉDICA GENERAL DEL 27/03/2025.','MARIA LOURDES/PROMED          ','2025-05-06','8:03 AM   ',' ',' ',' ','FALTA DE AGUA, ESTÁ PITANDO','LIC. KAROL/SALA 20 TBC        ','2025-05-06','7:51 AM         ','',' ','',' ','JOSÉ CASTILLO.                ','',0,0,0,0,0,0,0,0,'06/05/2025 12:05:43 PM',' ',2,'','1'),(199,'CONTRATO  ','0522-2025','EN TRÁMITE','                    ','M. PREVENTIVO','2025-05-06','61498','GESTIONADO MEDIANTE NOTA N° 25-229-SBM-HST POR CONDUCTO DE LA DIRECCIÓN MÉDICA GENERAL DEL 27/03/2025.','                              ','','          ','                              ','          ','          ','MANTENIMIENTO PREVENTIVO DE MAYO 2025','                              ','','                ','SE ADELANTA VISITA DE MANTENIMIENTO POR LA DISPONIBILIDAD POR PARTE DEL SERVICIO.','                              ','','          ','JOSÉ CASTILLO.                ','',0,0,0,0,0,0,0,0,'06/05/2025 12:09:50 PM',' ',2,'','1'),(200,'GARANTIA','0523-2025',' ','4200381888       ','M. CORRECTIVO','2025-05-06','110039','RECIBIDO A SATISFACCIÓN EL 30/09/2022.','DAYRA/HEALTHCARE              ','2025-05-05','1:54 PM   ',' ',' ',' ','CABLE AC EN CORTO.','LIC. YENISETH/SALA 6          ','2025-05-05','1:46 PM         ','',' ','',' ','JOSÉ CASTILLO.                ','',0,0,0,0,0,0,0,0,'06/05/2025 12:12:40 PM',' ',0,'',''),(201,'CONTRATO','0524-2025','4200602634       ',' ','M. PREVENTIVO','2025-06-07','39751','CONTRATO GESTIONADO SEGÚN ORDEN DE COMPRA N° 4200602634.',' ','',' ',' ',' ',' ','MANTENIMIENTO PREVENTIVO DE MAYO 2025.',' ','',' ','COORDINADO SEGÚN CRONOGRAMA Y DISPONIBILIDAD.',' ','',' ','JOSÉ CASTILLO.                ','',0,0,0,0,0,0,0,0,'07/05/2025 07:22:11 AM',' ',0,'','1'),(202,'CONTRATO','0525-2025','EN TRÁMITE       ',' ','M. PREVENTIVO','2025-06-07','61497','GESTIONADO MEDIANTE NOTA N° 25-229-SBM-HST POR CONDUCTO DE LA DIRECCIÓN MÉDICA DEL 27/03/2025.',' ','',' ',' ',' ',' ','MANTENIMIENTO PREVENTIVO DE MAYO 2025.',' ','',' ','COORDINADO SEGÚN CRONOGRAMA Y DISPONIBILIDAD.',' ','',' ','JOSÉ CASTILLO.                ','',0,0,0,0,0,0,0,0,'07/05/2025 07:23:54 AM',' ',1,'','1'),(203,'CONTRATO  ','0526-2025','CONT./MINSA      ','                    ','M. CORRECTIVO  ','2025-06-07','58108','CONTRATO GESTIONADO DIRECTAMENTE POR EL MINSA/BIOMEDICAL SUPPORT.','                              ','/  /','          ','                              ','          ','          ','REEMPLAZO DE TUBO DE RAYOS X.','                              ','/  /',' ','TRABAJO COORDINADO CON EL SERVICIO DE IMAGINOLOGÍA, PARTE SOLICITADA BAJO REPORTE ANTERIOR.','                              ','/  /','          ','JOSÉ CASTILLO.                ','',0,0,0,0,0,0,0,0,'07/05/2025 07:28:28 AM',' ',1,'2025-06-07','1'),(204,'CONTRATO','0527-2025','TRÁMITE          ',' ','M. CORRECTIVO','2025-04-07','38001','GESTIONADO MEDIANTE NOTA N° 2025-067-SBM-HST POR CONDUCTO DE LA DIRECCIÓN MÉDICA GENERAL.',' ','',' ',' ',' ',' ','RETORNO DE EQUIPO EVALUACIÓN CON DAÑO MAYOR.',' ','',' ','EMPRESA ENTREGA COTIZACIÓN PARA TRÁMITE DE REPARACIÓN.',' ','',' ',' JOSÉ CASTILLO.               ','',0,0,0,0,0,0,0,0,'07/05/2025 10:37:09 AM',' ',0,'',''),(205,'CONTRATO','0528-2025','EN TRÁMITE       ',' ','M. CORRECTIVO','2025-05-07','61498','GESTIONADO MEDIANTE NOTA N° 25-229-SBM-HST DEL 27/3/2025 POR CONDUCTO DE LA DIRECCIÓN MÉDICA GENERAL.','MARGARITA/PROMED              ','2025-05-07','          ',' ',' ',' ','SE APAGÓ DOS VECES, WATER  SUPPLY','LIC. MARTÍNEZ/SALA 20 TBC     ','2025-05-07','                ','',' ','',' ','JOSÉ CASTILLO.                ','',0,0,0,0,0,0,0,0,'07/05/2025 11:41:09 AM',' ',2,'','1'),(206,'CONTRATO','0529-2025','4200602634       ',' ','M. CORRECTIVO','2025-05-07','64242','GESTIONADO MEDIANTE ORDEN DE COMPRA N° 4200602634.',' ','',' ',' ',' ',' ','NO CARGA',' ','',' ','REPORTE DEL 21/04/2025 POR PARTE DE PERSONAL DE LA EMPRESA ENTREGADO A LA FECHA PARA CONTROL.',' ','',' ','JOSÉ CASTILLO.                ','',0,0,0,0,0,0,0,0,'07/05/2025 02:00:04 PM',' ',2,'',''),(207,'CONTRATO','0530-2025','4200602634       ',' ','M. CORRECTIVO','2025-05-07','64243','GESTIONADO SEGÚN ORDEN DE COMPRA N° 4200602634.',' ','',' ',' ',' ',' ','ERROR DE PROPULSOR',' ','',' ','REPORTE DEL 30/04/2025 POR PARTE DEL PERSONAL DE LA EMPRESA ENTREGADO A LA FECHA PARA SU CONTROL.',' ','',' ','JOSÉ CASTILLO.                ','',0,0,0,0,0,0,0,0,'07/05/2025 02:11:25 PM',' ',1,'',''),(208,'CONTRATO','0531-2025','4200602634       ',' ','M. CORRECTIVO','2025-05-07','64242','GESTIONADO MEDIANTE ORDEN DE COMPRA N° 4200602634.',' ','',' ',' ',' ',' ','REEMPLAZO DE TUBE LANCH PARK N/P 5392386',' ','',' ','PIEZA SOLICITADA EN REPORTE ANTERIOR.',' ','',' ','JOSÉ CASTILLO.                ','',0,0,0,0,0,0,0,0,'07/05/2025 02:17:32 PM',' ',2,'','1'),(209,'CONTRATO','0532-2025','4200602634       ',' ','M. CORRECTIVO','2025-05-07','64246','GESTIONADO MEDIANTE ORDEN DE COMPRA N° 4200602634 POR UN PERIODO DE 4 MESES.',' ','',' ',' ',' ',' ','REEMPLAZO DE BATTERY PACK, FIREFLY N/P 5770733/535000-2.',' ','',' ','PIEZAS SOLICITADAS BAJO REPORTES ANTERIORES.',' ','',' ','JOSÉ CASTILLO.                ','',0,0,0,0,0,0,0,0,'07/05/2025 02:24:17 PM',' ',1,'','1'),(210,'CONTRATO','0533-2025','4200602634',' ','M. CORRECTIVO','2025-05-07','64245','GESTIONADO MEDIANTE ORDEN DE COMPRA N° 4200602634.',' ','',' ',' ',' ',' ','REEMPLAZO DE CORD REEL WITH PLUG N/P 544444-2',' ','',' ','PIEZA SOLICITADA SEGÚN REPORTE ANTERIOR.',' ','',' ','JOSÉ CASTILLO.                ','',0,0,0,0,0,0,0,0,'07/05/2025 02:28:53 PM',' ',1,'','1'),(211,'CONTRATO','0534-2025','4200602634       ',' ','M. CORRECTIVO','2025-05-07','64244','GESTIONADO MEDIANTE ORDEN DE COMPRA N°4200602634. POR UN PERIDO DE 4 MESES.',' ','',' ',' ',' ',' ','REEMPLAZO DE CORD REEL WITH PLUG. N/P 544444-2',' ','',' ','PIEZA SOLICITADA SEGÚN REPORTE ANTERIOR.',' ','',' ','JOSÉ CASTILLO.                ','',0,0,0,0,0,0,0,0,'07/05/2025 02:32:54 PM',' ',1,'','1'),(212,'GARANTIA','0535-2025',' ','C51-2023 M       ','M. CORRECTIVO','2025-05-07','2324113304','EQUIPO RECIBIDO A SATISFACCIÓN EL 07/04/2025.','RESERMA                       ','2025-05-07','1:54 PM   ',' ',' ',' ','MENSAJE ERROR 195, TUBO FUERA DE POSICIÓN ','LIC. TATIANA/MAMOGRAFÍA       ','2025-05-07','12:41 PM        ','',' ','',' ','JOSÉ CASTILLO.                ','',0,0,0,0,0,0,0,0,'07/05/2025 02:36:43 PM',' ',1,'','1'),(213,'GARANTIA','0536-2025',' ','4200489552       ','M. CORRECTIVO','2025-05-07','119733','EQUIPO RECIBIDO A SATISFACCIÓN EL 10/08/2023.','DAYRA/HEALTHCARE PRODUCTS     ','2025-05-07','2:13 PM   ',' ',' ',' ','REVISIÓN Y REPARACIÓN','DRA. LLOYD/SALA DE PARTOS     ','2025-05-07','1:57 PM         ','',' ','',' ','JOSÉ CASTILLO.                ','',0,0,0,0,0,0,0,0,'07/05/2025 02:39:23 PM',' ',0,'','1'),(214,'CONTRATO','0537-2025','4200535878       ',' ','M. PREVENTIVO','2025-05-07','160427','EQUIPO RECIBIDO A SATISFACCIÓN EL 03/09/2024.',' ','',' ',' ',' ',' ','MANTENIMIENTO PREVENTIVO DE MAYO 2025.',' ','',' ','COORDINADO SEGÚN CRONOGRAMA Y DISPONIBILIDAD.',' ','',' ','JOSÉ CASTILLO.                ','',0,0,0,0,0,0,0,0,'08/05/2025 07:33:18 AM',' ',1,'','1'),(215,'CONTRATO','0538-2025','TRÁMITE          ',' ','M. CORRECTIVO','2025-05-08','71741-F','GESTIONADO MEDIANTE NOTA N°2025-067-SBM-HST POR CONDUCTO DE LA DIRECCIÓN MÉDICA.','CASTILLERO/ENDOSERVICE        ','2025-05-07','          ',' ',' ',' ','CONFIGURACIÓN DE IMPRESORA CON LOS BOTONES DE MANDO DE COLONOSCOPIOS 190. ','DR. BEITIA/COLOPROCTOLOGÍA    ','2025-05-07','                ','',' ','',' ','JOSÉ CASTILLO.                ','',0,0,0,0,0,0,0,0,'09/05/2025 07:35:10 AM',' ',0,'','1'),(216,'CONTRATO','0540-2025','EN TRÁMITE       ',' ','M. PREVENTIVO','2025-05-10','58240','GESTIONADO MEDIANTE NOTA N°25-128-SBM-HST POR CONDUCTO DE LA DIRECCIÓN MÉDICA GENERAL DEL 20/02/2025.',' ','',' ',' ',' ',' ','MANTENIMIENTO PREVENTIVO DE MAYO 2025',' ','',' ','COORDINADO SEGÚN CRONOGRAMA Y DISPONIBILIDAD.',' ','',' ','JOSÉ CASTILLO.                ','',0,0,0,0,0,0,0,0,'12/05/2025 07:28:17 AM',' ',1,'','1'),(217,'CONTRATO','0541-2025','EN TRÁMITE       ',' ','M. PREVENTIVO','2025-05-10','58239','GESTIONADO MEDIANTE NOTA N°25-128-SBM-HST POR CONDUCTO DE LA DIRECCIÓN MÉDICA DEL 20/02/2025.',' ','',' ',' ',' ',' ','MANTENIMIENTO PREVENTIVO DE MAYO 2025.',' ','',' ','COORINADO SEGÚM CRONOGRAMA Y DISPONIBILIDA.',' ','',' ','JOSÉ CASTILLO.                ','',0,0,0,0,0,0,0,0,'12/05/2025 07:29:43 AM',' ',1,'','1'),(218,'CONTRATO  ','0542-2025','4200602634','                    ','M. PREVENTIVO  ','2025-05-12','64244','GESTIONADO MEDIANTE ORDEN DE COMPRA N° 4200602634.','                              ','/  /','          ','                              ','          ','          ','PRUEBAS DE CONTROL DE CALIDAD.','                              ','/  /',' ','COORDINADO SEGÚN CRONOGRAMA Y DISPONIBILIDAD CON UNIDAD DE PROTECCIÓN RADIOLÓGICA Y EL EQUIPO.','                              ','/  /','          ','JOSÉ CASTILLO.                ','',0,0,0,0,0,0,0,0,'23/05/2025 11:56:23 AM',' ',1,'2025-05-12','1'),(219,'CONTRATO','0543-2025','EN TRÁMITE       ',' ','M. PREVENTIVO','2025-05-12','61498','GESTIONADO MEDIANTE NOTA N° 25-229-SBM-HST DEL 27/3/2025 POR CONDUCTO DE LA DIRECCIÓN MÉDICA GENERAL.',' ','',' ',' ',' ',' ','MANTENIMIENTO PREVENTIVO DE MAYO 2025.',' ','',' ','COORDINADO SEGÚN CRONOGRAMA Y DISPONIBILIDAD.',' ','',' ','JOSÉ CASTILLO.                ','',0,0,0,0,0,0,0,0,'12/05/2025 07:36:23 AM',' ',2,'',''),(220,'GARANTIA','0544-2025',' ','4200518131       ','M. PREVENTIVO','2025-05-12','120530','EQUIPO RECIBIDO A SATISFACCIÓN EL 04/12/2023.',' ','',' ',' ',' ',' ','MANTENIMIENTO PREVENTIVO DE MAYO 2025.',' ','',' ','COORDINADO SEGÚN CRONOGRAMA Y DISPONIBILIDAD.',' ','',' ','JOSÉ CASTILLO.                ','',0,0,0,0,0,0,0,0,'12/05/2025 07:44:42 AM',' ',0,'','1'),(221,'GARANTIA','0545-2025',' ','4200518131       ','M. PREVENTIVO','2025-05-12','120531','EQUIPO RECIBIDO A SATISFACCIÓN EL 04/012/2025.',' ','',' ',' ',' ',' ','MANTENIMIENTO PREVENTIVO DE MAYO 2025.',' ','',' ','COORDINADO SEGÚN CRONOGRAMA Y DISPONIBILIDAD.',' ','',' ','JOSÉ CASTILLO.                ','',0,0,0,0,0,0,0,0,'12/05/2025 07:46:14 AM',' ',0,'','1'),(222,'CONTRATO','0552-2025','02-2024          ',' ','M. CORRECTIVO','2025-05-09','400552','GESTIONADO MEDIANTE NOTA N°091223-SBM-HST POR CONDUCTO DE LA DIRECCIÓN MÉDICA GENERAL.',' ','',' ',' ',' ',' ','INSTALACIÓN DE LA TARJETA PCB.',' ','',' ','COORDINADO CON LA EMPRESA. PIEZA PENDIENTE DE INSTALAR BAJO REPORTES Y FALLAS ANTERIORES.',' ','',' ','JOSÉ CASTILLO.                ','',0,0,0,0,0,0,0,0,'12/05/2025 08:16:15 AM',' ',1,'','1'),(223,'CONTRATO','0553-2025','TRÁMITE          ',' ','M. PREVENTIVO','2025-05-13','63232','GESTIONADO MEDIANTE NOTA N° 25-090-SBM-HST POR CONDUCTO DE LA DIRECCIÓN MÉDICA GENERAL DEL 13/2/2025.',' ','',' ',' ',' ',' ','MANTENIMIENTO PREVENTIVO DE MAYO 2025',' ','',' ','COORDINADO SEGÚN CRONOGRAMA Y DISPONIBILIDAD.',' ','',' ','JOSÉ CASTILLO.                ','',0,0,0,0,0,0,0,0,'13/05/2025 07:36:33 AM',' ',1,'','1'),(224,'CONTRATO','0554-2025','EN TRÁMITE       ',' ','M. PREVENTIVO','2025-05-13','63219','GESTIONADO MEDIANTE NOTA N°25-213-SBM-HST POR CONDUCTO DE LA DIRECCIÓN MÉDICA GENERAL EL 21/03/2025.',' ','',' ',' ',' ',' ','PRUEBAS DE CONTROL DE CALIDAD.',' ','',' ','COORDINADO SEGÚN CRONOGRAMA Y DISPONIBILIDAD CON PERSONAL DE PROTECCIÓN RADIOLÓGICA DE LA INSTITUCIÓN.',' ','',' ','JOSÉ CASTILLO.                ','',0,0,0,0,0,0,0,0,'13/05/2025 07:38:45 AM',' ',2,'','1'),(225,'GARANTIA','0555-2025',' ','4200518460       ','M. PREVENTIVO','2025-05-13','160291','EQUIPO RECIBIDO A SATISFACCIÓN EL 17/07/2024.',' ','',' ',' ',' ',' ','MANTENIMIENTO PREVENTIVO DE MAYO 2025.',' ','',' ','COORDINADO SEGÚN CRONOGRAMA Y DISPONIBILIDAD.',' ','',' ','JOSÉ CASTILLO.                ','',0,0,0,0,0,0,0,0,'13/05/2025 08:16:28 AM',' ',0,'','1'),(226,'GARANTIA','0556-2025',' ','4200518460       ','M. PREVENTIVO','2025-05-13','160292','RECIBIDO A SATISFACCIÓN EL 17/07/2024.',' ','',' ',' ',' ',' ','MANTENIMIENTO PREVENTIVO DE MAYO 2025.',' ','',' ','COORDINADO SEGÚN CRONOGRAMA Y DISPONIBILIDAD.',' ','',' ','JOSÉ CASTILLO.                ','',0,0,0,0,0,0,0,0,'13/05/2025 08:20:58 AM',' ',0,'','1'),(227,'GARANTIA','0557-2025',' ','4200518460       ','M. PREVENTIVO','2025-05-13','160293','RECIBIDO A SATISFACCIÓN EL 17/07/2024.',' ','',' ',' ',' ',' ','MANTENIMIENTO PREVENTIVO DE MAYO 2025.',' ','',' ','COORDINADO SEGÚN CRONOGRAMA Y DISPONIBILIDAD.',' ','',' ','JOSÉ CASTILLO.                ','',0,0,0,0,0,0,0,0,'13/05/2025 08:22:37 AM',' ',0,'','1'),(228,'GARANTIA','0558-2025',' ','4200518460       ','M. PREVENTIVO','2025-05-13','160294','RECIBIDO A SATISFACCIÓN EL 17/07/2025.',' ','',' ',' ',' ',' ','MANTENIMIENTO PREVENTIVO DE MAYO 2025.',' ','',' ','COORDINADO SEGÚN CRONOGRAMA Y DISPONIBILIDAD.',' ','',' ','JOSÉ CASTILLO.                ','',0,0,0,0,0,0,0,0,'13/05/2025 08:25:06 AM',' ',0,'','1'),(229,'GARANTIA','0559-2025',' ','4200518460       ','M. PREVENTIVO','2025-05-13','160295','RECIBIDO A SATISFACCIÓN EL 13/05/2024.\r\n',' ','',' ',' ',' ',' ','MANTENIMIENTO PREVENTIVO DE MAYO 2025.',' ','',' ','COORDINADO SEGÚN CRONOGRAMA Y DISPONIBILIDAD.',' ','',' ','JOSÉ CASTILLO.                ','',0,0,0,0,0,0,0,0,'13/05/2025 08:29:14 AM',' ',0,'','1'),(230,'GARANTIA','0560-2025',' ','4200518460','M. PREVENTIVO','2025-05-13','160296','RECIBIDO A SATISFACCIÓN EL 17/7/2024.',' ','',' ',' ',' ',' ','MANTENIMIENTO PREVENTIVO DE MAYO 2025',' ','',' ','COORDINADO SEGÚN CRONOGRAMA Y DISPONIBILIDAD.',' ','',' ','JOSÉ CASTILLO.                ','',0,0,0,0,0,0,0,0,'13/05/2025 08:42:12 AM',' ',0,'','1'),(231,'GARANTIA','0561-2025',' ','4200518460       ','M. PREVENTIVO','2025-05-13','160297','RECIBIDO A SATISFACCIÓN EL 17/07/2024.',' ','',' ',' ',' ',' ','MANTENIMIENTO PREVENTIVO DE MAYO 2025.',' ','',' ','COORDINADO SEGÚN CRONOGRAMA Y DISPONIBILIDAD.',' ','',' ','JOSÉ CASTILLO.                ','',0,0,0,0,0,0,0,0,'13/05/2025 08:47:17 AM',' ',0,'','1'),(232,'CONTRATO','0562-2025','EN TRÁMITE',' ','M. PREVENTIVO','2025-05-13','61498','GESTIONADO MEDIANTE NOTA N° 25-229-SBM-HST DEL 27/3/2025 POR CONDUCTO DE LA DIRECCIÓN MÉDICA GENERAL.','MARICRUZ/PROMED               ','2025-05-13','7:22 AM   ',' ',' ',' ','NO ESTÁ PRODUCIENDO AGUA PARA AMBOS RIÑONES.','MIS MORÁN/HEMODIÁLISIS        ','2025-05-13','7:15 AM         ','',' ','',' ','JOSÉ CASTILLO.                ','',0,0,0,0,0,0,0,0,'13/05/2025 08:52:32 AM',' ',2,'','1'),(233,'CONTRATO','0563-2025','4200598718',' ','M. CORRECTIVO','2025-05-13','63177','GESTIONADO MEDIANTE ORDEN DE COMPRA N° 4200598718.',' ','',' ',' ',' ',' ','FUERTE OLOR A QUEMADO, VERIFICAR EQUIPO','LIC. PINEDA/RADIOLOGÍA        ','2025-05-13','                ','NO SE CONSIGUE LLAMADA, SE NOTIFICA VÍA CHAT A ENDER.',' ','',' ','JOSÉ CASTILLO.                ','',0,0,0,0,0,0,0,0,'13/05/2025 11:01:52 AM',' ',2,'','1'),(234,'CONTRATO','0564-2025','EN TRÁMITE       ',' ','OTROS','2025-05-13','61498','GESTIONADO MEDIANTE NOTA N° 25-229-SBM-HST DEL 27/3/2025 POR CONDUCTO DE LA DIRECCIÓN MÉDICA GENERAL.',' ','',' ',' ',' ',' ','TOMA DE MUESTRA',' ','',' ','COORDINADO SEGÚN DISPONIBILIDAD.',' ','',' ','JOSÉ CASTILLO.                ','',0,0,0,0,0,0,0,0,'13/05/2025 02:32:47 PM',' ',2,'','1'),(235,'CONTRATO','0565-2025','EN TRÁMITE       ',' ','OTROS','2025-05-13','61497','GESTIONADO MEDIANTE NOTA N° 25-229-SBM-HST POR CONDUCTO DE LA DIRECCIÓN MÉDICA DEL 27/03/2025.',' ','',' ',' ',' ',' ','TOMA DE MUESTRAS',' ','',' ','COORDINADO SEGÚN DISPONIBILIDAD.',' ','',' ','JOSÉ CASTILLO.                ','',0,0,0,0,0,0,0,0,'13/05/2025 02:33:45 PM',' ',1,'','1'),(236,'CONTRATO','0566-2025','EN TRÁMITE       ',' ','OTROS','2025-05-13','61496','GESTIONADO MEDIANTE NOTA N° 25-229-SMB-HST DEL 27/03/2025 POR CONDUCTO DE LA DIRECCIÓN MÉDICA GENERAL.',' ','',' ',' ',' ',' ','TOMA DE MUESTRAS',' ','',' ','COORDINADO SEGÚN DISPONIBILIDAD.',' ','',' ','JOSÉ CASTILLO.                ','',0,0,0,0,0,0,0,0,'13/05/2025 02:34:55 PM',' ',1,'','1'),(237,'CONTRATO','0567-2025','4200602634       ',' ','M. CORRECTIVO','2025-05-13','64243','GESTIONADO MEDIANTE ORDEN DE COMPRA N° 4200602634.',' ','',' ',' ',' ',' ','REEMPLAZO DE BATTERY PACK N/P 5770733.',' ','',' ','PARTE SOLICITADA EN BASE A REPORTE ANTERIOR.',' ','',' ','JOSÉ CASTILLO.                ','',0,0,0,0,0,0,0,0,'13/05/2025 02:36:38 PM',' ',1,'','1'),(238,'CONTRATO','0568-2025','420060263